"데이터 전송, -傳送, Data Transmission, DT",,전기 통신 매체를 통해서 전송되는 신호에 의하여 어떤 지점에서 다른 수신 지점에 데이터를 보내는 것. 데이터 전송도 하나의 컴퓨터와 다른 외부 장치(파일 서버 또는 컴퓨터) 사이에 데이터를 옮기는 데이터 전송(data transfer)의 한 방식이다.
"데이터 전송, -轉送, Data Transfer, DT",,"하나의 컴퓨터 내 어떤 장치에서 다른 장치로(예:디스크 구동 장치에서 임의 접근 기억 장치로) 데이터를 옮기거나 하나의 컴퓨터에서 다른 외부 장치(파일 서버 또는 다른 컴퓨터)로 데이터를 옮기는 것. 데이터를 옮기는 속도를 데이터 전송 속도(data rate 또는 data transfer rate)라고 한다. 순수 데이터 전송 속도(raw data rate)는 쉬는 시간(idle time), 오류 검사 절차 및 기타 오버헤드 때문에 실제로 의미 있는 데이터가 전송되는 속도보다 훨씬 빠르다. 데이터의 전송에 관련되는 장치나 거리에 따라서 여러 가지 모양으로 전송되는데, 표준적인 예로는 처리 장치와 기억 장치 사이에서는 단어(單語) 단위, 데이터 채널과 입출력 장치 사이에서는 바이트 단위, 통신 회선을 통하여 전송될 때에는 비트 단위 등이 있다."
"데이터 전송 단계, -傳送段階, data transfer phase",,"데이터 전송 회선을 통해 접속된 데이터 단말 장치 사이에서, 회선의 접속과 데이터 링크의 확립이 완료되어 정보 메시지를 전송하는 단계. 데이터 전송 제어 절차(data transmission control procedure)에서 회선의 접속, 데이터 링크의 확립, 정보의 전송, 데이터 링크의 종결, 회선 절단의 5단계로 규정하고 있는 과정의 제3단계를 말한다."
"데이터 전송 단말 설비, -傳送端末設備, terminal installation for data transmission",,데이터 전송에서 단말 측에 설치된 각종 장치의 총칭. 단말기만을 지칭하는 경우도 있다.
"데이터 전송 단말 장치, -傳送端末裝置, data transmission terminal equipment",,데이터 신호를 전송하기에 적합한 전기적인 신호로 변환하거나 복원하는 장치. 변복조기(모뎀)가 이에 해당된다.
"데이터 전송 레지스터, -傳送-, data transfer register",,컴퓨터 내에서 일시적으로 데이터의 교환 또는 이동을 해 주는 레지스터.
"데이터 전송로 변환기, -傳送路變換器, data channel converter",,"회선을 유용하게 이용하기 위하여 교류 방식의 저속 데이터 전송 회선을 주파수별로 다중화하는 장치. 예를 들면, 4선식 200bps 6회선을 음성 대역으로 다중화하는 장치가 있다."
"데이터 전송 서비스, -傳送-, data transmission service",,"전기 통신 주관청 또는 공중 전기 통신 사업자가 그들의 전기 통신 설비를 이용하여 원격지의 컴퓨터 간에 데이터를 전송하는 서비스. 회선 교환 데이터 전송 서비스, 패킷 교환 데이터 전송 서비스 및 전용선 데이터 전송 서비스로 분류된다."
"데이터 전송 속도, -傳送速度, data transfer rate",,"대응하는 장치 간에 전송되는 데이터의 단위 시간당 비트 수, 바이트 수 또는 블록 수의 평균치. 단위 시간은 초, 분, 시간으로 하는데 예를 들면 2,400비트/초(bps:bits per second)와 같이 표시한다. 비트 수로 표시할 때는 비트 전송 속도(bit transfer rate), 자수로 표시할 때는 문자 전송 속도(character transfer rate), 블록 수로 표시할 때는 블록 전송 속도(block transfer rate)라고 한다."
"데이터 전송 인터페이스, -轉送-, data transfer interface",,"컴퓨터와 하드웨어 장치를 상호 접속하여 상호 간에 정보가 전송될 수 있게 하는 플러그, 접속기, 카드 또는 기타 형태의 하드웨어 인터페이스. 예를 들면, RS-232나 스카시(SCSI)는 컴퓨터와 인쇄기, 하드 디스크 등의 장치 간 또는 데이터 단말 장치(DTE)와 데이터 회선 종단 장치(DCE) 간의 데이터 전송 인터페이스로 미국 전자 공업 협회(EIA)와 미국 표준 협회(ANSI)가 표준화한 데이터 전송 인터페이스이다."
"데이터 전송 제어, -傳送制御, data transfer control",,"데이터 전송에서 제어 정보, 형식화, 핸드 셰이킹 절차의 3요소에 의한 제어. 형식화는 특정 정보에 대한 전송 블록 내에 각 정보를 위한 필드 또는 공간을 마련한다. 제어 데이터와 전송 오류 검사용 데이터는 전송 블록 내에 포함되어야만 한다. 이들을 보통 블록의 표제부(header), 본체(body), 끝 부분(tailer)이라 부른다."
"데이터 전송 제어 절차, -傳送制御節次, data transmission control procedure",,시스템의 한 부분에서 다른 부분으로 데이터를 전송하는 것을 제어하는 절차.
"데이터 전송 트랩, -傳送-, data transmission trap",,"특수한 입출력 루틴과 연관된 프로그램들 간에 신호를 전달하거나 통신할 수 있도록 하기 위해, 자동적으로 조건에 따라 어떤 특정한 주소 부분으로 건너뛰기(프로그램에 의하지 않고)하는 것."
"데이터 전송 품질, -傳送品質, data transmission quality",,"데이터 통신 송수신 서비스에서 전송계가 사용하는 조건에서 데이터를 전송하고 재현하는 정도를 정량적으로 표현하는 것. 그 척도로는 오류율, 반복률, 유효 데이터 전송 속도 등이 있으나, 대체로 오류율이 이용된다."
"데이터 전송 효율, -傳送效率, data transmission efficiency",,"일정 시간 내에 데이터 전송계의 전 입력 정보량(전송 제어, 오류 제어 및 재송신 정보 등을 포함)에 대한 유효한 데이터 출력 정보량의 비율. 즉, 다음과 같은 식으로 나타낼 수 있다&nbsp;"
"데이터 전화기, -電話器, data telephone",,"기존 전화 이용 서비스 외에도 다이얼 번호의 모니터 표시, 재다이얼 기능 및 스피커에 의한 음성 수신 기능 등의 추가로 범용적 데이터 통신을 할 수 있도록 만든 전화기."
"데이터 접근, -接近, data access",,필요한 데이터의 집합을 검색하거나 위치를 찾아내는 과정.
"데이터 접근 객체, -接近客體, Data Access Object, DAO",,"마이크로소프트 액세스(Access)나 비주얼베이직(VisualBasic) 등과 같은 독립 환경에서 로컬 데이터베이스(DB)를 다룰 때 주로 사용하는 마이크로소프트 최초의 객체지향형 DB 응용 프로그램 인터페이스(API). 데이터베이스 작업에 필요한 접근 방식(mechanism)을 구현하는 것으로 데이터 소스에 대한 커넥션 정보가 있으며, 데이터의 생성, 수정, 삭제 등 대부분의 질의어(query)가 이곳에서 정의된다. DAO는 클라이언트로 하여금 데이터 소스 세부 구현을 알 필요가 없도록 해주며, 데이터 소스의 타입과는 상관없이 항상 클라이언트에 단일한 API를 제공한다. 최근에는 DAO 대신 프로그래밍이 쉽고, 더 빠른 ADO(ActiveX Data Objects)와 OLE DB를 주로 사용한다."
"데이터 접속기, -接續器, data connector",,고객이 소유하는 모뎀이나 데이터 세트를 보통의 전화선에 연결할 수 있도록 한 장치. 회선에 공급되는 전원을 제어하고 망의 제어나 신호 기능을 공급한다.
"데이터 접속 언어, -接續言語, Data Access Language, DAL",,"매킨토시 컴퓨터로 DAL 지원 데이터베이스나 비 애플 컴퓨터에 접속할 수 있는 데이터베이스 접속 언어. ANSI 표준의 레벨 1의 구조화 조회 언어(SQL)에 기초한 데이터베이스 조작 언어로서, 멀티벤더 시스템에 대응해 통일된 정보 접속 구조를 제공한다. DAL은 DB2, ORACLE, SY베이스, RDB, CA-DATACOM/DB 등의 주요 SQL 기반의 데이터베이스 관리 시스템을 지원하고 있으며, 모든 매킨토시에서 이용 가능하다."
"데이터 접속 장치, -接續裝置, Data Access Arrangement, DAA",,"공중 교환 전화망(PSTN)에 접속하기 위한 컴퓨터 모뎀. 전화 회선 인터페이스 모듈이라고도 부른다. 전화 회선의 고전압과 분리하도록 되어 있고, 컴퓨터 주기판(마더보드)에 설치하는 경우도 있지만 모뎀에 설치하는 것이 더 많다."
"데이터 정당성, -正當性, data validity",,"정당성의 척도 또는 관계. 예를 들면, 중복 점검 또는 금지 부호 점검과 같이 데이터에 대해서 수행되는 특수한 시험의 결과들이 있다. 이러한 시험과 결과는 데이터의 신뢰성을 입증하며 데이터의 정당성 또는 수용성의 정도를 나타낸다."
"데이터 정리, -整理, data reduction",,"가동되지 않은 원시 자료에서 필요없는 부분을 제거하여 유용하고 요약되거나 간단한 정보로 변환하는 것. 변환 과정에서 조정하기, 편집, 정렬 등이 사용된다."
"데이터 정의명, -定義名, Data Definition name, DD name",,"데이터 정의문에 붙여지는 이름. 이용자는 프로그램 도중에 사용하는 데이터 집합을 데이터 정의문으로 정의한다. 데이터 처리 시스템은 이 이름을 사용하여 데이터 제어 블록(DCB)과 대응하고, 이 블록에서 데이터 집합에 접근하기 위해 필요한 정보를 얻는다."
"데이터 정의문, -定義文, Data Definition statement, DD statement",,특정 작업 단계에 관련된 데이터 집합을 설명하는 작업 제어 문장. 작업 단계가 필요로 하는 데이터의 프로그램 내부 기술과 이 작업 단계에서 실제로 갖추어져 있는 외부 데이터 집합과의 관련 붙임을 한다.
"데이터 정의 언어, -定義言語, Data Definition Language, DDL",,"데이터베이스에서 데이터와 데이터간의 관계를 정의하여 데이터베이스 구조를 설정하는 SQL(구조화 조회 언어)문. 데이터베이스, 테이블, 필드, 인덱스 등 객체(Object)를 생성하고(CREATE), 제약을 걸며, 변경하거나(ALTER) 삭제하는(DROP) 등 응용 프로그램과 데이터베이스 관리시스템간의 인터페이스인 쿼리(query)에 사용되는 SQL문이다. 외부 스키마 명세를 정의하고, 데이터베이스를 정의, 수정하며, 스키마에 사용되는 제약조건에 대한 명세를 정의하고, 데이터의 물리적 순서를 규정하며, 수행된 결과는 데이터 사전(data dictionary)이라는 여러 개의 파일과 테이블로서 저장된다."
"데이터 정화, -淨化, data cleansing",,"①데이터베이스의 불완전 데이터에 대한 검출ㆍ이동ㆍ정정 등의 작업. 데이터베이스의 데이터 정화뿐만 아니라 다른 데이터베이스로부터 들어온 이종 데이터에 대한 일관성을 부여하는 역할을 한다. 데이터 정화 작업에는 알고리듬, 규칙, 룩업 테이블과 수작업에서 작업 오류로 나타난 태스크를 사용한다. ②복수 배열 독립 디스크(RAID) 시스템에서 드라이브 동기를 위한 패리티 비트 오류 정정 기능."
"데이터 조작 처리, -操作處理, data manipulation",,"데이터의 분류, 갱신, 변경, 첨가, 제거, 입출력 동작, 보고서 작성, 정렬 등과 같은 데이터 처리 작업."
"데이터 조작 처리 언어, -操作處理言語, Data Manipulation Language, DML",,"데이터베이스에 저장된 자료를 검색, 삽입, 삭제, 갱신, 재구성하기 위해 사용되는 언어. 크게 응용 프로그램을 작성하는 코볼이나 PL/1 등의 호스트 언어에 포함되어 사용되는 것과, 사용자가 대화식으로 단말기를 통해 직접 사용하는 것으로 구별할 수 있다. 전자를 데이터 종속 언어라 하고 후자를 질의 언어라 한다."
"데이터 종속성, -從屬性, data dependence",,"파일을 중심으로 한 자료 처리 시스템이 갖는 문제점 중의 하나로서 응용 프로그램과 데이터 간의 상호 의존 관계를 의미하는데, 데이터 구성 방법이나 구성 형식, 접근 방법이 변경되면 이에 관련된 응용 프로그램도 같이 변경되어야 하는 것."
"데이터 주도 공격, -主導攻擊, data driven attack",,"불법 프로그램을 이식하는 경우. 만약 포스트스크립트 파일을 전자 우편으로 보냈다면 수신자가 이를 인식 시 불법 명령들이 실행될 수 있고,침입 차단 시스템(firewall)을 이용한 서비스의 제한 등이 요구된다."
"데이터 주소, -住所, data address",,"데이터 기억 영역의 주소, 주기억 장치상의 주소, 자기 디스크 장치의 실린더 주소, 트랙 주소, 레코드 주소 등을 가리키는 말."
"데이터 중복 제거, -重複除去, Data deduplication",,"백업 파일 저장 시 중복된 부분을 제거한 후 저장하는 기술. 보통 백업 솔루션은 변경한 파일 전체를 다시 한 번 백업하는 것이 일반적이다. 때문에 1개 파일에서 한 단어가 A에서 B로 바뀌었다고 해도 전체 파일을 백업해야 한다. 데이터 중복 제거 기술을 이용하면 전체 파일을 다시 백업할 필요 없이 바뀐 단어와 그 위치만 백업하거나 같은 파일을 여러 명에게 전송했을 경우에 파일을 모두 저장하는 것이 아니라, 1개의 파일과 보낸 메일 정보만 저장하면 된다. 특히 이 기술의 장점은 전통적인 가상 테이프 라이브러리(VTL: Virtual Tape Library)나 디스크 어레이를 백업 타깃으로 활용하는 경우와 비교할 때 스토리지 자원을 10~50배 정도 효율적으로 활용할 수 있다는 점이며, 디스크에 데이터를 더 오랫동안 보관하고 디스크에서 직접 데이터를 복구하는 지점을 여러 개로 늘릴 수 있다는 점으로 백업의 신뢰성을 한 단계 높이고 백업 속도를 향상하며 빠른 복구를 가능하게 한다."
"데이터 중심 접근법, -中心接近法, data oriented approach",,"데이터 처리 시스템의 개발에서, 프로그램에 의한 처리 기능보다 데이터 구조의 설계와 관리를 우선으로 하는 시스템 개발 연구법."
"데이터 중심형 설계, -中心型設計, data structure-centered design",,어떤 시스템에서 취급되는 파일 구조의 분석에 의해서 그 시스템의 논리적 구조나 구성 요소의 상호 관계를 결정하는 설계 기법.
"데이터 즉시 접근도, -卽時接近圖, Data Immediate Access Diagram, DIAD",,사용자가 탐색이나 분류 없이 데이터 저장부로부터 검색할 수 있는 대상을 보여 주는 데이터 저장부로의 즉시 접근 통로도.
"데이터 지시자, -指示子, data pointer",,"①연산에 필요한 데이터가 기억된 장소, 또는 연산 결과가 기억될 장소를 가리키는 값. 기억 장치의 어떤 주소값이 된다. ②①과 같은 값을 갖고 있는 레지스터."
"데이터 지연, -遲延, data delay",,①다른 프로세스가 수행되기 전까지 지연되거나 기다려야 하는 시간. ②데이터 자체 내에서의 돌발 사태로 지연되는 것.
"데이터 집선 장치, -集線裝置, data concentrator",,"공용 데이터 전송로에, 동시에 사용 가능한 통신로 수보다 많은 데이터 단말 장치를 접속할 수 있도록 하는 단위 장치. 한 예로는 모뎀이 멀리 떨어진 여러 개의 장치를 담당하는 것이 있다. 하드 카피 인쇄기, 비디오 장치, 텔레 타이프 등도 있다. 경합을 근거로 한 동작이기 때문에 입출력은 선착순 방식이나 선택적 방식으로 운용한다."
"데이터 집합, -集合, data aggregate",,"①데이터베이스에서 어떤 형의 레코드 중 몇 개의 데이터 항목을 한데 묶어 이름을 붙인 것. ②개별적 또는 집합적으로 참조될 수 있는 2개 이상의 데이터 항목의 집합. 배열(array), 구조체(structure) 등이 있다."
"데이터 집합 무결성, -集合-無缺性, data set integrity",,"데이터베이스에서 데이터 집합(data set)의 공용 또는 배타 제어에 의하여, 복수의 이용자의 동시 사용으로 일어나는 혼란을 방지하고 데이터 집합을 정상 상태로 보전하는 것."
"데이터 집합 속성, -集合屬性, data set attribute",,"데이터 집합의 형식과 구조상의 성질을 표시하는 정보의 총칭. 데이터 집합 편성, 레코드 형식, 블록 길이, 레코드 길이 등이 있다."
"데이터 창고, -倉庫, Data Warehouse, DW","동의어 : 데이터 웨어하우스, 자료 창고","조직 내에서 분산 운영되는 각각의 데이터베이스 관리 시스템에 축적된 데이터들을 공통의 형식으로 변환하여 통합하고 조정·관리하는 데이터베이스 기술. 데이터(data)와 창고(warehouse)란 의미가 합성된 용어이다. 데이터 이외의 분석 방법도 포함하여 조직 내 의사 결정을 지원하는 정보 관리 시스템을 의미하기도 한다. 1980년대 중반 IBM은 자사 하드웨어를 판매할 목적으로 ‘정보 창고(information warehouse)’라는 용어를 처음 사용하였다. 이후 이 개념은 여러 업체들에 의해 이론적으로 성장하였고, 1980년대 후반 컴퓨터 과학자인 빌 인몬(Bill Inmon)이 기업 데이터 모델의 연구에서 데이터 창고(DW) 개념을 정의하면서 구체화되었다. 데이터 창고(DW)는 크게 관리 하드웨어, 관리 소프트웨어, 추출·변환·정렬 툴, 데이터베이스 마케팅 시스템, 메타데이터, 최종 사용자 접근과 활용 도구 등으로 구성된다. 원시 데이터 계층, 데이터 창고(DW) 계층, 클라이언트 계층으로 특화된 데이터뿐만이 아니라 기업 활동에 필요한 모든 정보를 전사 규모의 데이터베이스로 일원화하여 데이터 추출, 저장, 조회 등의 기능을 수행하기 때문에 대용량의 저장 공간이 필요하다. 이에 병렬 처리 컴퓨터가 주로 사용된다. 데이터 창고(DW)는 주제별 데이터 구성(subject-orientation), 시계열적(time-variancy) 데이터 축적, 일관된 형태로 데이터 통합(integration), 변경·삭제 등이 어려운 비휘발성(nonvolatilization) 저장 등의 특성이 있다. 기업의 분산된 대규모 정보 자산을 통합하여 효율적인 의사 결정을 지원하는 구조적 환경을 제공한다."
"데이터 채널, data channel",,"①컴퓨터 시스템에서, 주기억 장치와 주변 장치 간의 정보 이송을 위한 통신 채널. 입출력 채널(input/output channel)과 같은 의미이다. ②데이터 통신에서, 데이터 전송을 위한 통신 채널. 회선과 같은 의미이다."
"데이터 처리 센터, -處理-, data processing center",,"각종 컴퓨터 및 입출력 기기 등이 설치되어 있고, 설비와 그것을 운용하기 위해 필요한 요원을 포함한 사무실. 이 처리 센터에서는 각종의 계산 처리 업무를 도급 맡고, 컴퓨터로 처리하며 기업 내의 데이터 처리를 집중해서 실행한다."
"데이터 처리 장치, -處理裝置, data processor",,"①디지털 컴퓨터, 아날로그 컴퓨터, 계산기 등과 같이 데이터를 처리할 수 있는 장치. ②데이터 처리를 하는 사람. ③계산기, 카드 장치, 컴퓨터 보조기 등을 포함하는 데이터나 정보의 축소, 요약, 처리, 입출력을 할 수 있는 모든 장치를 나타내는 표준화 용어."
"데이터 초기화 설정문, -初期化設定文, data initialization statement",,원시 프로그램에서 사용되는 변수나 배열 요소 또는 배열에 초기값을 설정하기 위한 프로그램 문. 초기값은 목적 프로그램의 실행을 개시하기 전에 대입된다.
"데이터 초기화 조정, -初期化調整, data initiated control",,"데이터를 이용하여 외부로부터 신호나 메시지를 받자마자 미리 지정된 규칙에 따라 작업을 자동적으로 시작하고 수행하도록 하는 것. 예를 들면, 원거리 처리 응용에서의 작업은 원격 단말기로부터 받아서 수행된다. 원격 단말기의 데이터는 자료부로부터 프로그램의 실행을 시작하게 할 수 있으며, 프로그램은 데이터를 처리한 후 원거리 단말기에 적절한 응답을 한다."
"데이터 최고 책임자, -最高責任者, Chief Data Officer, CDO",,"기업에서 가치를 창출할 수 있는 양질의 데이터를 발굴하여 기업 자산으로 관리하고 활용할 수 있도록 데이터 통합 관리(data governance)를 총괄 담당하는 최고 임원. 기존 정보 최고 책임자(CIO: Chief Information Officer)와의 차이점은 CIO는 정보 시스템을 중심으로 정보 자원을 관리하고 비즈니스 활동을 하는 반면, 데이터 최고 책임자(CDO)는 방대한 빅데이터를 분석하고 비즈니스 전략에 맞는 데이터를 설계하는 등 데이터를 중심으로 비즈니스 활동을 한다. 또한 최신 정보통신기술(ICT) 기반으로 데이터를 전략적으로 활용할 수 있는 비즈니스 모델을 개발하여 이익 창출에 기여한다.CDO 직책은 2000년대 초반 비자(Visa), 캐피털원(Capital One) 미국 금융기관 등에서 생기기 시작했다. 이후 데이터양이 급격히 많아지고 중요성이 부각되면서 은행, 보험 회사, 공공기관 등에서 고객 정보, 기업 위기 관리 등을 위해 CDO를 임명하여 활용하고 있다. CDO는 조직에 따라 최고 경영 책임자(CEO) 직속 또는 정보 최고 책임자(CIO), 재무 담당 최고 책임자(CFO) 등의 직속으로 배정되어 있다. "
"데이터 추상화, -抽象化, data abstraction",,"하나의 데이터형과 관련된 조작들과 그 표현 형태를 결합하여 모아 두는 기법으로, 프로그래머에게 프로그램에서 사용되는 데이터의 구조와 조작을 효과적으로 사용할 수 있도록 잘 정리된 수단을 제공하는 것. 예를 들면, 일반 프로그램 언어에서 제공되지 않는 데이터형인 대기 행렬을 프로그램에서 사용할 때, 이에 따른 조작인 추가, 삭제, 비우기를 프로그래머가 프로그램에서 정의하여 하나의 데이터형으로 정의해서 사용하도록 하는 수단을 제공해 준다. 이로 인해 프로그램이 이해하기 쉽고 오류가 줄어드는 효과가 생긴다."
"데이터 추출, -抽出, data extract",,"데이터 집합에서 질의 처리를 통하여 분석에 필요한 일부 데이터 집합을 추출하는 절차. &nbsp;데이터 추출은 빅데이터 분석을 위해 다양한 데이터 저장소에서 필요한 데이터를 추출(extract)하고, 분석 도구에 맞는 형태로 변환(transform)하여 대상 시스템의 데이터 저장소에 올려놓는(load) ETL(Extract, Transform and Load) 과정의 첫 번째 단계이다. 정형 데이터는 정적인 데이터 소스에서 한 번에 데이터를 추출하는 전체 추출(full extraction) 방법과 센싱(sensing) 정보처럼 시간에 따라 데이터가 증가하는 경우 변경된 부분 만큼만 데이터를 추출하는 증분 추출(incremental extraction) 방법을 사용한다.&nbsp;반정형과 비정형 데이터에서 데이터를 추출하기 위해서는 데이터의 노이즈를 제거하고 질의 처리(query processing)가 가능한 형태로 구조화하는 등의 전처리 작업이 필요하다. 추출된 데이터는 개인식별정보(PII: Personally Identifiable Information)와 같은 민감한 정보를 포함할 수 있으므로 별도의 처리 방법을 마련해야 한다.&nbsp;&nbsp;* 관련 표준&nbsp;- ITU-T Y.3600 (Big data – Cloud computing based requirements and capabilities(11/2015)&nbsp;&lt; ETL 과정 &gt;"
"데이터 추출 언어, -抽出言語, Data Extraction Language, DEL",,"다양한 데이터 형식을 확장성 마크업 언어(XML)로의 변환 과정을 기술하기 위한 XML 기반 언어. DEL 스크립트로 입력 데이터로부터 객체들의 배치 및 추출 방법과 추출 객체들의 XML 형식 내의 삽입 위치를 정하며, DEL 스크립트를 수행하는 DEL 프로세서는 새로운 XML 문서를 생성하거나 XML 경로 언어(XPath) 표현이 있는 위치에서 새로운 요소와 속성을 만들어 기존 XML 문서를 변경하기 위해 추출 데이터를 사용한다."
"데이터 취득, -取得, data acquisition",,"데이터 입력 장치에 의해 처리 데이터를 받아 이것을 디지털 정보로 변환하며, 회계나 감독에 사용되는 레코드나 실험 자료의 레코드를 제공하기 위하여 인쇄해 주기도 하는 것."
"데이터 카트리지, data cartridge",,대용량 기억 시스템 등의 데이터 매체. 카트리지라고도 한다.
"데이터 캡, Data Cap",,"서비스 수준 협약(SLA: Service Level Agreement)에 의해 트래픽 소스와 목적지 사이에 계약된 총 트래픽 양의 상한. 유‧무선 인터넷 트래픽 급증, 통신시장의 성장 정체, 플랫폼을 중심으로 한 생태계 형성 및 경쟁, 모바일 인터넷 전화(mobile VoIP)와 통신 대체 서비스의 확산 등의 요인으로 이용량에 기반한 요금제의 필요성 증대와 함께 과도한 트래픽에 대한 '접속차단', '트래픽 관리'와 같은 정책이 요구된다."
