"듀얼 라이선스, Dual License",,"상업용 라이선스와 오픈소스 SW 라이선스를 조합하거나 오픈소스 SW 라이선스들을 조합해 제공하는 복수의 라이선스. 공개 SW 대표 라이선스 체계인 GPL 하에서 '커뮤니티 에디션'은 무료로 제공하고, 상용 버전인 '엔터프라이즈'는 유료로 제공해 유·무료 정책을 동시에 운영하는 것이다. 대표적인 예로 데이터베이스 관리 시스템(DBMS)인 'MySQL'이 있다."
"듀얼레이어, 二層記錄, Dual Layer, DL",,"정보를 저장할 수 있는 층이 디스크 한 면에 2층인 광저장 매체. 저장할 수 있는 정보량도 2배로서 일반 싱글레이어 DVD가 4.7Gb인데 비하여 듀얼레이어는 8.5Gb의 데이터를 저장한다. DVD의 앞뒤 양면이 듀얼레이어인 경우에는 총 4개 층에 데이터를 기록할 수 있다. 플레이어가 2 개층 모두를 읽기 위해 앞의 층은 반투명으로 제작되며, 레이저의 렌즈 초점을 각 층에 맞도록 조절하여 읽게 된다. 듀얼레이어 디스크는 디스크 표면색이 금색이므로 육안으로도 쉽게 싱글레이어와 구분할 수 있다."
"듀얼 레이어 레코딩, Dual Layer Recording, DLR",,"DVD-R, DVD+R 등 디지털 비디오 디스크(DVD) 매체에서 한 면의 기록층이 2층 구조로 되어 있어 기존 싱글레이어 DVD보다 2배 가량(면당 8.5GB 정도)의 용량을 기록할 수 있는 것."
"듀얼 밴드, dual band",,"하나의 무선 단말기로서 두가지 무선 주파수대를 선택하여 사용할 수 있는 기능. CDMA 휴대폰의 경우에는 800MHz대와 1,900MHz대 모두에서 사용될 수 있는 단말기의 기능이다. 동일 사업자가 두 주파수의 시스템을 운영할 경우 사용 가능하다."
"듀얼밴드 듀얼모드, Dual Band Dual Mode, DBDM",,"하나의 무선 단말기로서 두 가지 시스템 방식을 선택하여 사용할 수 있는 기능. CDMA 도입 초기에는 아날로그 AMPS 방식과 CDMA 방식을 선택 사용할 수 있는 기능이 필요했고, 최근에는 동기식 cdma2000과 비동기식 WCDMA의 겸용, 또는 GSM과 WCDMA의 겸용 단말기가 개발되고 있다."
"듀얼 뷰, Dual View",,"한 대의 텔레비전으로 서로 다른 두 개의 콘텐츠를 볼 수 있게 하는 기능. 능동 유기 발광 다이오드(AMOLED: Active Matrix Organic Light Emitting Diode)와 셔터 안경(shutter glasses) 기술을 응용해 하나의 텔레비전으로 두 개의 화면을 볼 수 있게 만든 기술이다. 특히, 동시 발광 구동(SEAV: Simultaneous Emission with Active Voltage) 기술을 적용하면 3차원 텔레비전(3DTV)의 화면 겹침 현상과 어지럼증을 해결할 수 있다."
"듀얼 스크린 듀얼 플레이, Dual Screen Dual Play",,스마트 폰 화면을 TV에서 보는 미러링 기능. TV와 스마트폰에서 각기 다른 화면을 보여줄 수도 있다. TV에 슬라이드를 띄워놓고 스마트폰에서는 슬라이드 노트를 보는 게 가능하다.
"듀얼 스택 라이트, Dual Stack Lite",,"네트워크 장비 하나에서 IPv4와 IPv6 인터넷 주소 체계를 동시에 지원하는 기술. 기존 듀얼 스택이 서로 다른 IP 주소 체계 간 통신을 위해 두 번의 주소 변환이 필요했지만 듀얼 스택 라이트(DS-Lite, dual stack lite)는 터널링(Tunneling)이라는 기술을 이용해 임시 주소 체계를 부여함으로써 변환 과정을 한 번만 거치면 된다. 듀얼 스택 기술 연장선에 있지만 간편해졌다는 뜻에서 라이트를 붙였다."
"듀얼 스택 모바일 IPv6, Dual Stack Mobile IPv6, DSMIPv6",,단말과 네트워크에서 IP 버전 4(IPv4)와 IP 버전 6(IPv6)를 동시에 지원하는 방식. 이동 통신망의 다양화로 IPv6 채택이 확대되고 이동성 지원이 핵심 기술로 부각되면서 기존의 IPv4망까지도 이동성 지원이 필요하여 DSMIPv6을 채택하고 있다.&nbsp;
"듀얼 스트림 3DTV, Dual stream 3DTV",,"좌우 영상을 두 개의 스트림으로 구성하여 전송하는 3차원(3D) 영상 포맷. 좌영상은 MPEG-2(약 12Mbps), 우영상은 AVC(약 6Mbps) 방식으로 압축하여 전송하기 때문에 하나의 스트림으로 전송하는 사이드 바이 사이드 (side-by-side) 방식 보다 고화질의 영상을 구현할 수 있다. 기존 2DTV를 보유한 가정에서는 좌영상만으로 DTV를 시청하고, 3DTV 수상기를 보유한 가정에서는 두 개의 스트림을 디코딩하여 3D영상을 시청할 수 있다.&nbsp;"
"듀얼 심 휴대 전화, -携帶電話, dual SIM portable phone",,"휴대 전화 1대로 2개의 전화번호를 동시에 사용할 수 있는 휴대 전화. 휴대 전화에 2개의 가입자 식별 모듈 카드(SIM card, 심 카드)를 넣어 단말기 하나로 2개의 번호를 사용할 수 있다. 특히 전화와 문자 메시지는 물론 무선 통신 등의 동시 수신이 가능한 것이 장점이다."
"듀얼 인라인 메모리 모듈, Dual In-Line Memory Module, DIMM",,"DIMM이라는 이름은 단자가 기판의 양측에 있는 것에서 유래되고 있다. 72핀 SIMM(single in-line memory module)에서는 양측 모두 동일 신호선이 설치된 반면, DIMM에서는 양측에 다른 신호선이 설치되어 있다. DIMM은 SIMM에 비해 탑재되어 있는 메모리 규격 등이 변경된 것이 있으므로 증설할 때는 주의해서 선택해야 한다. DIMM은 탁상형 PC에 사용되는 168핀의 것과 노트북형 PC 등에 사용되는 특수 형상의 것으로 분류된다. 노트북형 PC용의 것은 여러 가지인데 각각의 노트북 PC 전용이 된다. 탁상형에 이용되는 168핀 DIMM은 72핀 SIMM(single in-line memory module)보다 약간 긴 모양이다. 일반적으로 DIMM이라 하면 168핀의 것을 말하는데, 펜티엄 II와 같이 64비트로 입출력이 되는 중앙 처리 장치(CPU)에서는 64비트 출력을 가진 DIMM이 채용된 것이 많다. 이것은 32비트 출력만 있는 SIMM이 2장 단위로 증설이 필요한 반면, DIMM에서는 1장 단위로 증설할 수 있기 때문이다."
"듀얼 코어, dual core",동의어 : 이중 코어,"물리적으로 두 개인 프로세서 코어를 하나로 통합, 집적화한 것. 겉보기에는 하나의 중앙 처리 장치(CPU)로 보이지만, 실제로는 두 개에 해당하는 강력한 것으로 향후 프로세서 로드맵에 있어 기반 기술로 기대된다. 한국 IBM사의 파워5, 한국 선 마이크로시스템스사의 스팍 4, 한국 휼렛 패커드(HP)사의 PA8800이 이 방식을 채택하고 있다. 듀얼 코어 프로세서는 물리적으로는 두 개이지만 용도에 따라서는 하나로 볼 수도 있어 프로세서당으로 적용하는 소프트웨어 라이선스 정책에 혼선을 주고 있다."
"듀얼 콜, dual call",,기본 호출 번호 외에 별도의 호출 번호를 하나 갖고 있어 호출음의 패턴으로(예:삐삐삐와 삐-삐-삐) 어느 쪽에서 온 것인가(예:집과 회사)를 식별할 수 있는 서비스. 이원 호출이라고도 한다.
"듀얼 포맷 플레이어, dual format player",,차세대 영상 저장 장치의 양대 기술인 블루 레이 디스크와 고선명 DVD(HD DVD)를 모두 지원하는 플레이어. 블루 레이와 HD DVD는 게임·영화 등 멀티미디어 콘텐츠를 풀 HD 영상으로 구현할 수 있는 차세대 영상 저장 장치이다. 그러나 콘텐츠 제작 업체인 영화사와 저장 장치 제조업체들이 블루 레이와 HD DVD 진영으로 나뉘어 차세대 저장 장치 기술의 주도권을 놓고 치열한 경쟁을 벌이고 있다. 따라서 듀얼 포맷 플레이어는 이처럼 양대 기술의 혼전 양상에서 시장의 접합점을 제공한다는 점에서 의미가 있다.
"듀얼 플레이트 유기 발광 다이오드 디스플레이, -有機發光-, Dual plate Organic Light Emitting Diode Display, dual plate OLED display, DOD",동의어 : 듀얼 플레이트 방식,"박막 트랜지스터(TFT) 기판에 직접 유기 전기 발광 다이오드(OLED)를 형성하는 기존 방식과 달리 하부의 TFT 기판과 상부의 OLED 기판을 각각 제작한 후 전기적으로 결합시키는 능동 유기 발광 다이오드(AMOLED) 디스플레이 제작 방법. 듀얼 플레이트 방식(DOD) 기술 도입으로 아몰포스실리콘(a-Si: amorphous silicon) 방식의 AMOLED TV가 대형화하기 어렵다는 단점을 극복했으며, 확장 그래픽스 어레이(XGA)급 해상도에 80% 색 재현율, 상하좌우 170도의 시야각을 구현할 수 있게 되었다."
"듀얼 호밍, -方式, dual homing",,광섬유 분산 데이터 인터페이스(FDDI)에서 라우터나 호스트에 추가적인 덧붙임 기능을 제공하여 망 운용을 보장할 수 있도록 도와주는 장애 허용 기술. 이 방식에서는 라우터나 호스트가 회로 교환 장치인 두 집선기에 연결되어 있어서 하나가 능동 상태에 있으면 다른 하나는 수동 상태로 된다. 수동 상태의 집선기는 다른 집선기에 장애가 발생할 때까지 예비 모드로 대기해 있다가 장애가 발생하면 자동적으로 수동 상태에서 능동 상태로 변한다.
"드라마 쇼핑, Shopperama",동의어 : 쇼퍼라마,"쇼퍼(Shopper)와 드라마(Drama)의 합성어로 드라마를 보며 화면에 나오는 제품을 쇼핑할 수 있는 새로운 콘텐츠. 드라마 화면창 옆에는 해당 장면에 나온 옷과 액세서리, 휴대 전화 같은 상품에 대한 이미지와 가격이 제시된다. 이에 따라 드라마를 보는 소비자들이 관련 이미지를 클릭하여 상품에 대한 상세한 설명을 볼 수 있고, 곧바로 살 수 있다."
"드라이스톤, dhrystone",,"마이크로프로세서의 성능을 테스트하기 위한 벤치마크 테스트 방법 중 하나. 드라이스톤은 여러 종류의 마이크로프로세서의 성능을 필요 항목별로 비교하여 벤치마크 테스트할 수 있으며, SPEC(Systems Performance Evaluation Cooperative)에서 개발한 프로세서 성능 측정 방법이다."
"드라이 카퍼, dry copper",,"가입자용 동선(銅線) 케이블을 전송 매체 그대로 사용자에게 대여해 주는 임대 형태의 선로. 즉, 드라이(dry)는 전기 신호가 통하지 않은 상태로, 대여자(업체)는 케이블을 자유롭게 통신에 이용할 수 있다. 다만, 높은 주파수나 고속 통신을 이용하면 동일 케이블 내 인접 회선에 간섭 등의 방해를 주게 되므로 전송 조건은 엄격하게 규정되어 있다. 우리나라에서는 정보통신부에서 기준을 제정, 통신 사업자(드라이 카퍼 대여 사업자)에게 실시토록 하고 있는데, 접속점은 주배선반(MDF)으로 되어 있다. 따라서 회선 대여업을 하는 사업자는 한국통신, LG텔레콤, 온세텔레콤 등 통신 사업자로부터 임대 조건에 따라 드라이 카퍼를 임차, 일반 가입자가 필요로 하는 회선을 구성하여 대여해 준다. 이 경우 전기 통신 사업자와 회선 대여업자 간에 접속점에서 접속료 및 기타 회선 장애 시 다툼이 발생하기도 한다."
"드로퍼, Dropper",,자기 자신을 복제하는 바이러스 코드는 없지만 실행할 때 바이러스를 불러와 전파할 수 있는 악성 실행 파일. 컴퓨터를 쓰는 사람이 알 지 못하는 순간에 바이러스나 트로이 목마 프로그램을 사용자 컴퓨터에 설치하는 악성 프로그램이다. 한 번 감염되면 악성 코드 수십 개를 생성하는 '멀티 드로퍼(Multi Dropper)'로 악화되고 있어 주의해야 한다.
"드로퍼 인서터, Dropper-Inserter, DI",,"임의의 순방향-역방향 간 공통 통신로를 시험하기 위한 장치. 분기/삽입 기능을 가지고 있다. 드로퍼 인서터(DI)는 시분할 통화로 접속 장치(TDC)에 있는 임의의 공통 통신로를 선택, 임의의 채널에 대하여 디지털 데이터를 추출하여 보전 스위치(MSW)에 보낸다. 또 MSW로부터 디지털 데이터를 받아 임의의 채널에 삽입하여 TDC에 보낸다."
"드롭다운 메뉴, drop-down menu",,"컴퓨터 대화 상자에 표시된 주 차림표(main menu)를 선택하면 주 차림표에 들어 있는 하위 차림표(menu)들이 아래로 나란히 배열되어 나타나는 형태의 차림표 표시 방식. 마우스로 주 차림표를 클릭한 후 아래로 끌기를 하여 원하는 하위 차림표에서 버튼을 놓거나, 주 차림표를 클릭한 후 하위 차림표를 클릭함으로써 해당 하위 차림표를 선택할 수 있다. 주 차림표를 선택하지 않는 한 하위 차림표는 화면에 표시되지 않는다."
"드롭아웃 컬러, drop-out color",,광 문자 판독기(OCR)나 광 마크 판독기(OMR)에서는 판독되지 못하고 인간의 눈으로만 판독될 수 있는 색. OCR이 판독 문자 가까이에 주의 사항을 인쇄하거나 OMR 마크 판독을 위한 마크 존(mark zone)을 지정하는 것 등에 사용된다.
"드롭 온디맨드형 잉크 분사 인쇄기, -型-噴射印刷機, Drop on demand inkjet printer, DOD inkjet printer",,"필요할 때만 잉크 입자를 날려보내는 잉크 분사 방식의 인쇄기. 정상적으로 잉크 입자를 날려서 입자의 전하에 의해 켜거나 끄는 하전 제어 방식에 비하면 인쇄 속도는 느리지만 구조가 간단하기 때문에 소형화하기 쉽다. 소형 개인용 컴퓨터(PC)용 잉크 분사 인쇄기, PC나 문서 처리기에 내장되어 있는 인쇄기의 대부분은 주문형(온디맨드)이다. 해상도는 300/720dpi정도이며, 구동 방식은 압전체(壓電體)의 수축으로 잉크를 토해내는 방법과 잉크에 열을 가해서 기포를 일으켜 잉크를 토해내는 방식이 있다."
"드 모르강의 법칙, -法則, law of De Morgan",,논리 대수의 기본 정리의 하나. 다음 2가지 논리식으로 표현된다.
"드 모르강의 정리, -定理, De Morgan`s theorem",,"논리 대수 성질의 하나로서, 여러 논리 변수의 논리합 전체를 부정(NOR)하면 그것은 원래의 논리 변수를 각각 부정한 것을 논리곱한 것과 같고, 또 여러 논리 변수의 논리곱 전체를 부정(NAND)하면 그것은 원래의 논리 변수를 각각 부정한 것을 논리합한 것과 같다는 것을 나타낸 정리. 이것을 이용하면 어떠한 논리 회로도 NAND와 NOR를 사용하여 간략하게 나타낼 수 있다. 이 정리를 이론식으로 표시하면 다음과 같이 나타낼 수 있다."
"드보락 키보드, Dvorak keyboard",,영문 타자기와 컴퓨터 키보드 배열의 한 가지인 드보락형의 키보드. A.드보락(August Dvorak)과 W. 딜리(William Dealey)에 의하여 1936년 당시 널리 보급되어 있던 쿼티 키보드(QWERTY keyboard)의 대안으로서 개발된 키보드이다. 영어에서 빈번하게 사용되는 문자를 손쉽게 타자(입력)할 수 있도록 배열함으로써 타자 속도를 높이도록 고안되었다. 또 자주 순서적으로 나타나는 한 쌍의 문자는 각각 다른 손으로 교대로 칠 수 있게 분할 배치되었다. 1982년에 미국 표준 협회(ANSI)에서 쿼티 키보드의 대체 표준으로 채택하였으나 쿼티 키보드만큼 보급되어 있지 않다.&nbsp;
"드웰 클릭 소프트웨어, dwell click software",,마우스의 클릭을 대신하는 프로그램. 마우스 클릭이 곤란한 사람이 아이콘이나 메뉴에 잠시 머무르기만 해도 클릭되는 솔루션이다.
"들여쓰기, indent",,문서나 프로그램을 작성할 때 문단의 시작 부분을 들어가게 쓰는 것. 왼쪽을 나란하게 똑같이 쓰면 문단의 시작 부분을 알 수 없어 가독성이 떨어지므로 의미를 명확하게 표현하기 위해서 왼쪽 끝에서 일정한 간격을 벌려 오른쪽으로 이동하여 쓰는 것을 말한다. 일반적인 문서 처리기(word processor)에는 소프트웨어적인 기능으로 설정되어 있다.
"들여오기, import",,다른 컴퓨터 시스템으로부터 자기의 시스템 안에 데이터 등을 들여놓는 행위.
"들여오기 필터, import filter",,해당 프로그램의 본래 형식이 아닌 데이터를 읽어 들여오는 기능. 보통 파일명으로 파일을 선택하기 전에 먼저 파일 형식을 정의해야 하는데 들여오기 필터를 사용하면 정의된 파일명이 아닌 파일을 열 수 있다.
"등가 4선 방식, 等價四線方式, equivalent four wire system",,1조 1심의 동축 케이블을 사용하여 상하 양방향의 신호를 고군 및 저군의 주파수 대역으로 나누어 등가적으로 4선 구성을 한 전송 방식. 2심의 동축 케이블에 비해 중계기의 수가 적고 경제적이며 신뢰성이 높아 해저 동축 케이블 방식에 널리 사용된다.
"등가 경로, 等價經路, equivalent path",,송신점을 나온 전파가 전리층에서 반사되어 수신점에 이를 때까지의 시간에 진공 중의 광속도를 곱한 것을 그 전파 통로에 대하여 이르는 말. 이것은 전파가 전리층 내를 진공 중의 광속도와 같은 속도로 전파한다고 가정한 경우의 전파 진행 경로의 길이이다. 전리층 내의 전파 속도는 광속도보다 작으므로 등가 경로는 언제나 실제의 전파 통로보다 길다.
"등가 다중 경로, 等價多重經路, Equal-Cost Multi-Path routing, ECMP",,"최단 경로 우선 프로토콜(OSPF)에서 목적지에 대한 모든 등가 경로를 정하는 프로토콜. 최단 경로 테이블을 작성할 때 주어진 목적지에 대한 등가 경로를 모두 계산하고, 등가 경로가 있으면 그 경로들에 동일한 양의 트래픽을 분배하는 방법이다. 각 경로의 부하를 고려하지 않고 트래픽을 일정한 비율로 분산시키므로 균등한 부하 분배를 이루는데 효율적이지 못하다.&nbsp;"
"등가 등방성 방사 전력, 等價等方性放射電力, Equivalent Isotropically Radiated Power, e.i.r.p, EIRP",동의어 : 유효 등방성 방사 전력(Effective Isotropically Radiated Power),송신계 성능의 하나를 나타내는 지수이며 주(主) 빔 방향의 전력속(束) 밀도로 모든 방향으로 방사한 경우의 전력. 송신 안테나의 실효 이득과 송신기 출력의 곱으로 구할 수 있으며 dBW(데시벨 와트)로 나타낸다.
"등가 분할, 等價分割, equivalence partitioning",,"시스템이나 시스템 구성 요소(component) 또는 소프트웨어 프로그램의 입력값과 출력값이 특정 그룹으로 분류되며, 분류된 그룹 내의 값들이 시스템에 의해 동일하게 취급된다는 특성을 이용하여 시험하는 기법. 등가 분할은 유사한 입력값들이 시스템을 거치면 유사한 답변이 나온다는 것을 가정한다. 등가 분할에서 하나의 값은 그 분할 내 모든 값을 대표하는 것으로 간주한다. 모든 입력값을 시험할 필요가 없게 하여 시험을 효율적으로 수행할 수 있도록 지원한다. 일반적으로 경계값 분석 기법(boundary value analysis)과 함께 테스트 케이스(test case)를 작성하는 데 사용된다."
"등가 비트 속도, 等價-速度, equivalent bit rate",,통신 선로 부호 신호에서 단위 시간 내에 전송할 수 있는 2진 디짓의 수.
"등가성 회복 처리, 等價性回復處理, equivalence recovery",,"논리 볼륨을 구성하는 2개의 물리 볼륨상의 데이터가 어떤 이유로 일치하지 않을 때, 한쪽의 물리 볼륨상의 데이터를 다른 한쪽의 물리 볼륨에 복사함으로써 다시 동일한 데이터를 갖도록 하는 처리. 이중화 상태의 논리 볼륨에 데이터를 써넣는 중에 컴퓨터 시스템이 사용 가능하지 않게 되면, 그 갱신 부분의 데이터가 불일치하게 된다. 이때는 저널 정보(journal data:회복 처리를 하기 위해 필요한 정보)에 따라서 갱신 부분의 복사를 한다. 또 한쪽 계통 상태의 논리 볼륨에 물리 볼륨을 짜 넣어 이중화 상태로 할 때는 이전부터 사용 중인 물리 볼륨의 모든 데이터를 새로운 볼륨에 복사한다."
"등가 시스템, 等價-, equivalent system",,"2개의 시스템 A, B에서 A의 상태 공간에 포함되는 각 상태 a에 대하여 B의 상태 공간에 포함되는 등가인 상태 b가 적어도 하나 존재하고, 그 역이 성립하는 시스템."
"등가 연산, 等價演算, Equivalence Operation, If-And-Only-If Operation, IFF",,"A⇔B로 표시된 논리 연산의 하나. A⇔B는 A와 (B의 진릿값이 같을 때, 즉 A와 B가 모두 참이거나 모두 거짓일 때 참이고, A와 B의 값이 다르면 거짓이다. 배타적 부정 논리합(NOR)이라고도 하며, 배타적 논리합(exclusive OR)의 반대 연산이다."
"등가 임피던스, 等價-, equivalent impedance",,"내부에 신호원을 포함하지 않은 회로망이나 기기에서 임의의 단자에서 본 임피던스, 또는 임의의 회로에서 그것의 등가 회로를 생각하였을 때의 임피던스."
"등가 잡음 대역폭, 等價雜音帶域幅, equivalent noise bandwidth",,"어떤 장치의 진폭·주파수 응답 특성에 의해 결정된 주파수 폭이며, 지정된 특성 잡음원(雜音源)에서 주어지는 잡음 전력을 정의하는 것."
"등가 잡음 온도, 等價雜音溫度, equivalent noise temperature",,"통신용 기기에서 발생하는 열잡음의 양을 그것과 등가의 잡음을 발생하는 저항체의 절대 온도로 표시한 것. 위성 통신에서는 적은 열잡음량을 다루기 위하여 잡음 온도를 사용하는 경우가 많다. 지구국 수신계의 등가 잡음 온도는 안테나, 급전 장치, 저잡음 증폭기 등의 등가 잡음 온도의 합으로 나타낸다."
"등가 잡음 전력, 等價雜音電力, Noise Equivalent Power, NEP",,어떤 주파수(파장)의 실효 잡음 대역폭 내에서 주어진 검출기 출력의 신호 대 잡음비가 1을 나타내는 복사 전력. 또한 신호 대 암전류 잡음비가 1이 되는 복사 전력을 가리키기도 한다.
"등가 주파수, 等價周波數, equivalent frequency",,주파수 분할 다중 방식에서 어느 계위에서의 주파수 ft가 재변환되어 또 다른 계위의 주파수 fs로 된 경우에 ft와 fs를 서로 가리키는 말.
"등가 지구 반지름, 等價地球-, effective radius of the earth",,전파의 통로를 직선으로 나타내기 위하여 가상한 지구 반지름. 표준 대기에 의한 지구 반지름은 실제 반지름의 4/3이다. 등가 지구 반지름과 실제 반지름과의 비를 등가 지구 반지름 계수라 한다.
"등가 트리, 等價-, equivalent tree",,같은 위치에 같은 데이터를 가진 서로 같은 2개의 트리. 
"등가 회로, 等價回路, equivalent circuit",,"①전 주파수대에 걸쳐 특성이 같은 회로망을 등가라고 하며, 등가인 회로를 등가 회로망이라고 한다. ②어떤 회로망에 대해서 특정한 주파수 또는 주파수 범위에서 특성이 같은 회로망을 그 주파수에서의 등가 회로망이라고 하며, 복잡한 계산이나 해석을 할 경우 이와 같은 회로망을 사용하면 편리하다. →등가 회로망"
"등가 회로망, 等價回路網, equivalent network",,임의의 조건을 이용하여 전기적인 수행을 하는 데 실질적인 영향 없이 다른 망으로 대치할 수 있는 망. 망들의 외부 시스템의 전기적 동작에 변형 없이 다른 망으로 대치할 수 있는 것을 일반적인 등가망이라 한다. 또 몇몇의 특별한 시스템에만 다른 망으로 대치할 수 있는 것을 제한 등가망이라고 한다.
"등가 회선, 等價回線, equivalent line",,중계국의 통화량 처리 용량을 표현하기 위한 단위. 교환기의 크기를 비교하는 데 쓰인다.
"등각 속도, 等角速度, Constant Angular Velocity, CAV",,"디스크 저장 매체에서 디스크 회전 속도를 일정하게 하고 디스크의 회전각에 따라 데이터를 저장하는 방식. 디스크 내곽과 외곽의 회전 속도 차이로 생기는 데이터의 조밀도가 달라 외곽이 저장 공간의 낭비가 생기는 단점이 있으나, 헤드의 위치에 따라 디스크 회전 속도를 조절하는 상수 선형 속도(CLV)에 비해 데이터 접근 속도가 빠르다."
"등감도대, 等感度帶, equisignal zone",,보통 단일 송신국에서 송신된 주어진 두 무선 신호의 진폭 차가 식별되지 않는 공역(空域).
"등급 부호, 等級符號, class code",,"다주파 부호를 선택 신호로 사용하는 국간 중계 접속 시, 착신국에서 가입자의 등급이나 요금 부과 등급 등을 요구할 때 선택 부호의 앞이나 뒤에 위치시켜 전송하는 것."
"등급 식별, 等級識別, class analysis",,"입력 회선의 등급 또는 가입자 등급의 차이에 따라 접속 처리 방법이 다르게 되므로 그 등급 정보를 뽑아내는 처리. 보통 입력 회선 또는 가입자의 수용 위치 정보를 찾아내는 것을 입선 식별이라 하며, 가입자 정보로서 발호자 번호 식별이 이루어져 발호자 번호가 각종 서비스를 하는 데 이용된다."
