"단전자 트랜지스터, 單電子-, Single Electron Transistor, SET",,소스와 드레인 사이에 나노 크기의 1개의 양자점과 이와 전기 용량적으로 커플링된 게이트로 하나의 단위 소자를 이루는 양자(量子: quantum)화 개념의 트랜지스터. 전자 1개가 1비트의 정보를 저장할 수 있어 1mm의 10만분의 1정도의 나노 소자에서 테라(tera)급의 기억 용량을 실현할 수 있는 차세대 기억 소자로 기대되고 있다. 
"단절 동작, 斷切動作, make-break operation",,펄스들이 단절됨에 따라 전류의 흐름이 한정된 시간 동안 중단되는 전신 회로의 동작 방식.
"단절 명령, 斷切命令, DISConnect instruction, DISC instruction",,"단말 장치 간에 연결된 링크 동작을 정지시키는 명령. 주국(master station)이나 통합국에 의해서 일어난다. 단절 명령은 응답 확인(VA)에 의하여 확인 응답되며, 통합국 또는 종속국(slave station)은 단절 요구(RD) 반응을 보내어 단절 모드로 들어가기를 요청할 수 있다."
"단절 신호, 斷切信號, disconnect signal",,어떤 회선의 한쪽 단말에 연결되어 있는 장치를 해제하여 다른 단말 장치에 사용 가능한 상태로 만드는 신호.
"단점, 短點, dot",,모스 부호(Morse code)의 구성 요소. 시간 길이는 장점의 3분의 1이다. 인쇄 부호에서도 단점(마크)과 단점과 같은 시간 길이를 갖는 간격(스페이스)과의 연속 부호를 사용하여 시험과 조정을 하는 경우가 있으며 전신 기기와 회선의 조정에 자주 사용된다.
"단점 신호, 短點信號, dot signal",,1과 0으로 이루어진 2진수의 열(列).
"단점 주파수, 短點周波數, dot frequency",,"전신 또는 데이터 통신 부호의 최단 시간. 즉, 기본 단점 시간의 2배의 역수로 다음과 같이 식으로 나타낼 수 있다. fP＝1/2fP:단점 주파수, τ:단점 시간, B:보(baud) 수로 주어진다."
"단접합 트랜지스터, 單接合-, UniJunction Transistor, UJT",,이미터(emitter)와 컬렉터(collector)의 2개의 접합을 가진 보통 트랜지스터와 달리 1개의 접합을 가진 트랜지스터. 가늘고 긴 부분에 직류 전류를 가한 상태에서 중앙의 이미터 접합의 전압 전류 특성을 취하면 부성 저항이 나타나므로 이것을 이용하여 스위치로 사용한다.
"단중계기, 端中繼機, end repeater",,"음성 신호와 2선-4선의 변화를 증폭하며 동시에 제어 신호를 변환하는 장치. 2개의 증폭 회로, 평형 결선망 등으로 구성된다."
"단축 다이얼 변경 제한, 短縮-變更制限, Abbreviated Dialing Change Restriction, ABDR",,단축 다이얼 기능 중 일단 기억된 단축 부호와 가입자 번호를 변경할 수 없도록 하기 위해 부여하는 등급.
"단축 다이얼 호출, 短縮-呼出, abbreviated dialing",,"적은 자릿수의 다이얼 조작으로 특정 통신 상대를 호출할 수 있는 서비스. 이용자의 조작으로 단축 번호를 등록하거나 변경할 수 있는 방법을 가변 단축 다이얼 호출이라 하고, 이용자의 조작으로는 변경할 수 없는 방법을 고정 단축 다이얼 호출이라 한다. 또 상대방 선택 번호의 일부를 단축 번호로 바꾸는 방식을 부분 단축 다이얼 호출이라 한다."
"단축 라우팅, 短縮-, Cut-Through Routing",,"이더넷의 매체 접근 제어(MAC) 주소를 확인해 해당 목적지 포트로 전송하는 기법. Shortcut Routing이라고도 부르며, 서로 다른 서브넷에 접속한 단말들이 라우터를 거치지 않고 직접 통신을 수행할 수 있도록 수신되는 패킷의 목적지 주소(패킷의 가장 앞부분 6바이트)를 확인하자마자 목적지 포트로 패킷을 전송함으로써 전송 대기 시간을 최소화한다. 수신 패킷에 에러가 발생하면 이를 폐기하고 재 전송 패킷을 기다리며, 세그먼트의 상태를 확인해 전송이 가능한 시점에서 패킷 전송을 시작하고, 충돌이 발생하면 잠시 대기했다가 재 전송한다. 목적지 포트의 상태에 따라 패킷의 송신을 보류해야 하는 경우가 있으므로 대부분의 스위치에는 전송 대기용 버퍼를 가지고 있다. 패킷의 길이에 관계없이 지연 시간이 일정하며, 고속 네트워크 연결이 불가능하고, 동일한 장비(FDDI-FDDI, ATM-ATM)간 연결에서 가능하다."
"단축 번호, 短縮番號, abbreviated number",,단축 다이얼 호출 기능 중 상대방 전화번호를 두 자리 숫자로 줄여서 호출할 수 있는 번호.
"단축 부호, 短縮符號, abbreviated code",,단축 다이얼 기능 사용 시 부여되는 부호.
"단축 인터넷 주소, 短縮-, URL shortening",,"웹상의 긴 인터넷 주소(URL)를 짧고 간단한 URL로 바꿔 제공하는 방식. 콘텐츠 작성자가 트위터 등 SNS에서 단축 URL을 제공할 수 있고, 뉴스 사이트에서 기사 원문에 대해 단축 URL을 직접 생성해 사용자로 하여금 간편하게 콘텐츠에 접근할 수 있게 한다."
"단축 주소 호출, 短縮住所呼出, abbreviated address calling",,호를 개시할 때 이용자가 주소의 총 문자 수보다 적은 문자 수의 주소를 사용할 수 있는 호출. 망 내에서는 이용자가 단축 주소 부호를 일정 수 지정할 수 있다. 하나의 수신처 또는 복수의 수신처에 대한 단축 주소 부호의 할당은 요구에 따라 적절한 절차에 의하여 변경할 수 있다.
"단축 키, 短縮-, Short Cut, SC",동의어 : 바로쇠,"키보드에서 명령을 입력할 필요가 있을 때 자주 사용하는 기능을 간단히 호출하는 키. 일부 운영 체계(OS)나 애플리케이션은 이용자가 자유로이 단축 키를 정의할 수 있는 기능을 가지고 있지만, 대부분의 OS는 각 애플리케이션에 공통으로 사용되는 키의 조합을 사용하고 있다. 예를 들면, 윈도즈에서는 [Ctrl]+[C]가 복사, [Ctrl]+[X]는 잘라냄, [Ctrl]+[V]는 첨부로 정해져 대부분의 애플리케이션에서 동일한 단축 키를 사용할 수 있다."
"단축 핵심어, 短縮核心語, abbreviations for keywords",,"짧게 만든 핵심어 중 하나의 구체적인 핵심어. 핵심어에 대해 언어 규정상 구문적으로 같은 뜻을 갖는, 좀 더 짧게 만든 핵심어라고 정의할 수 있다."
"단축화 부호, 短縮化符號, shortened code",,"조직 부호에서 몇 개의 정보점을 항상 0으로 놓고 부호화한 다음, 이들 정보점을 제외시킴으로써 얻게 되는 부호 길이가 단축된 부호."
"단측파대, 單側波帶, single sideband",,"진폭변조(AM)된 전파에서 반송파와 상, 또는 하측의 측파대 하나를 제거시키고 남은 측파대 하나만 취하는 것. 반송파에는 아무 정보도 없으며, 반송파의 상측 USB(Upper Side Band)와 하측 LSB(Lower Side Band)는 같은 정보를 가지고 있으므로 하나가 제거되어도 원래 변조파의 재생이 가능하다. 수신측에서는 송신시와 동일한 반송파를 만들어 주어야 복조가 된다. 반송파와 측파대 하나가 제거되면 음성이 있을 때에만 전파가 나가는 것이 되므로 그 만큼 송신전력이 감소되고, 점유주파수 대역도 1/2이하가 되며, 강한 반송파에 의한 혼신의 경감과 어느 정도의 비화 효과도 얻어진다. 억압반송파 단측파대(SSB-SC: SSB-Suppressed Carrier)가 보다 정확한 표현이며, 반송파의 억압 정도에 따라, 억압반송파, 저감반송파, 전반송파로 분류되고, 다른 측대파가 완전히 제거되는 SSB와 일부가 남는 VSB(Vestigial Sideband)가 있다."
"단측파대 송신기, 單側波帶送信機, single sideband amplitude modulated transmitter",,단측파대 전송 방식을 사용한 진폭 변조 송신기.
"단측파대 위상 변조, 單側波帶位相變調, Single Sideband Phase Modulation, SSB-PM",,"4kHz의 간격으로 통화로마다 정해진 부반송파를 각 통화로의 신호로 단측파대(SSB) 변조하여 4kHz의 간격으로 배열된 신호파군을 만들어, 송신기의 주반송파를 위상 변조하는 방식. 단측파대 주파수 변조(SSB-FM) 방식과 함께 마이크로파 다중 통신 회선에 많이 사용된다."
"단측파대 전송 방식, 單側波帶傳送方式, single sideband transmission system",,진폭 변조로 반송파 양쪽에 생기는 양측파대 중에서 어느 한쪽만을 전송하는 방식. 양측파대 전송 방식에 비하여 약 반 정도의 주파수 대역이 필요하기 때문에 주파수 대역을 효과적으로 이용할 수 있어 널리 사용되고 있다.
"단측파대 주파수 변조, 單側波帶周波數變調, Single Sideband Frequency Modulation, SSB-FM",,"4kHz 간격으로 통화로마다 정해진 부 반송파를 각 통화로의 신호로 단측파대(SSB) 변조하여 4kHz의 간격으로 배열된 신호파군을 만들어, 송신기의 주 반송파를 주파수 변조하는 방식. 주파수 분할 다중 방식(FDM) 중 가장 대표적인 것으로 다중 통신 회선에 많이 사용되고 있다. 발사 전파의 주파수 대역폭이 넓어서 비교적 높은 주파수(주로 마이크로파)에서 사용되므로, 반송 단국 장치로부터 추출되는 신호파군도 비교적 높은 주파수 영역으로 변환할 필요가 있다. 이 때문에 몇 단계의 군 변조를 되풀이하여 소요 변조 신호파를 얻는 것이 보통이다."
"단층 파일, 單層-, flat file",동의어 : 플랫 파일,"① 단일 레코드형(record type) 레코드의 순서적 집합으로 이루어진 텍스트 파일. 단층 파일에는 레코드들의 관계를 지배하는 계층 구조 정보가 매입되어 있지 않다. 보통 각 레코드에는 그것을 식별하여 판독하거나 기록하기 위한 하나의 레이블이 있다. 이용자만이 식별할 수 있는 종속적인 데이터 항목이 있어서도 안 되고, 비록 있다 해도 단층 파일 체계(file system)에 의해서 식별되지 않는다. ② 관계형 데이터베이스에서 하나의 관계(relation)와 같은 의미. ③ 기본 데이터 항목의 1차원 또는 2차원 배열."
"단층 파일 디렉터리, 單層-, flat file directory",동의어 : 플랫 파일 디렉터리,파일 체계에서 서브디렉터리(subdirectory)를 가질 수 없고 파일 이름 목록만 들어 있는 디렉터리. 단층 파일 디렉터리는 매킨토시 운영 체계의 초기 버전이었던 매킨토시 파일 체계(MFS: Macintosh File System)와 MS-DOS의 버전 1.X 등에서 생성되었다.
"단층 파일 체계, 單層-體系, flat file system",동의어 : 플랫 파일 시스템,컴퓨터에서 파일들 사이의 관계를 지배하는 계층적 질서가 없는 파일 관리 체계. 보조 기억 장치인 디스크 내에 저장되어 있는 파일은 모두 각각 다른 이름을 가져야 한다. 각각 다른 디렉터리에 존재하더라도 2개의 파일이 같은 이름을 가질 수 없다. 매킨토시 운영 체계의 초기 버전이었던 매킨토시 파일 시스템(MFS)과 MS-DOS의 버전 1.X 등에서 단층 파일 체계가 채용되었었다. 계층적 파일 시스템(hierarchical file system)과 대칭된다.
"단파, 短波, short wave",동의어 : HF,"파장의 범위는 10 ∼ 100 m인 전파(HF: High Frequency). 주파수 범위로는 3,000 ~ 30,000 kHz 사이에 있는 전파로 상공 약 60㎞ 이상에 있는 전리층에 의해서 반사·흡수되는 전파이고, 근거리 통신에는 감퇴나 페이딩(전파의 강도가 급속하게 변동하는 현상)이 크기 때문에 이용할 수 없지만, 전리층인 F층(약 200∼400 ㎞ 상공에 존재)에서는 반사되기 때문에 원거리 통신에 이용된다. F층에서 반사되는 전파의 주파수는 전자밀도의 제곱근에 비례한다. 따라서 태양 활동 주기, 밤과 낮, 계절, 지구의 장소에 따라서 전자 밀도가 변하므로 사용 주파수를 바꾸지 않을 수 없다. 고정 통신, 국제 방송과 항공기, 선박 등의 무선 통신에 사용된다."
"단파대 대수 주기 수직 편파 안테나, 短波帶對數週期垂直偏波-, HF log periodic vertical antenna",,"초단파(VHF), 극초단파(UHF)대에서 사용되는 다이폴 어레이형 대수 주기 안테나의 원리를 단파대(HF)에 적용한 것. 주파수 범위는 최장의 소자와 최단의 소자 길이로 결정되지만, 여진하는 주파수에 의해 작동한 소자가 이동하기 때문에 광대역성을 가진다."
"단파 무지향성 수직 부하형 안테나, 短波無指向性垂直負荷型-, HF omnidirectional vertical loaded antenna",,단파대의 전파 감시에 사용되는 안테나. 수직 도체와 상층부 용량 부하 사이에 수직 도체의 특성 임피던스와 같은 저항을 접속하여 진행파 안테나로 작동시킨다. 이 때문에 광대역성(2~30MHz)이 있어 정재파비도 낮으며 무지향성이다. 또 건설에 필요한 부지 면적이 적은 이점도 있다.
"단파 방송, 短波放送, Short Wave Broadcasting",,"단파(3~30MHz)를 이용한 라디오 방송. 송신소에서 전파가 발사되면 공간파가 되어 지구의 상층에 있는 전리층(지상 150~300km)에서 반사되고, 다시 지구 표면에서 반사되며, 이러한 반사를 계속하면서 원거리까지 도달한다. 단파는 이와 같이 전리층에서 반사되기 때문에 멀리까지 전달할 수 있어 국제 방송 등에 이용되고 있다."
"단파 방송의 계절별 계획표, 短波放送-季節別計劃表, seasonal planning of high frequency broadcasting schedule",,"전파 규칙(RR) 제12조의 규정에 의거 각국의 주관청이 작성하고 전파 관리 위원회(RRB)에서 승인하는 세계적인 단파 방송 계획. 고주파 방송 가계획이라고도 한다. 1960년 9월 4일 그리니치시(GMT) 01:00 이후부터 1년을 3월계(季)(M : 3월의 첫 번째 일요일 GMT 01 : 00부터), 5월계(J : 5월의 첫 번째 일요일 GMT 01 : 00부터), 11월계(D : 11월의 첫 번째 일요일 GMT 01 : 00부터) 등 4계로 나누어서 각 계절마다 단파 방송 계획을 방송 시작 6개월 전까지 각 주관청은 전파 관리 위원회에 등록 통지하도록 되어 있다. 사용 주파수대는 5950㎑/26.100㎑에서 8개 대역이며 RRB에서는 각 주관청의 계획을 검토하여 방해 우려가 있는 것은 상호 수정/변경하도록 각 주관청에 권고한다."
"단파 소실, 短波消失, Short Wave Fadeout, SWF",,갑작스러운 전리층 교란으로 단파대의 전파가 흡수되어 통신이 돌발적으로 끊어지는 현상.
"단파 수신기, 短波受信機, short wave receiver",,3~30MHz의 주파수 범위의 전파를 수신하는 장치.
"단편, 短片, fragment",,분산 데이터베이스에서 실제 기억 장소에 알맞도록 하나의 릴레이션을 여러 개로 나눈 것.관계 시스템에서는 임의의 행과 열의 부분 집합을 가리킨다.
"단편화, 短片化, fragmentation",,①주기억 장치의 활용도를 극대화하기 위해서 프로그램을 비연속적인 곳에 적재하는 작업. 기억 장치 대응표에 의해서 자동적으로 가상적 연속 공간으로의 변환이 수행된다.②정보 송수신 시에 임의의 긴 데이터를 통신 프로토콜이 관리하기에 적절한 크기로 분할하는 것.③기억 장치의 가용 공간이 많은 작은 구역으로 나누어져 쓸모없게 되어 밀집화가 필요한 상태.④데이터 통신 비용과 접근하는 시간을 최소화하기 위하여 전체적 관계(relation)들을 적당하게 나누어 사용 빈도가 높은 장소에 저장하는 것. 수평 단편화와 수직 단편화의 2가지 방법이 있다.
"단향 2로 전신 방식, 單向二路電信方式, diplex telegraphy",,송신과 수신에 각각의 회선을 사용하여 동시에 두 방향 통신이 가능하도록 한 통신 방식. 보통 실선 두 가닥을 사용하여 각각 한 가닥과 대지 귀선에 따라 송신과 수신 각각의 회선을 구성하는 전신 회선 구성 방식을 말한다.
"단향 도파관, 單向導波管, uni-guide",,"마이크로파에서 비가역(非可逆) 회로의 일종으로, 도파관 쪽에서 오는 파는 다른 쪽으로 통과시키지만 반대 방향의 파는 통과시키지 않는 회로. 페라이트의 자이로(gyro) 자기 특성(磁氣特性) 등을 사용하여 만들 수 있다."
"단향 전송로, 單向傳送路, simplex channel",,미리 정해진 한쪽 방향으로만 전송할 수 있는 통신 채널. →단방향 전송.
"단 효과, 端效果, end effect",,안테나에서의 커패시턴스 영향. 이 효과를 고려하는 경우 반파장 안테나에 대한 실제의 길이는 반파장보다 5% 정도 짧게 할 필요가 있다.
"닫기, close",,파일 접근 처리에서 루틴의 최후에 하는 일련의 처리. 입력 파일의 데이터 수의 비교나 출력 파일의 파일 끝 블록을 작성하는 것 등이다.
"달링턴 회로, -回路, Darlington circuit",,2개의 트랜지스터를 직접 연결하여 등가적으로 하나의 트랜지스터 처럼 동작하도록 하는 연결 회로. 간단한 구조로 매우 높은 공통 이미터(common emitter) 전류 증폭률과 개선된 입출력 직선성을 얻을 수 있어 큰 신호의 출력회로로 이용된다. 증폭용 앞단 트랜지스터와 출력용 뒷단 트랜지스터의 종류(npn 또는 pnp)를 같게 하거나 다르게 할 수 있다. 그림과 같은 접속 방법을 달링턴 접속이라고 한다. 
"담당 기술자 부분, 擔當技術者部分, customer engineering section",,"프로그램 작성자, 조작원이 사용할 수 없는 장치의 일부분으로 해당 장치를 제조한 회사에 고용된 기술자만 사용, 유지, 작동할 수 있는 부분."
"닷 TV, Dot TV",,방송 통신 융합 서비스 모델의 하나로 기존 지상파 디지털 텔레비전(DTV) 방송에 인터넷과 저장 장치가 결합된 새로운 개념의 서비스. IP 텔레비전(IPTV)이 인터넷으로 TV를 볼 수 있는 것처럼 닷 TV는 TV로 인터넷 서비스를 즐길 수 있다. 우리나라의 방송사와 가전 회사가 공동으로 개발한 차세대 방송 서비스이다.
"닷넷 프레임워크, .NET Framework",,"마이크로소프트(Microsoft)사의 윈도즈 운영 체제(Windows OS), 윈도즈폰, 윈도즈 서버용 소프트웨어 개발 플랫폼. 닷넷 프레임워크(이전 이름 닷넷)는 윈도즈 환경에서 실행되는 대부분 응용 프로그램의 필수 요소로서 프로그램의 개발과 실행에 필요한 공통적인 기능들을 제공한다. 닷넷 프레임워크는 응용 프로그램들이 실행되는 가상 머신인 공통 언어 런타임(CLR: Common Language Runtime)과 프로그래밍 언어의 상호 운용성 등 광범위한 기술을 지원하는 클래스(class), 인터페이스 및 값 형식이 포함된 방대한 크기의 프레임워크 클래스 라이브러리(FCL: Framework Class Library)로 구성되어 있다. 2014년 마이크로소프트사는 닷넷 프레임워크를 오픈 소스(open source)로 전환했다."
"닷모비, .mobi",,"각종 휴대용 무선단말기를 통해 바로 인터넷에 접속할 수 있도록 모바일 인터넷 환경에 특화된 인터넷 최상위 도메인. .mobi 도메인은 .com, .net, kr과 같은 최상위 도메인(gTLD: generic Top Level Domain)으로 2005년 국제인터넷주소관리기구(ICANN: The Internet Corporation for Assigned Names and Numbers)로부터 최종 승인 받았으며 운영은 삼성전자, 마이크로소프트, 구글, 소니, 에릭슨 등 전세계 대표적인 모바일 업체들이 출자해서 아일랜드에 설립한 MTLD(Mobile Top Level Domain)사가 맡고 있다."
"닷컴 기업, -企業, dot-com enterprise",동의어 : 인터넷 기업,"인터넷을 기반으로 온라인상에서 사업을 하는 기업. 아마존, 야후, 소프트뱅크, 다음, 네이버처럼 공장 설비를 갖추지 않고 인터넷을 통해 수입을 올리는 기업을 말한다. 주로 이들 기업이 운영하는 사이트의 도메인 이름에 ‘.com’이 있어 생긴 말이다."
"대가 할당, 代價割當, spectrum charge assignment",,"주파수 할당 대가를 출연금으로 받고 주파수 이용권을 부여하는 주파수 할당. 주파수의 경제적 가치와 기술적 파급 효과가 크다고 인정될 때, 주파수에 대하여 경쟁적 수요가 있다고 인정될 때, 기타 전파 진흥을 위하여 필요하다고 인정될 때에 정보 통신부 장관이 출연금을 받고 할당할 수 있게 한 제도다. 대가 할당을 하지 않는 경우에 심사 할당을 적용하게 된다. 우리나라에서는 IMT-2000 주파수 할당에 처음으로 대가 할당 제도가 쓰였다."
"대각 해상도, 對角解像度, diagonal resolution",,"영상에서 대각선 방향의 해상도. 사람의 시각은 수직, 혹은 수평 방향의 해상도에 비하여 민감하지 못하다. 이 사실을 이용하면 영상 신호의 대역을 효과적으로 압축할 수 있다."
"대국 경보, 對局警報, remote alarm, far end alarm",,"디지털 전송 시스템에서 수신 전송로 및 시스템 장애 시 경보를 자체적으로 발하고 그 경보를 상대국으로 전송하여 상대국으로 하여금 장애 상황을 알리도록 해 주는 방법으로, KD-4 반송 장치에서와 같이 매 채널 시간 슬롯의 D₂에 ‘0’을 계속하여 보내는 방법. 송수신 데이터를 이용하는 방법과 프레임 비트나 제어용의 오버헤드 비트를 이용하는 방법이 있다."
"대국 장애 경보 신호, 對局障碍警報信號, Backward Alarm Indication Signal, BAIS",,"디지털 전송로에서 어떤 보수 구간(ME)에 장애(failure)가 검출되었을 때 역방향의 전송로에 대하여 특정의 부호를 송출하여, 한쪽 방향의 회선이 서비스를 제공할 수 없게 되었다는 것을 알리는 신호."
"대권 항법, 大圈航法, great circle sailing",,지구상의 두 점의 최단 거리인 대권에 따라 항행하는 것.
"대규모 다중 접속 온라인 게임, 多重接續-, Massively Multiplayer Online Game, MMOG",,수백 또는 수천명이 인터넷에 접속해 함께 즐기는 게임. PC뿐만 아니라 모바일 기기에서도 대규모 다중 접속 온라인 게임(MMOG)을 할 수 있다.
"대규모 다중 접속 온라인 역할 게임, 大規模多衆接續-役割-, Massively Multiplayer Online Role-Playing Game, MMORPG",동의어 : 대규모 다중 사용자 온라인 롤플레잉 게임,"수백 또는 수천 명 이상이 동시에 같은 게임에 접속하여 각자 맡은 등장인물의 역할을 수행하고 서로 협업하며 즐기는 온라인 게임. MMORPG는 대규모 다중 이용자(MMO)와 역할 게임(RPG)의 합성어로, RPG와의 차이점은 수백, 수천 또는 수만 명의 이용자들이 동시에 게임에 접속할 수 있는 대규모 온라인 RPG를 뜻한다. 한 게임 안에서 수백, 수천 명의 플레이어들이 서로 등장 인물(캐릭터)을 맡아 역할을 수행하면서, 다른 플레이어들과 정보를 공유하고 함께 집단 전투 활동 등을 하면서 성취감, 동질감, 소속감 등을 갖는다. MMORPG에서는 이용자가 게임에 접속하는 것에 상관없이 현실과 같이 게임은 계속 진행된다. 즉, 이용자가 다시 게임에 접속하면 종료한 시점에서 시작하지 못한다.1996년 넥슨(NEXON)사의 '바람의 나라', 미국 오리진 시스템즈(Origin Systems)의 ‘울티마 온라인’ 게임 등으로 그래픽스 기반 MMORPG의 대중화가 시작되었다. 이후 초고속 인터넷이 보급되면서 엔씨소프트의 리니지(1998년), 소니온라인엔터테인먼트의 에버퀘스트(1999년), 블리자드 엔터테인먼트의 월드 오브 워크래프트(2004년 출시) 등의 세계적인 흥행으로 게임의 주류로 자리잡게 되었다.4G 이동통신(IMT-Advanced), 와이파이(Wi-Fi) 등 기술 발전으로 데이터 사용 한도가 커지고 속도가 빨라지면서 모바일 MMORPG의 이용이 증가되었다. "
"대규모 사물 통신, 大規模事物通信, massive Machine Type Communications, mMTC",,"IMT-2020(5G) 이동통신에서 다수의 기기가 서로 연결되어 정보를 주고받는 사물 통신을 일컫는 명칭. IMT-2020(5G) 이동통신의 주요 서비스 요건(usage scenario) 중 하나이며, 비교적 저용량의 데이터를 저속으로 주고받는 사물 통신 기기를 대상으로 한다. mMTC 서비스를 위해 ITU-R은 사물 통신 기기의 수(connection density)를 단위 면적(1km2) 당 최대 100만개(106) 가량 대규모로 늘리는 것 외에, 기기 비용 절감(예: 10달러 미만), 배터리 수명 대폭 연장(10년), 서비스 범위(coverage) 확장 등을 정의하고 있다.대규모 사물 통신(mMTC)는 에너지 검침, 헬스/의료, 자동차, 공장 등 사회 전반에 활용될 수 있다. ※ MTC는 3GPP에서 정한 용어로 M2M(Machine To Machine), 사물 인터넷(IoT: Internet of Things)과 동일한 의미이다."
