"다각형망, 多角形網, polygon mesh",,3차원 그래픽의 물체를 2차원 화면에 나타내기 위해 물체의 표면을 연속적인 다각형의 모임으로 구성하는 것. 모서리와 다각형의 모임으로 주어진 응용에 따라 여러 가지 방법으로 구성한다.
"다결정 실리콘 박막 트랜지스터, 多結晶-薄膜-, polycrystalline silicon thin-film transistor, poly-Si TFT",,박막 트랜지스터(TFT)의 재료로서 다결정 실리콘(polycrystalline silicon) 박막을 사용한 것. 비결정성 실리콘(amorphous silicon) TFT에 비해 오프(off) 전류를 내리기는 까다로우나 온(on) 전류가 크기 때문에 동등한 스위치 능력의 확보가 가능하다. 신뢰성/안정성이 높기 때문에 투사형(投寫型) 표시 장치 등에 사용한다.
"다관절 로봇, 多關節-, articulated robot",,"팔이 3개 이상의 회전 관절을 가지는 로봇. 사람의 어깨, 팔, 팔꿈치, 손목의 관절을 본떠서 만든 로봇으로 사람이 하는 움직임과 비슷하게 움직일 수 있다. 행동이 빠르고 공간도 적게 차지하며 동작 범위도 넓어서, 공장 생산설비의 조립 작업이나 도장(塗裝)·용접 등에 사용한다."
"다국어 도메인 이름, 多國語-, Internationalized Domain Names, IDN",동의어 : 국제화 도메인 네임,"도메인 이름의 영역에 영문 도메인이 아닌 한글과 같은 자국어를 사용한 도메인. 2002년 10월 각국의 다국어 도메인을 영어, 숫자, 하이픈(-)으로만 구성된 아스키 문자열로 변환하는 과정이 클라이언트 애플리케이션단에서 수행되는 IDNA(Internationalizing Domain Names in Applications) 방식이 다국어 도메인의 IETF 국제 표준안이 되었다. IDNA에서는 사용자 애플리케이션단에서 다국어 도메인을 유니코드 변환→네임프렙(Nameprep) 과정→아스키 변환(Punnycode encoding) 처리한 후 인코딩된 이름을 리졸버(resolver)에게 전달하는 과정이 수행되며, 이를 구현하기 위해 아스키로의 변환 알고리듬과 인코딩된 도메인을 사용자가 알아볼 수 있도록 입력했던 지역 문자셋 형태의 도메인 이름으로 출력해 주는 역변환 알고리듬을 이용한다."
"다국어 식별자, 多國語識別子, Internationalized identifier",,"도메인(domain), 전자우편주소(e-mail address), URL, 인터넷 식별자(URI) 등에서 한글 등 다국어를 지원하도록 확장한 것. 다국어 식별자에는 다국어 도메인(IDN), 다국어전자우편(EAI), 다국어자원식별자(IRI) 등이 있으며, 이는 차세대 웹에서 정보 확장을 위한 인프라로서의 중요한 역할을 한다."
"다기능 메시지 처리 프로토콜, 多機能-處理-, Versatile Message Transaction Protocol, VMTP",,미국 스탠포드 대학에서 개발한 분산 환경용 전송 프로토콜. 요구/응답 형식으로 구현된다.
"다기능 명령 집합, 多機能命令集合, multifunction instruction set",,"시스템의 종류에 따라 수치적/논리적 연산, 데이터의 이동 검사, 결과의 저장 등이 한 명령으로 이루어지게 된 것. 곱셈과 나눗셈은 마이크로컴퓨터의 명령 중에서 대표적인 다기능 명령이다."
"다기능 복사기, 多技能複寫機, Multifunction Copier, MFC",,"디지털 기술을 응용해서 한 대의 기기를 복수 목적에 사용하는 사무자동화(OA) 기기. 복사 이외에 팩스, 인쇄기 등의 기능이 있어서 디지털 복사기라도 한다. 다기능 복사기의 기본 기능은 스캐너(scanner) 부분에서 원고를 읽어, 그 신호를 디지털화해서 화상 처리한 후 복사하는 것이다. 이 기능은 팩스나 인쇄기와 유사하다. 화상 처리하는 부분에 전화 회선과의 인터페이스 회로를 조합하면 팩스가 된다. 스캐너에서 읽은 원고를 전화 회선 형식으로 변환해서 송신, 외부로부터 송신된 신호를 변환해서 인쇄하면 된다. 인쇄기로 사용할 경우 컴퓨터로부터 받은 신호를 화상 처리해서 인쇄하는 것이 좋다. 다기능 복사기에는 기기 내부의 비싼 기구계(스캐너, 프린터 등)를 공용하기 때문에 내부 공간을 효율적으로 이용할 수 있고 단일 기능의 기기이므로 비용을 절감할 수 있다. 통신 기능을 강화하면 인터넷이나 인트라넷에 접속해 통신망상에서 이용할 수 있다."
"다기능 전화기, 多技能電話機, multifunction telephone",,"전자식 교환기의 출현으로 가능하게 된 전화기로서, 전화 메시지를 기억하였다가 호출 램프와 간단한 음성 우편(mail) 시스템을 이용하여 사용자에게 알리는 기능의 전화기."
"다기능 주변기기, 多機能周邊機器, Multifunctional Peripheral, MFP",,"네트워크 컴퓨터에 연결된 주변 장치로서 복사기, 팩스, 프린터, 스캐너 등 적어도 2가지 이상의 기능을 지원하는 기기. 잉크젯, 흑백 레이저, 칼라 레이저 등의 방식이 있으며, 문서 출력 환경 변화에 따라 각 단일 기능의 제품들이 복합 기능의 플랫폼으로 전환되어 유연한 연결성을 제공함으로써 작업 능률을 향상시킨다."
"다기능 처리 전화기, 多技能處理電話機, Transaction Utilization Multiphone, TRUMP",,"전화기에 마이크로컴퓨터, 모뎀을 내장하고 자기 카드 읽개, 프린터, 조작 안내 패널이 부착되어 있는 데이터 전화 단말. 은행과의 대금 결제, 상품의 수발주, 호텔과 여관의 예약, 신용 판매의 신용 조회 등 폭넓은 이용을 고려하여 일본의 전국 지방 은행 협회와 NEC가 공동 개발한 것이다."
"다기능 홈 네트워크, 多技能-, Versatile Home Network, VHN",,"고속 직렬 버스 인터페이스 규격 IEEE 1394b(FireWire 800) 기술을 홈 네트워크의 기간망(backbone)으로 정하고 그 위에 IP 기술과 확장성 마크업 언어인 XML을 이용하여 기기 간 제어를 구현한 미들웨어.컴퓨터, 디지털 텔레비전, 디지털 비디오 카세트 녹화기, 디지털 전화, 프린터, 스테레오 시스템, 기타 원격 조정 기기와 같은 접속 장비들의 상호 운용을 제어한다. 전화, 케이블 텔레비전(CATV), 일반 텔레비전, 직접 방송 위성(DBS)과 같은 외부 접속 망은 가정용 게이트웨이(Residential Gateway)나 케이블 모뎀을 통하여 VHN에 연결된다."
"다니엘 전지, -電池, Daniel cell",,"1차 전지의 하나로, 음극에 아연(Zn)판, 전해액에 황산아연 용액(ZnSo4), 양극에 구리(Cu)판, 감극제에 황산구리 용액(CuSo4)을 사용한 것. 기전력은 약 1.1V, 내부 저항은 2.5/3 Ω 이다."
"다단계 간접 주소매김, 多段階間接住所-, deferred addressing, indirect addressing",,"간접 주소 지정 방식의 다른 이름. 명령어의 주소부가 지정하는 곳에 가서 유효 주소를 읽은 다음, 이 유효 주소를 사용하여 데이터를 읽거나 쓰는 것으로, 데이터에 특별한 꼬리표를 붙여 그것이 다시 주소가 될 수 있도록 하는 방법도 있다. 이런 경우에 이러한 간접 주소가 지정된 횟수 이상 계속되면 시스템이 이상(panic) 상태가 되어 정지하게 된다."
"다단계 제어, 多段階制御, multilevel control",,"프로세스가 복잡해짐에 따라 이것을 자동 제어하기 위한 시스템도 복잡해지므로, 프로세스 전체를 최적 또는 합리적으로 운용하기 위하여 제어 장치를 여러 계층으로 나누어 배치하고 상호 관련성을 갖게 함으로써 각 계층이 알맞은 제어 기능을 발휘할 수 있도록 하는 것. 제어 기능의 고급화를 위한 제어 장치에는 컴퓨터가 이용된다."
"다단 변조, 多段變調, compound modulation, multiple modulation",,"①변조파로 다시 별도의 반송파를 변조하는 조작을 1단 이상 하는 것. ②1단 또는 2단 이상의 변조로 만들어지는 다중 신호로 주반송파를 변조하는 다중 통신의 변조 방식. 예를 들면, SS-FM은 단측파대 신호로 주 반송파를 주파수 변조하는 것이며, SS-SS는 단측파대 신호로 주 반송파를 진폭 변조한 다음에 그것을 단측파대로 하는 것이다."
"다단 안테나, 多段-, stacked antenna",,"안테나의 지향 특성이나 이득을 개선하려고 같은 종류의 안테나를 몇 단씩 겹쳐 쌓아 놓은 것 안테나. 동일 안테나를 수직 방향으로 2단 또는 4단 겹쳐 쌓아서 사용하면 이론적으로 이득은 2단으로 약3㏈, 4단으로 약 6㏈ 증가한다. 상하 간격에 따라 수직면 내의 지향성이 변화하는데, λ/2(λ：파장) 정도가 좋다."
"다단 연결, 多段連結, multistage link",,여러 개의 격자 스위치를 연결 접속하여 스위치 회로망을 구성한 접속 방법. 스위치 회로망에서는 출입선에 비하여 동시에 접속되는 통화 수가 적다. 이 점에 착안하여 스위치를 입선 스위치군과 출선 스위치군으로 나누어 양자 사이를 몇 개의 입선군에 대하여 공통으로 사용하는 연결로 결합함으로써 경제적인 스위치 회로망을 구성하게 된다.
"다단 중계, 多段中繼, multi-step relay",,"마이크로웨이브를 2회 이상 직렬로 송수신을 반복하여 신호를 중계하는 것. 송수신점 간에 전파의 장애물이 있는 두 점 간의 거리가 가시거리가 아니거나, 페이딩이나 눈, 비에 의한 신호의 감쇠를 고려해야 할 때는 그 사이를 몇 개로 분할하여 수신기 입력에 필요한 신호 대 잡음비(S/N)가 얻어지는 지점을 정하여 수신 한 후 다음 지점으로 송신하는 것을 반복한다. 국제간의 중계는 통신 위성을 통한 다단 중계가 사용된다. 또 광의로는 수동 중계(passive relay)도 포함한다."
"다단 처리 시스템, 多段處理-, polyprocessor system",,"다수의 처리 장치를 공통 버스, 공유 기억 장치, 데이터 연결 등과 같은 방법으로 상호 접속해서 전체로서의 다양한 기능과 고성능을 갖춘 시스템. 미니컴퓨터나 마이크로컴퓨터와 같은 값싼 처리 장치를 다수 접속하여 구성한다."
"다 대 다 관계, 多對多關係, many-to-many relationship",,"객체 집합 A, B가 있을 때, A의 한 객체가 B의 임의 개수의 객체와 연관되고, 또 B의 한 객체가 A의 임의 개수의 객체에 연관될 때, 객체 집합 A, B의 관계."
"다 대 일, 多對壹, many-to-one",,"두 집합 사이의 관련성을 나타내는 비율이나 측정값으로, 한 집합의 둘 또는 그 이상의 원소가 다른 집합의 한 원소와 대응되는 것. 한 원시 언어의 여러 문장이 다른 목표 언어의 한 문장에 대응되면 다 대 일의 관계가 존재한다고 말할 수 있다."
"다도체, 多導體, bundle core",,"송전선의 1상(相)당 도체로는 2선 이상의 전선을 적당한 간격으로 사용하는 방식. 대전력을 송전하기 위해서는 P=VI 에 의해서 전압이나 전류를 증가시켜야 한다. 그런데 흐르는 전류를 증가시키려면 두꺼운 전선이 필요하고 그만큼 무거워져서 철탑과 기타 지지 재료에 대한 건설 비용이 증가한다. 그러므로 송전 전력 증강 대책으로는 가는 전선으로 전압을 올리는 방안이 바람직하다. 그러나 전압을 올리게 되면 코로나(corona)가 발생하는데, 이를 방지하기 위해서 전선 표면의 전위 경도(傾度)를 내리는 다도체 방식을 채용한다."
"다리없는 반도체, -半導體, Bottom Leaded Plastic Package, BLP",,"반도체의 외부 리드(반도체 다리)를 제거시켜 칩 크기와 두께를 최소화시킨 차세대 반도체 패키지 기술. 이 기술은 패키지 공정 혁신으로 제조 공정 단축과 제조 원가를 절감할 수 있으며, 특히 시스템의 소형화와 메모리 확장이 용이하다는 장점이 있다. 다리 없는 반도체(BLP) 패키지는 우리나라의 LG 반도체가 1995년 독자 기술로 개발해 반도체 분야의 세계 표준화 기구인 JEDEC(Joint Electron Device Engineering Council)에서 국제 표준으로 인정받았다."
"다목적 인터넷 전자 우편, 多目的-電子郵便, Multipurpose Internet Mail Extensions, MIME",,"아스키(ASCII) 형식이 아닌 텍스트나 화상, 음성, 영상 등 멀티미디어 데이터를 그대로 전자 우편으로 송신하기 위한 간이 전자 우편 전송 프로토콜(SMTP)의 확장 규격. 초기의 전자 우편은 7비트의 ASCII 부호로 기록된 텍스트 파일밖에 취급할 수 없었으나 인터넷의 보급으로 영어 이외의 각 나라 2바이트 문자를 위시해서 ASCII 이외 문자의 텍스트나 멀티미디어 데이터를 주고받는 것이 필요하게 되어 인터넷의 표준화 조직인 인터넷 엔지니어링 태스크 포스(IETF)에서 다목적 인터넷 전자 우편(MIME)을 규정하였다. ASCII 이외의 텍스트나 멀티미디어 데이터는 MIME 유형(MIME type)을 사용하여 전송되며, 수신 측의 응용 프로그램은 파일의 내용을 해석하기 위하여 MIME 유형과 세부 유형(subtype)으로 편성된 표준 문서 목록을 참조한다. 예를 들어, text/html이라는 MIME 유형은 하이퍼텍스트 마크업 언어(HTML)로 기록된 텍스트가 포함되어 있다는 것을 의미한다. MIME은 하이퍼텍스트 전송 규약의 일부분이며, 월드 와이드 웹(WWW) 브라우저와 WWW 서버는 MIME을 사용하여 그들이 송신하고 수신하는 전자 우편 파일을 해석한다."
"다목적 인터넷 전자우편 보안, 多目的-電子郵便保安, Secure/Multipurpose Internet Mail Extension, S/MIME",,"다목적 인터넷 전자우편(MIME)에 기밀성과 인증, 그리고 부인 방지 등의 정보보호 서비스를 제공하는 프로토콜. 전자우편을 암호화하고 전자 서명을 이용하여 메시지 기밀성, 송신자 인증, 메시지 무결성 등의 보안 기능을 제공한다."
"다발, 多發, cluster",,"①유사성(類似性)과 같은 어떤 개념을 바탕으로 몇 개의 집단으로 분류한 데이터 집합. ②서로 근접한 위치에 있으며 하나의 제어 장치에 의해 제어되는 입출력 장치나 단말 장치 등의 장치 집단. ③플로피 디스크나 하드 디스크에 정보를 기록하고 기록된 정보를 읽어 내기 위해 운영 체계(OS)가 사용하는 디스크 저장 공간의 단위. 디스크의 물리적 최소 저장 공간 단위는 섹터(sector)인데, 섹터는 프로그램이나 데이터를 관리하는 단위로서는 너무 작기 때문에 일정한 수의 섹터로 구성되는 다발을 한 단위로 사용한다. 다발은 디스크의 종류에 따라 보통 2의 제곱수(2, 4, 8, 16,…)의 섹터로 구성되며, 운영 체계가 디스크 저장 공간을 할당하고 해제하거나, 사용/미사용 공간을 관리하는 최소 단위이다. 아무리 작은 정보를 저장하더라도 1다발이 할당된다. 다발의 크기는 다발을 구성하는 섹터의 수에 섹터의 크기를 곱한 것이 된다. 이와 같이 다발을 사용하면 기억 장소가 낭비되는 단점도 있지만, 디스크에 접근하는 횟수가 줄어들기 때문에 전반적으로 처리 속도가 빨라지는 장점이 있다."
"다변형 섬유, 多變形纖維, Multimaterial Fibers",,"카메라 렌즈가 없어도 빛의 파장이 입력되면 각각의 섬유와 연결된 센서에 전자 신호가 닿아 이미지를 저장하거나 연결된 모니터로 전송할 수 있는 섬유. 빛의 파장이 입력되면 각각의 섬유와 연결된 센서에 전자 신호가 닿아, 이미지를 저장하거나 연결된 모니터로 전송할 수 있다. 렌즈 없이 빛의 파장을 받아들여 이미지를 전송하고, 휘는 카메라 기능이 가능하며, 360도로 물체의 움직임을 탐지하거나 외부로부터 받아들인 빛을 이미지로 바꿀 수도 있다."
"다분기, 多分岐, multidrop",,"컴퓨터 등에 접속되는 통신 회선에 많은 단말이 접속되는 방식. 분기라고도 한다. 통신 회선을 경제적, 효과적으로 사용하기 위한 방식이다."
"다분기 운용, 多分岐運用, multipoint operation",,"중앙의 제어국에 대해 여러 단말 장치나 하나의 전용 회선에 분기 접속된 경우의 데이터 전송 기능. 제어국의 제어하에 데이터 통신이 실행되며, 분기 회선을 이용하는 경우 일반적으로 폴링(polling)/선택(select)에 의해서 데이터 연결이 확립된다. 즉, 단말기에서 제어국까지 데이터 흐름에 관한 데이터 링크는 단말 장치에 송신해야 할 데이터의 유무를 묻는 폴링에 의해 행해지고, 송신해야 할 데이터가 있으면 제어국으로 데이터가 송신된다. 반대로, 제어국에서 단말기까지 데이터 흐름에 대한 데이터 연결은 제어국으로부터 데이터를 수신해야 할 단말기를 선택하여 수신 준비를 묻는 선택에 의해 행해지고, 준비가 갖추어져 있으면 그 단말기로 데이터가 송신된다. &nbsp;"
"다사업자 통합 통신 규약, 多事業者統合通信規約, Multi-Vendor Integration Protocol, MVIP",,1990년에 미국 내추럴 마이크로시스템(Natural Microsystem)사 외 6개사가 제창하여 공동 개발한 음성/팩스/데이터 등의 처리를 위한 표준 인터페이스. CTI (computer telephony integration) 시스템에 널리 활용된다.
"다선식, 多線式, multiple-wire system",,"전신 또는 데이터 통신 부호의 각 단위를 시계열로 전송하는 것이 아니고, 각 단위를 그 수와 같게 다수의 선로로 동시에 전송하는 병렬 통신 방식. 일반적으로 실선이 다수 필요한 점은 불리하지만, 속도가 빠르고 기계가 간단하다는 이점이 있다."
"다선식 인쇄기, 多線式印刷機, multiple channel printer",,"다선식 전신 및 데이터 통신 기기에서 송신기, 수신 천공기, 인쇄기 등으로 구성되는 장치."
"다성분 유리 광섬유, 多成分-光纖維, multicomponent glass optical fiber",,"산화 규소 외에 Na2O, CaO 등 많은 유리 성분으로 된 광섬유. 이중 도가니법 등으로 제작된다. 석영 광섬유에 비하여 연화점(軟化點)이 낮다."
"다수결 연산, 多數決演算, majority operation",,각 피연산자가 값 0 또는 1의 어느 하나를 취하고 값 1을 갖는 피연산자의 개수가 값 0을 갖는 개수보다 많을 때에만 값이 1이 되는 한계값 연산.
"다수결 함수, 多數決函數, majority function",,"입력 수가 반드시 홀수이고, 반수 이상의 입력이 1일 때 출력이 1이 되는 논리 함수."
"다수결 회로, 多數決回路, majority decision circuit",,n(3 이상의 홀수)개의 입력 단자와 1개의 출력 단자가 있어 (n+1)/2개 이상의 입력 단자에 입력 1이 주어질 경우에만 출력 단자에 출력 1이 나타나는 회로. 표는 3입력 다수결 회로의 입력값과 출력값과의 관계를 나타낸 것이다.
"다수 데이터베이스, 多數-, multi database",,"독립적으로 생성, 관리되는 여러 개의 데이터베이스들로, 일부 데이터베이스는 같은 컴퓨터에 존재하고 나머지 데이터베이스는 컴퓨터망을 통해서 접근되는 형태의 데이터베이스. 이 데이터베이스의 특징은 각 데이터베이스들이 물리적, 논리적으로 다르다는 것이다. 따라서 다수 데이터베이스를 관리하는 시스템이 필요하며, 이러한 시스템을 다수 데이터베이스(관리) 시스템(MBS)이라 한다. MBS를 설계하는 방식은 하나의 전역 스키마를 기준으로 다수 데이터베이스를 하나의 데이터베이스인 것처럼 해 주는 방식과, 전역 스키마가 없이 데이터베이스마다 스키마가 따로 존재하는 방식이 있다."
"다수 프로토콜 통신 제어 장치, 多數-通信制御裝置, Multiprotocol Communications Controller, MPCC",,"타이밍 블록에 의해 송수신이 조정되어 동기식 전송에 사용하며 0의 삽입과 제거, 순환 여유 검사(CRC)의 조성과 검사 그리고 보조 주소의 비교 등 다양한 프로토콜 기능을 수행하는 제어 장치."
"다시점 영상, 多視點映像, Multiview Video",,"한 대 이상의 카메라를 통해 촬영된 영상들을 기하학적으로 교정하고 공간적인 합성 등을 통하여 여러 방향의 다양한 시점을 사용자에게 제공하는 3차원(3D) 영상. 다시점 영상은 파노라마 영상으로 방송은 물론 우주/항공 사진학, 컴퓨터 비전, 영상처리, 컴퓨터 그래픽스 등 다양한 분야에서 이용된다."
"다시점 영상 부호화, 多視點映像符號化, Multiview Video Coding, MVC",동의어 : 다시점 비디오 부호화,한 대 이상의 카메라로 촬영된 다시점 영상(multiview video)을 효율적으로 압축하고 전송하고 재생하기 위한 엠펙(MPEG) 표준. 고효율 영상 압축 표준인 MPEG-4 AVC(Advanced Video Coding)의 확장 표준이다.
"다심 광섬유 접속, 多心光纖維接續, multifiber joint",,"2개의 다심 광섬유 케이블을 연결하여 각각의 도파로를 동시에 광학적으로 정렬, 접속하는 것."
"다심 광섬유 케이블, 多心光纖維-, multifiber cable",,각각 분리된 정보 통로를 제공하는 2개 혹은 그 이상의 광섬유를 포함하는 광케이블.
"다용도 기판, 多用途基板, universal board",,배선용 인쇄 회로 형식이 균일하게 되어 있어 다용도로 사용할 수 있는 기성 인쇄 회로 기판.
"다용도 번역 중심 언어, 多用途飜譯中心言語, Universal Compiler Oriented Language, UNCOL",,"다양한 프로그램 작성 언어로부터 다양한 기계어를 목적 프로그램으로 번역하기 위한 다용도 중심 언어의 일종. 언어의 수가 N개이고, 목적 기계의 수가 M개일 때 원시 프로그램 번역을 위해서 필요한 번역 수는 N×M이 필요하지만 다용도 번역 중심 언어(UNCOL)를 사용하면 N＋M개로 줄어든다."
"다용도 비디오 부호화, 多用途-符號化, Versatile Video Coding, VVC","동의어 : 범용 비디오 부호화, 미래 비디오 부호화, Future Video Coding","대용량 초실감 서비스 제공을 위한 차세대 비디오 부호화(압축) 표준 기술. 기존 고효율 비디오 부호화 표준인 HEVC(High Efficiency Video Coding)와 비교하여 압축 성능이 최대 2배로 향상되었다. 8K(7680x4320)포함 UHD 영상, 360도 가상현실(VR) 영상 등을 모두 대상으로 하여 제이벳(JVET: Joint Video Expert Team)에서 다용도(versatile) 비디오 부호화 표준이라고 명명하였다.VVC는 기본적으로 기존 HEVC 표준의 기본 골격을 유지하면서 HEVC 보다 블록 크기 확장(최대 128x128), 다양한 크기의 블록 분할, 인트라 예측 모드 확대(65개), 정교한 움직임 벡터 예측, 정교한 변환(transform) 측면에서 향상된 기능을 제공한다. 또한 압축률 개선을 위해 중첩된 블록 움직임 보상(OBMC: Overlapped Block Motion Compensation), 적응적인 루프 필터(ALF: Adaptive Loop Filter), 6개의 자유도를 갖는 전역/지역 움직임 벡터(affine motion) 기능을 추가하였다.기존의 모든 비디오 부호화 표준에 대해서는 하방 호환(backward compatibility)을 지원하지 않는다. 80 Mbps 이상의 8K UHD 콘텐츠는 위성으로만 제공하나 해당 콘텐츠에 VVC를 적용하면 전송량을 반으로 줄일 수 있어 지상파와 케이블에서도 전송이 가능해진다. 또한 8K 해상도의 360도 가상현실 영상 압축, 저장 및 전송이 가능하여 보다 실감나는 서비스를 제공할 수 있다."
"다용도 입출력 포트, 多用途入出力-, General Purpose Input/Output, GPIO",,프로세서나 컨트롤러(controller) 등에서 일반 목적으로 사용하도록 준비된 입출력 포트. 다용도 입출력 포트(GPIO)를 소프트웨어와 연동시키면 전기적 입력을 받거나 출력으로 특정 장치를 제어하게 할 수 있다.
"다용도 접속, 多用途接續, general interface",,"어떠한 입출력 기기에도 적합하게 만든 접속. 입출력 접속, 직병렬 접속 등이 있다."
"다우 존스 뉴스 검색, -檢索, Dow Jones News/Retrieval, DJN/R",,"세계적인 일간 경제 신문 ‘더 윌 스트리트 저널’을 발행하고 경제 관련 뉴스 통신 ‘다우 존스 뉴스와이어’를 배포하고 있는 다우 존스사(Dow Jones Co., Inc.)가 제공하는 종합 온라인 데이터베이스 시스템과 그 서비스의 명칭. 45종의 데이터베이스로 이루어져 있으며 경제 정보의 데이터베이스로는 세계 최대 규모이다. 주요한 정보 항목으로는 미국의 주요 산업 부문 65종의 평균 주가 지수인 다우 존스 평균 주가 지수(DJA), 세계 경제/투자/금융 정보인 다우 존스 국제 뉴스(DJINS), 90일 동안의 ‘더 윌 스트리트 저널’ 및 ‘다우 존스 뉴스와이어’ 기사 초록을 수록한 다우 존스 뉴스(DJNEWS), 홈 쇼핑 정보 등이 있다."
