"폐쇄 회로 텔레비전, 閉鎖回路-, Closed Circuit Television, CCTV",,"특정한 수신자에게만 서비스하는 것을 목적으로 하는 텔레비전 전송 시스템. 카메라, 모니터, 디지털 비디오 녹화기(DVR), 네트워크로 구성된다. 산업, 교육, 의료 및 지역 정보 서비스 등 산업 분야 전반에 이용되고 있지만 영상 보안 시스템용으로 시장이 확대되고 있다. DVR는 촬영에서 전송까지 모두 디지털로 처리하는 네트워크 비디오 녹화기(NVR)로 발전하고 있다."
"폐영역 회수, 廢領域回收, garbage collection",,"동적 데이터 구조를 취급하는 프로그램은 필요할 때마다 히프(heap)라고 하는 동적 데이터용의 기억 영역으로부터 새로운 데이터 셀(cell)이나 동적 변수를 확보하고 있는데, 이때 전혀 이용되지 못한 데이터 셀을 히프로 되돌리는 것. 인용 카운터나 마킹을 이용하여 회수해도 좋은 데이터 셀을 결정하거나, 히프를 둘 준비하여 사용 가능성이 있는 셀을 한 쪽에서 다른 쪽으로 이동시켜 가는 복사에 따른 회수 등의 방법으로 실현된다."
"포대기형 루프, -型-, nested loop",,루프의 범위 내에서 다른 루프를 포함하는 루프.
"포락선 검파, 包絡線檢波, envelope detection",,진폭 변조된 입력 신호의 파형을 검출하기 위하여 다이오드와 저주파 필터를 사용하여 포락선을 검출하는 것.
"포락선 지연, 包絡線遲延, envelope delay",,①1개 파(波)의 포락선에서 두 점 사이의 전파 시간. ②변조 신호의 포락선이 회로망의 한 점에서 두 번째 점까지 통과하는 시간. ③선명도의 대역폭이 각기 주파수 성분과의 간격보다 클 때 스펙트럼 분석기에 나타나는 모양. ④파의 두 점 사이의 전파 시간.
"포럼/컨소시엄 표준, -標準, Forum Specifications",,"몇몇의 복수 기업들이 자발적으로 참여하여 포럼 또는 컨소시엄을 구성하여 제정하는 표준. 시장의 요구사항을 반영하여 시장 확산 및 정보공유를 위해 제정하는 경우도 있으며, 단일 표준이 시장을 지배하지 못한 경우 동일 분야에서 복수의 포럼을 구성하여 패권을 다투는 경우도 있다. 포럼/컨소시엄 표준은 시장에서 승리하여 시장 표준이 되거나 공식 표준화 기구에 제안하여 공식 표준이 된다. 이와 같은 의미에서 잠정 표준이라 하고 명칭을 규격(Specification)이라 한다."
"포레스트, forest",,트리에서 뿌리 노드를 제거하면 발생하는 n개의 분리된 트리들. 
"포마, Freedom of Mobile Multimedia Access, FOMA",,"일본 NTT 도코모사의 W-CDMA 방식 이동 통신 서비스. 무선 인터넷에서 단순한 문자 전송의 기능을 넘어 동영상이나 음악 등 다양한 미디어 기능을 제공한다. 384Kbps(패킷 통신)와 64Kbps(64K 데이터 통신)의 데이터 전송 속도를 가진 무선 데이터 통신이 가능하고, 각종 동영상이나 멀티미디어 서비스도 활용할 수 있다. 또 무선 인터넷 아이모드(i-Mode) 서비스 등 다양한 콘텐츠를 확보하고 있다."
"포맷, format","동의어 : 형식, 서식, 틀잡기","① 미리 정해진 자료의 배치 방식. 각 항목의 위치, 간격, 구두점, 행 등의 정보가 이에 해당한다.  ② 데이터의 저장이나 전송 시의 구성 방법. 특히 자료를 파일로 저장할 때 그 파일의 구조를 말한다. ③ 각종 문서를 작성할 때 입력한 문서의 좌우 여백 조정, 간격 띄우기, 오른쪽 줄맞춤 등을 하여 문서를 보기 좋게 가지런히 맞추는 것(서식)."
"포맷 시프팅, format shifting",,동일한 미디어 파일을 다른 장치에서도 보고 들을 수 있도록 파일 포맷이나 비디오·오디오 부호화 포맷과 같은 데이터 압축 포맷으로 변환하는 것. 예를 들어 엠피3(MP3) 플레이어에서 콤팩트디스크(CD)의 음악을 듣기 위해 CD 포맷을 MP3와 같은 디지털 포맷으로 변환하는 절차가 필요하다.
"포스퀘어, Foursquare",,"포스퀘어(Foursqure)사의 위치 기반 소셜 네트워킹 서비스(SNS, 누리소통망 서비스). 사용자가 방문한 장소를 체크-인(check-in)하여 그곳에 대한 평가나 추천하고 싶은 내용을 친구와 공유하고 체크-인에 대한 보상으로 점수를 얻거나 뱃지를 받고 메이어(Mayor)가 된다. 메이어에게는 업체가 무료 혜택을 주며 더 많은 체크인을 하는 사람에게 지위를 빼앗을 수 있는 게임 같은 성격도 있다. 포스퀘어는 2009년부터 서비스 되었고, 2013년말에 4,500만의 등록 이용자가 있으며, 2014년 7월에 포스퀘어 8.0이 서비스되기 시작했다."
"포스트, post",,①전자 우편 통신망으로 상대편에게 메시지를 전달하거나 뉴스그룹에 기사를 투고하는 것. ②한 단위의 기본 정보를 레코드에 삽입하는 것. ③컴퓨터의 게시판(bulletin board)이나 온라인 포럼의 메시지 난에 메시지를 첨가하는 것.
"포스트 PC, post PC",,"일반적으로 서브노트북, PDA, 휴대전화, 정보가전 등을 통칭. 문서작성, 전자우편, 인터넷 검색 등과 같은 PC의 주요기능을 충실히 제공하면서도 언제 어디서나 이용할 수 있는 이동성과 휴대성의 유비쿼터스가 강조되며, 생활의 필수품으로서 단순하면서도 사용이 간편하고 저렴한 기기들을 의미한다. Post PC는 관점에 따라 인터넷 정보단말, 정보단말, Non-PC, PC-Plus, 또는 Consumer NC 등으로 불리기도 한다."
"포스트넷, Postal Numeric Encoding Technique, PostNet",,"우체국 택배와 국제 특별 수송(EMS)을 강화하기 위해 우편물에 RFID 칩을 달아 언제 어디서나 실시간으로 그 우편물의 위치를 확인할 수 있는 우편 물류 시스템. 우편물 위치 실시간 안내, 배달 예정 시간, 배달 완료 문자 메시지 서비스(SMS), 웹상에서 우편물 픽업 신청에 따른 직원의 방문 접수 등의 정보를 제공한다."
"포스트스크립트, PostScript",,"미국 어도비사에서 개발한 페이지 기술 언어(PDL). 매끄럽고 섬세한 고품질 글자체(font)와 도형의 이미지를 프린터에 인쇄하거나 화면에 표시할 수 있게 한다. 1984년에 이 언어의 명세가 공표되고, 1985년에 이 언어의 번역기(interpreter)를 내장한 레이저 프린터가 애플 컴퓨터사에서 발매되어 큰 호평을 받았으며 그후에 많은 프린터에 탑재되어 포스트스크립트는 업계 표준이 되고 있다. 한글이나 일본어 등의 텍스트도 기술할 수 있도록 언어 명세의 확장이 이루어졌다. 포스트스크립트의 특징은 출력 장치의 해상도에 의존하지 않고 영어와 비슷한 명령어를 사용, 페이지의 배열을 제어하고 윤곽 글자체(outline font)를 불러내어 그 크기를 조절할 수 있는 점이다. 당초에는 페이지 프린터용으로 개발되었으나 프린터와 모니터 양쪽에서 사용될 수 있도록 기능이 확장된 디스플레이 포스트스크립트(Display PostScript)도 발매되고 있다. 또 MS-DOS나 매킨토시 등의 다른 환경에서 가동하는 응용 소프트웨어 간의 파일 전송 형식으로서 밀봉형 포스트스크립트(ESP)가 널리 이용되고 있다."
"포스트스크립트 글자체, -字體, PostScript font",,"포스트스크립트 페이지 기술 언어의 규칙에 따라서 정의되고 포스트스크립트 호환 인쇄기로 인쇄되는 것을 목적으로 하는 글자체. 글자체의 매끄러움, 섬세함 및 식자업계에서 확립되어 있는 품질 규격에 대한 충실함에서 비트 맵 글자체보다 뛰어나다. 그래픽 사용자 인터페이스(GUI)의 비트 맵 문자와 같이 화면상에 나타나는 글자체는 화면 자형(screen font)이라고 불린다. 화면 자형으로 표시된 문서가 포스트스크립트 인쇄기로 보내지면, 인쇄기는 포스트스크립트 글자체가 존재하면 포스트스크립트 버전을 사용한다. 포스트스크립트 글자체는 존재하지 않지만 컴퓨터에 포스트스크립트 버전이 설치되어 있는 경우에는 글자체가 컴퓨터에서 프린터로 내려받기된다. 프린터나 컴퓨터에도 포스트스크립트 글자체가 설치되어 있지 않은 경우에는 비트 맵 글자체가 포스트스크립트로 변환되어 인쇄기는 비트 맵 글자체를 사용하여 텍스트를 인쇄한다."
"포스트앰블, postamble",,자기 테이프에서 각 블록 끝에 기록되어 있는 역방향 판독 시의 동기를 목적으로 하는 2진 문자의 열. 자기 테이프 디스크 장치 등에서 1군의 데이터 종단에 부가된 동기용 신호를 말한다.
"포스트 양자 암호, -量子暗號, Post-Quantum Cryptography, PQC","동의어 : 양자 내성 암호, quantum-safe, quantum-registance","양자 컴퓨터(quantum computer)를 이용한 해킹(hacking)으로부터 안전한 비대칭 키 암호 알고리즘.양자 컴퓨터가 등장한 이후(post-quantum) 그에 따른 위협에 대응하기 위한 비대칭 키 암호 알고리즘을 말한다.암호기법은 크게 대칭 키 암호 알고리즘(symmetric key algorithm)과 비대칭 키 암호 알고리즘(asymmetric key algorithm)으로 나눈다. 양자 컴퓨터를 이용한 해킹에 대응하기 위하여 대칭 키 암호 알고리즘은 키 크기를 2배로 늘려 이전과 동일한 수준으로 안전성을 확보한다.반면, 비대칭 키 암호 알고리즘 중 가장 많이 이용하는 RSA에서 사용하던 소인수 분해 문제가 양자컴퓨터에 의하여 무력화됨이 쇼어 알고리즘(Shor’s algorithm)으로 증명되었다. 이를 해결하기 위한 새로운 방법으로 제시된 것이 양자의 중첩, 얽힘 그리고 복제 불가능성과 같은 특성을 활용한 양자 암호(quantum cryptography)와 기존 암호 알고리즘처럼 새로운 수학적 난제(어려움)를 활용한 양자 내성 암호(PQC: Post-Quantum Cryptography)다.양자 내성 암호(PQC)는 기반이 되는 수학적 난제에 따라 격자 기반 암호(lattice-based), 코드 기반 암호(code-based), 다변수 기반 암호(multivariate-based), 아이소제니 기반 암호(Isogeny-based) 그리고 해시 기반 전자서명(hash-based)의 5가지 분야로 구분한다. 각각의 방식을 이용하여 여러 암호 알고리즘을 개발한다.미국 국립표준기술연구소(NIST: National Institute of Standards and Technology)에서 PQC와 관련한 표준을 만들고 있으며, 2020년에 3라운드 진출 알고리즘 7개를 공개하였다. 이 중에서 최종 PQC 표준 알고리즘을 선정한다.※ 참고: 미국 NIST의 PQC와 관련한 표준화 일정- 2016년 PQC 표준을 만들기 위한 공모 시작- 2017년 12월 1라운드 시작 (69개 알고리즘)- 2019년 1월 2라운드 시작 (26개 알고리즘)- 2020년 7월 3라운드 시작 (결선 진출 7개, 후보 8개 알고리즘) (결선 진출 7개 – 공개 키 암호와 키 교환 용(用) 알고리즘 4개, 전자서명 용(用) 알고리즘 3개)- 2024년 최종 PQC 표준 알고리즘 선정"
"포스트 오피스 프로토콜, Post Office Protocol, POP",,"전자 우편 서버에 접속하여 전자 우편을 내려받기하기 위하여 사용하는 프로토콜. 보통 전자 우편의 송수신에는 간이 전자 우편 전송 프로토콜(SMTP)을 사용하는데, 이 경우에 사용자의 컴퓨터가 가동하고 있지 않으면 메시지를 수신할 수 없다. 예를 들면, 출장 중에 출장지에서 자기 앞으로 보내온 전자 우편을 무릎형 컴퓨터로 내려받기하고 싶을 때에는 포스트 오피스 프로토콜(POP) 클라이언트인 무릎형 컴퓨터에서 POP 서버인 본사 사무실의 전자 우편 서버에 접속하여 사용자 ID와 암호에 의한 인증(authentication) 후에 전자 우편의 내려받기를 한다. POP, POP2, POP3의 버전이 있으며, 같은 POP이라도 서버와 클라이언트의 버전이 다르면 서버에 접속할 수 없다."
"포인트 오브 케어, Point of Care, PoC",,"이동 전파 식별(Mobile RFID) 서비스 모델의 하나로, 현장에서 즉각 진료가 가능하도록 실시간으로 진료 기록ㆍ처방ㆍ검사 결과ㆍ투약 기록 등 임상 정보를 등록 및 조회할 수 있는 의료 정보 시스템. POC는 환자의 진료 과정이 신속하게 이루어져야 한다는 기본적인 목적을 충실히 수행하기 위한 진료 정보 시스템의 하나로, 데스크톱 환경의 진료 시스템을 대체하는 것이 아니라 상호 보완적이며 유기적인 관계를 가지고 있다."
"포인트캐스트, PointCast",,"사전에 사용자가 지정한 특정 분야의 뉴스 기사 모음을 서버가 자동적으로 각 사용자에게 발신하는 인터넷 서비스. 사용자가 클라이언트 소프트웨어인 월드 와이드 웹 브라우저로 서버에 접속하여 서버상에 있는 정보를 인출하는 월드 와이드 웹 서비스나 기타 사용자의 검색 조작에 의해 정보를 인출하는 이른바 풀형(pull type)의 다른 인터넷 서비스와는 달리, 포인트캐스트는 푸시 기술에 의한 푸시형(push type) 서비스이므로 클라이언트로부터의 요구가 없어도 서버가 자동적으로 해당 뉴스 기사를 올려주기(upload)한다."
"포인팅 벡터, Poynting vector",,"공간에서 방사 전계와 방사 자계는 상호 직각이며, 그 위에 그 양쪽의 전파 방향이 직각인데, 이와 같을 때 전파 방향에 직각인 단위 면적을 통과하여 흐르는 전자 에너지. 전계 강도를 E[V/m], 자계 강도를 H[A/m]로 하면, 회로에서 전압×전류가 전력으로 나타나듯이, 전계 강도×자계 강도(E×H) 또한 전력을 나타내는 것이다. E와 H의 곱 W는 W＝E×H[V/m/A/m]＝E×H[VA/m2]=E×H[W/m2]로 되어, 이것은 전류의 흐름에 의해 1m당 흘러나오는 전력, 즉 포인팅 벡터를 나타내고 있다. 그러나 전계 강도 E와 자계 강도 H의 비는 항상 일정한 E/H＝120π이므로 H＝E/120π [A/m]란 관계가 성립된다. 120π인 값은 자유 공간의 임피던스에 해당한다. 따라서 W＝E2/120π[W/m2]로 되어 전계 강도를 알면, 그 장소를 통과하는 포인팅 벡터가 계산된다. 포인팅 벡터는  존 헨리 포인팅(John Henry Poynting)이 처음 제시하였다. "
"포인팅 키패드, Pointing Keypad",,스마트폰을 비롯한 모바일 기기에서 사용자가 터치키패드(또는 스크린)에서 문자를 입력하면서 전환 동작 없이 기존 마우스포인터(또는 커서)를 자유롭게 움직이도록 해 줌으로 모바일 기기에서도 문서의 편집이 편리하게 하는 유저인터페이스(UI). 스마트폰과 스마트패드 등에 적용하면 작은 화면 내에서 손가락 터치와 드래그만으로 커서를 마음대로 이동시킬 수 있을 뿐 아니라 블록설정과 복사 및 붙이기 등 다양한 편집 기능을 이용할 수 있다.
"포즈 키, pause key",동의어 : 쉼글쇠,"IBM 키보드 및 호환 기종의 키보드에 있는 키로, 프로그램이나 명령의 동작을 일시적으로 중지시키는 데 사용하는 것. 예를 들면, 복수 화면에 걸치는 목록이나 문서를 읽을 수 있도록 스크롤링(scrolling)을 중지시키는 데 사용된다. 또한 현행 동작을 중지시키는 다른 어떤 키를 가리키기도 한다. 예를 들면, 대부분의 게임 프로그램에는 게임을 일시적으로 중단시키는 포즈 키가 있는데 이것을 단순히 P 키라고 부르거나 표시하는 경우가 많다."
"포직스, Portable Operating System Interface for Computer Environment, POSIX",,"컴퓨터 처리 환경을 위한 이식 가능한 운영 체제 인터페이스로, IEEE P1003 기술 위원회에서 작성한 컴퓨터 운영 체제 서비스의 표준. 당초에는 유닉스 사용자 그룹이 유닉스를 기반으로 표준화 작업을 시작하였으나, 미국의 국내 표준인 ANSI 표준으로 제정할 목적으로 IEEE가 인계하여 추진하게 되었다. P1003 기술 위원회는 여러 개의 작업반을 구성하여 주제별로 표준화를 추진한다. 대표적인 것으로는 ㉠ POSIX.0(포직스(POSIX) 개방 시스템 환경에 대한 전반적 지침), ㉡ POSIX.1(커널(Kernel), 운영 체제 인터페이스), ㉢ POSIX.2(셸(shell)과 툴(tool), 사용자 명령 등), ㉣ POSIX.3(표준 규격의 적합성 검증법), ㉤ POSIX.4(실시간 POSIX 확장), ㉥ POSIX.5(에이다(Ada) 언어), ㉦ POSIX.6(보안 기능) 등이다. 이 중에서 POSIX.1은 1988년에 ANSI/IEEE 1003.1 표준과 연방 정보 처리 표준(FIPS)으로 채택되고, 이어서 1990년에 ISO/IEC 9945-1로서 국제 표준화되었다. POSIX라고 하면 POSIX.1을 가리키기도 한다. POSIX 표준은 유닉스를 기반으로 하였으나 다른 운영 체제에도 쉽게 이식될 수 있다."
"포착 시행 후 응답률, 捕捉試行後應答率, answer bid ratio",,"통신망의 관리를 위해 ITU-T가 정한(권고 E.411) 망 성능 파라미터의 하나. 자국을 포함한 망의 트래픽 소통 상황을 표시하기 위해 응답 신호 수신 횟수에 대한 포착 시행 횟수 비의 백분율로 표시한다. 보통 회선망에서는 착신국(國)으로의 직통 경로, 우회 경로를 포함하여 자국에서 상대국의 국내망까지 포함한 트래픽 응답률을 쓰고 있다."
"포착 신호, 捕捉信號, seizing signal, seizure signal",,"착신 장치를 기동시켜 계속 보내오는 선택 신호의 수신 준비를 하기 위하여, 또는 착신 측에 착신을 표시하기 위하여 발신 장치로부터 송출되는 제어 신호의 일종. 이 신호는 선택 신호의 첫머리 부분으로 겸용되는 때도 있다."
"포착 전조, 捕捉前兆, seizure precursor",,역방향 제어 채널을 통하여 이동국에 의해 기지국으로 전송되는 초기 디지털 시퀀스.
"포커스 그룹, focus group",,"ITU-T 산하 연구반의 활동을 돕고, ITU 회원이 아닌 외부 전문가의 참여를 장려하여 신속히 해결해야 할 특정 과제를 수행하기 위해 설립한 조직. 2006년 말 현재 NGNM, IPTV 등 5개 포커스 그룹이 활동하고 있다."
"포켓 PC, Poqet PC",,"미국 포켓 컴퓨터(Poqet Computer)가 1989년 발매한 무게 1.5kg의 휴대용 IBM PC. 가로 23cm, 세로 10cm, 높이 2cm 정도의 소형이면서도 램(RAM) 512kB의과 롬(ROM) 640kB의 용량을 제공한다."
"포켓 뱅킹 서비스, pocket banking service",,"IC 칩이 담긴 유에스비(USB) 포켓 단말기를 통해 이루어지는 금융 서비스. 융합, 보안, 휴대성이라는 금융의 3대 트랜드를 반영한 e-금융 서비스로 실생활에서 사용하던 지갑을 전자적으로 구현한 서비스다. 기존 인터넷 뱅킹이 브라우저를 통해 웹에 접속한 데 비해, 포켓 뱅킹 서비스는 IC 칩이 내장된 USB 형태의 단말기를 통해 개인 맞춤형 인터넷 뱅킹을 제공한다."
"포켓 벨, pocket bell",,일반적인 이용에 제공되는 페이징용 수신기의 총칭. 1대의 수신기로 한 사람의 호출만을 받게 되는 것과 서로 다른 벨음으로 구별하여 두 사람으로부터의 호출을 받을 수 있는 것의 2종류가 있다. 후자를 듀얼 콜(dual call)이라 부른다.
"포크, -, fork","동의어 : 분기, 갈래","①다중 프로그래밍 시스템에서 수행하는 프로세스가 자신의 가지 프로세스를 하나 만드는 것. 이는 새로운 프로세스를 생성하는 기본 연산 중의 하나다. ②유닉스 운영 체계의 시스템 호출 중 한 가지로, 현재 수행하는 프로세스와 똑같은 프로세스를 원래 프로세스의 가지 프로세스로 만들어 내는 것.③기존 블록체인 플랫폼의 기능을 추가하거나 성능을 개선하는 행위.블록체인 플랫폼의 기능을 개선하고, 보안 위협을 해결하기 위해 새로운 암호기술, 합의 기법 등을 적용할 때 이전 블록체인과 구별하려고 분기(分歧)되었다고 한다. 포크는 기존 블록체인과의 호환성 유무에 따라 소프트 포크(soft fork)와 하드 포크(hard fork)로 나뉜다. 소프트 포크는 새로운 블록 생성 규칙을 적용한 블록을 기존 블록체인에 연결하는 것을 말한다. 이 생성 규칙은 네트워크 참여자 간에 합의로 결정되며, 이전 블록체인과 호환한다. 따라서 네트워크 참여자들이 무조건 새로운 블록 규칙을 적용할 필요는 없다. 하드 포크는 기존 블록체인에 새로운 블록 생성 규칙을 적용한 블록을 연결하지 않고 새로운 블록체인을 시작하는 것을 말한다. 이전 버전과 호환성을 유지하지 않고 완전히 독립적으로 운영되기 때문에 네트워크 참여자들은 반드시 새로운 블록 생성 규칙을 적용해야 한다. 만약 하드 포크 적용에 문제가 생기면 모든 참여자들은 이전 블록 생성 규칙으로 되돌려야 한다. "
"포털 마크업 언어, --言語, Portal Markup Language, PML",,"포털 웹 사이트를 구성하는 제품의 특징을 기술하는 확장성 마크업 언어(XML). 시스템에 의해 관리되는 정보 객체, 사용자, 단체, 접근 제어 신청 및 통지에 관한 표준 방법을 통해 정보를 교환할 수 있고, 정식 문서형 정의(DTD)에 의해 작성된다."
"포털 사이트, Portal Site, PS",동의어 : 들머리 사이트,"이용자가 웹 페이지에 접속할 때 최초로 들어가는 사이트(곳). 웹 브라우저는 초기 설정에서 브라우저ㆍ벤더의 사이트를 표시하도록 되어 있다. 허브, 관문국(게이트웨이) 등으로 부르기도 한다. 포털 사이트의 예로는 검색 사이트나 신문사 뉴스 사이트, 브라우저ㆍ벤더 사이트 등을 들 수 있다. 이용자의 접속이 집중되기 때문에 광고 매체로도 주목받는다. 포털 사이트로 설계된 페이지에는 이용자가 원하는 정보에 쉽게 접속하도록 분야별 연결 주소나 최신 뉴스, 일기 예보, 스포츠 정보 등 일반인의 관심이 높은 화제가 게재되어 있다. 정보를 통틀어서 취급하는 종합적인 사이트와 달리 음악, 여행 정보 등 목적별로 특화된 사이트를 목적(destination) 사이트라 부른다. 종합적인 포털 사이트는 격심한 경쟁은 없다 하더라도 목적 사이트의 콘텐츠를 도입해서 내용을 충실하게 한다."
"포털 소프트웨어, portal software",,"인트라넷의 포털을 만드는데 사용되는 개발 도구. 다음과 같은 4가지 형태가 있다. ㉠디지털 대시보드 포털: 다양한 애플리케이션의 시작 길라잡이와 요약 정보 제공 ㉡pure-play 포털: 다수의 플랫폼의 접근이 가능한 이식성 인터페이스 제공과 이메일, 원조 도구, 자원 계획 도구 등 다양한 비즈니스 생산성 애플리케이션의 중앙 접근점으로서 다양한 기능 제공 ㉢애플리케이션 포털: 포털 인터페이스와 함께 사용되는 작업반 소프트웨어와 같은 광범위한 도구들을 말하며, 대부분의 공통 애플리케이션이 이 분류에 속함 ㉣기반 구조 포털: pure-play 포털과 유사하나 기업 내에서 개발한 특수 기술과 관련된 이식성이 아닌 포털"
"포털 컴퓨팅, portal computing",,"비즈니스를 통합하여 고객, 협력 업체, 공급 업체, 직원 등을 연결하는 기술로 기존의 클라이언트/서버 컴퓨팅 및 웹 컴퓨팅이 발전한 형태. 클라이언트 컴퓨터와 이기종(異機種) 시스템을 연결할 수 없는 한계에 부딪힌 클라이언트/서버 컴퓨팅의 대안이 됐던 웹 컴퓨팅도 이기종 시스템 연결에 많은 시간이 소요되므로 별도의 프로그램을 필요로 했다. 포털 컴퓨팅은 클라이언트와 이기종 백 엔드 시스템의 가교 역할을 하는 미들웨어 계층을 제공하므로 이런 문제점들을 해결한다."
"포토닉스, photonics",,"일렉트로닉스(Electronics)와 같은 개념으로 전자대신 광자를 다루는 학문. 광의 비접촉, 병열성, 초고속, 광대역, 발광특성으로 통신 등 여러 산업분야에서 활용되고 있는 핵심적인 기술 분야이다."
"포토닉 잉크, photonic ink, p-ink",,"스위치의 동작으로 색상이 자유자재로 바뀌는 잉크. 무지개 스펙트럼의 모든 색조를 나타낼 수 있고, 변화하는 이미지들을 보여 주는 신문이나 검출 대상 물질에 따라 색조를 달리하는 화학적 센서에 활용된다. P-ink 색은 회절(Diffraction)을 통해 약 300 나노미터 직경의 이산화규소(SiO2) 공들로부터 반사된 빛의 간섭 현상에 의해 특정 파장들의 빛은 상쇄 소멸되고 반사된 빛이 특정의 색을 띠게 된다. 이 공들은 액체에 가라 앉으면서 콜로이드 결정이라 불리는 배열을 형성하고. 잉크의 색상은 공들의 층 사이에 끼워 있는 고분자 젤(Gel)이 부풀고 수축하는데 따라 공들의 간격이 반사되는 빛의 파장을 결정해 색상이 연속적으로 조절된다."
