"머니퓰레이터, manipulator",,"인간의 팔과 유사한 동작을 하는 로봇의 기구. 보통 여러 개의 자유도를 가지며 대상물(부품 또는 공구)을 붙잡거나 옮길 목적으로, 서로 상대적인 회전 운동이나 미끄럼 운동을 하는 관절의 연결로 구성된 기구이다. 머니퓰레이터는 운전자, 프로그램이 가능한 전자식 조종 장치(controller) 또는 논리 시스템에 의해 제어되며, 말단 장치를 포함하지 않는다."
"머드 게임, Multi-User Dungeon, MUD",,"통신망을 통해 동시에 여러 명이 진행하는 게임의 한 가지. 어드벤처, 롤 플레잉, 시뮬레이션 게임 등이 있다. 사용자는 머드 게임(MUD)을 제공하는 서버 컴퓨터에 접속한 후에 각각 하나의 역할을 맡아 3차원 시뮬레이션을 통해 복잡하게 얽힌 가상 세계에서 자신의 역할을 수행한다. 그 가운데는 계속 진행되는 모험 게임도 있고, 교육적인 목적의 게임도 있으며 단순히 친목 도모를 위한 게임도 있다."
"머드플레이션, MUDflation",,머드(MUD) 게임과 인플레이션(inflation)을 결합하여 만든 용어로 게임에서만 나타나는 경제적인 현상. 시중의 통화는 늘어나는 데 비해 아이템의 가격은 고정되어 있는 데서 벌어지는 현상으로 최근에 획득한 아이템이 기존의 아이템 가치를 현저히 상실하게 만들 때 발생한다.
"머레이 부호, -符號, Murray code",,모스 부호와 비슷하나 각각의 문자가 마크 및 스페이스로 구성된 5개의 비트로 이루어진 부호. 각 문자는 시작 또는 스톱 비트로 분리된다. 주로 고속 자동 전신에 쓰인다.
"머리디언 무손실 압축, -無損失壓縮, Meridian Lossless Packing, MLP",,"영국 머리디언(Meridian)사가 개발한 DVD 오디오의 표준 압축 기술. PPCM(Packed-PCM)이라고도 한다. 데이터의 일부를 제거해 압축하는 것이 아니라 데이터 사이사이의 비는 공간에 부족 부분의 데이터를 옮겨 놓아 데이터의 압축률은 2분의 1밖에 되지 않지만 좀 더 원음에 가깝게 재생할 수 있는 방식이다. 이 기술은 하나의 샘플에 대략 8비트의 정보를 압축하는데, 이것은 24비트의 데이터가 압축하지 않은 16비트 데이터와 같은 공간을 차지한다는 것을 의미한다. 샘플링 주파수는 2채널인 경우 24비트 192kHz, 6채널인 경우 96kHz이다."
"머리부, -部, header",,"①데이터의 선두에 놓인 문자군. 머리부에 계속되는 데이터의 내용, 성격을 식별 또는 제어하기 위하여 사용된다. ②필드나 레코드의 수 등과 같은 데이터 파일에 관한 정보를 담고 있는 데이터베이스 파일의 한 부분. 디베이스 Ⅲ 플러스(dBASE Ⅲ PLUS)에 의해 관리된다."
"머리부 형식, -部形式, header format",,"컴퓨터 통신에서 쌍계층 간의 메시지는 머리부 부분과 상위 계층에서 전달받은 데이터 부분 및 후미 부분 등으로 나뉘는데, 이때 머리부 부분의 형식을 가리키는 용어. 대개 근원지 주소, 목적지 주소, 머리부 길이, 서비스 형식, 명령어, 옵션, 검사 합 등의 자릿수를 지정한다."
"머리 전달 함수, -傳達函數, Head Related Transfer Function, HRTF",,"인간의 머리와 두 귀의 형상에 따른 음향 신호의 상관관계를 표현한 수학적 함수. 3차원 오디오 지각은 단순한 경로 차이보다는 머리 표면에서의 회절, 귓바퀴의 굴곡들에 의한 반사 등 복잡한 경로상의 특성이 음의 도래 방향에 따라 변화하는 현상에 의한다. 이러한 입체 음향을 만들기 위하여 HRTF가 주로 이용되고 있다."
"머리 착용 디스플레이, -着用-, Head Mounted Display, HMD","동의어 : 헤드 마운티드 디스플레이, 헬멧형 디스플레이, 두부 장착형 디스플레이, 머리 장착형 영상장치","머리에 착용하는 형태의 디스플레이. HMD 장치를 머리에 쓰면 양쪽 눈의 근접한 위치에 소형 디스플레이가 있어 시차를 이용한 삼차원(3D) 영상이 투영된다. 사용자의 움직임을 트래킹하는 자이로 센서, 움직임에 따라 영상을 만드는 렌더링 기능 등으로 사용자는 3D 공간에 있는 것 같은 가상 현실(VR) 또는 증강 현실(AR)을 실감할 수 있다. HMD는 게임뿐만 아니라 산업, 우주 개발, 원자로, 군사 기관 및 의료 기관 등 다양한 분야에 활용된다. 최초의 HMD는 1968년 컴퓨터 그래픽스 창시자인 이반 서덜랜드(Ivan Sutherland) 교수가 만든 것으로 알려져 있다. HMD 기기는 구글 카드보드(Google cardboard), 삼성 기어 VR(GearVR) 등과 같은 스마트폰 장착형 HMD와 오큘러스 리프트(Oculus Rift), HTC VIVE 등과 같이 PC와 연결되는 데스크톱형 HMD, 소니 PSVR과 같이 게임 콘솔 연결형 HMD, 각종 센서들을 HMD에 부착한 혼합 현실형(MR) HMD 등이 있다."
"머리 추적, -追跡, head tracking",,"가상 현실(VR) 머리 착용 디스플레이(HMD)에서 사용자 머리의 움직임을 추적하는 기술. 사용자의 머리 중심을 3차원 좌표계의 원점에 두고, 전후좌우상하 움직임을 추적하여 HMD 화면에 반영한다. 머리가 움직이는 대로 화면이 자동으로 바뀐다. 머리 움직임에 따른 위치 값을 파악하기 위해 가속도 센서(accelerometer sensor), 자이로 센서(gyroscope sensor), 자기장 센서(magnetometer sensor) 등이 사용된다. 각 축(x, y, z)을 중심으로 한 회전각은 자이로 센서로 측정하고, 움직임 거리는 가속도 센서로 측정한다. 움직임 거리는 대부분 회전각의 보조 정보로 이용된다. 자기장 센서로 방향의 기준을 잡는 경우도 있으나 자성 물질에 의해 쉽게 교란될 수 있어 제한적으로 사용된다. 별도의 적외선 카메라를 이용한 위치 추적(positional tracking)이 사용되기도 한다. "
"머시니마, machinima",,"기계(machine), 영화(cinema), 애니메이션(animation)의 합성어로 게임을 통해 만들어진 영화 예술 장르를 가리키는 말. 일반적으로 특정 게임에 사용된 컴퓨터 그래픽스(CG) 기술이나 게임 엔진, 애니메이션 소프트웨어를 기반으로 만들어진 영화를 뜻한다. 전통적인 영화가 실존하는 배우 및 배경과 오랜 제작 기간 및 엄청난 부대 비용을 요구하는 단일 스토리인 반면, 머시니마는 3차원 CG 등 첨단 기법에 의해 배우와 배경이 사이버상으로 단기간 내에 형성되고 성우 더빙 등만 거치면 되므로 상대적으로 제작비 및 제작 기간이 적게 들 뿐만 아니라 멀티 스토리를 가질 수 있는 장점이 있다."
"머클 트리, -, merkle tree","동의어 : 해시트리, 이진트리, 이진 해시트리","블록체인에서 블록 하나에 포함된 모든 거래 정보를 요약하여 트리(tree) 형태로 표현한 데이터 구조.블록체인에서 블록의 바디(body)에 포함된 모든 거래 정보를 특정 크기 단위별로 암호화 기법(예: SHA-256)을 적용하여 여러 단계(round)를 거쳐 해시값을 만든다. 이 해시값들이 트리 형태이고, 1979년 고안자 랄프 머클(Ralph Merkle)의 이름에서 따와 머클 트리라고 부른다.이 머클 트리의 최상위에 위치하는 해시값을 머클 트리 루트(merkle tree root)라고 한다. 기존의 이진 트리 구조가 부모 노드에서 자식 노드로 향하는 구조였다면, 머클 트리는 자식 노드에서 부모 트리로 상향하는 구조이다.머클 트리 루트를 생성하는 과정은 다음과 같다. - 먼저 블록 내의 모든 거래 정보들의&nbsp;해시값을 계산한다. (이 해시값을 리프(leaf) 데이터라고 부른다.)- 두 개의 리프 데이터를 연결하여 해시값을 구한다. (이 해시값은 리프 데이터에 대한 부모 데이터라고 한다.)- 쌍을 지을 수 없을 때까지 상향식으로 반복하여 해시값을 구한다. 이때 최종 해시값이 머클 트리 루트이고 블록의 헤더(header)에 포함된다."
"먹거리테크, food technology, foodtech",동의어 : 푸드테크,"최신 정보기술(IT)을 활용한 음식 관련 서비스를 칭하는 신조어. 빅 데이터, 블루투스 비콘(beacon), 온오프라인 연결 비즈니스(O2O) 등과 같은 최신 IT를 활용하여 사용자에게 맛집 추천, 식당 예약, 음식 주문 등의 서비스를 편리하게 제공한다."
"먹임 구멍, feed hole",,①위치 결정이 가능하도록 데이터 매체에 천공된 구멍. ②종이 테이프를 테이프 판독기로 읽을 때 종이 테이프를 한 자씩 앞으로 진행시키기 위해 톱니가 걸리도록 한 구멍. 먹임 구멍의 직경은 약 1.2mm로서 정보 기억을 위한 구멍보다는 작다.
"먼셀 기호, -記號, munsell number",,"미국의 화가인 먼셀(A. H. Munsel)이 고안한 색표에 입각한 색상 표시법. 10가지 색상을 10진법의 명도(V), 색상(H), 채도(C)로 구분하여 만든 척도에 따라 모든 무채색과 유채색을 좌표적으로 위치시킨다. 국제적으로 가장 권위있는 색의 표시법이다."
"멀덱스, muldex",,"멀티플렉서(multiplexer)와 디멀티플렉서(demultiplexer)의 합성 단축어로서, 동일한 장치 내에 멀티플렉서와 디멀티플렉서가 결합되어 있을 때 사용되는 말. 장치를 설명할 때에는 장치의 기능에 따라 펄스 부호 변조(PCM) 멀덱스, 데이터 멀덱스와 같이 그 명칭을 한정시켜야 한다."
"멀토스, Multi Application Operating System, MULTOS",,마스터 카드사의 칩 카드 전략의 핵심 요소이자 세계 각국이 전자 화폐의 기반 기술로 받아 들이고 있는 운영 체계. 발급 당사자인 각 금융 기관들의 요구 사항을 거의 수용할 수 있는 개방형 플랫폼을 제공하고 있다. 또한 방화벽 기능을 통해 응용 서비스 간 상호 간섭하는 것을 배제함으로써 여타 응용 서비스와 무관하게 서비스 간 독자적인 보안 체계를 구축할 수 있도록 설계되어 있다. → MAOSCO.
"멀티 드로퍼, Multi Dropper",,"컴퓨터에 다운로드 되면, 추가로 수십 개의 다양한 악성코드를 생성하는 악성코드. 이런 악성코드는 각종 트로이목마(Trojan Horse)와 루트킷(Rootkit), 애드웨어(Adware) 등을 포함하고 있어 감염을 통하여 10여 개 이상의 다양한 악성코드나 스파이웨어 등이 PC에 설치되기 때문에 컴퓨터 사용에 막대한 지장을 주는 것은 물론 인터넷을 통해 새로운 악성코드를 지속적으로 다운로드 한다. 백신 프로그램이 치료하기 전에 시스템에 손상을 입히는 것은 물론 다양한 변종으로 구성돼 한꺼번에 치료하기 힘들다."
"멀티레벨 메시지, 複數-, multilevel message",,복수의 사용자가 동시에 대화식으로 사용하는 시분할 시스템(TSS: Time-Sharing System)에서 명령에 의해 출력되는 통보 메시지. 이용자에게 개략적인 내용을 전하는 1차 메시지와 상세한 내용을 전하는 2차 메시지로 이루어진다.
"멀티 레벨 셀, 多重-, Multi-Level Cell, MLC",,"플래시 메모리 칩에서 셀(cell)당 다수의 비트를 저장하는 기억소자. 일반적인 플래시 메모리는 셀당 하나의 비트를 저장하는 기술을 사용하지만, 멀티 레벨 셀(MLC)은 트랜지스터의 게이트를 다수의 전압 레벨로 변화시켜 셀당 다수의 비트를 저장하는 기술을 사용한다. 셀당 레벨 수에 따라 저장 능력은 증가하지만 다이(die) 크기는 별로 커지지 않는다."
"멀티레벨 전송 방식, 多-傳送方式, multilevel transmission system",,"디지털 신호를 전송할 때 1 디짓(digit) 당 레벨 수는 보통 2 레벨인데 레벨의 수를 더 늘려 1 디짓당 전송 정보량을 증가시키는 전송 방식. 일반적으로 n 레벨 신호에서 1 디짓당 전송 가능한 정보량은 log2n 비트로 증가되지만, 동시에 잡음에 대한 여유는 2 레벨의 경우에 비해 그것의 1/(n -1)로 감소한다. &nbsp;"
"멀티미디어, multimedia",동의어 : 다중매체,"문자, 음성, 영상을 통합하여 처리하는 미디어 포맷. 기존의 미디어는 기능별로 서비스가 제공되었다. 음성은 통신, 영상은 TV, 데이터는 인터넷을 통해 서비스되었으나 디지털 기술이 실용화되고, 전기통신 기술이 고도화되면서 모든 미디어가 멀티미디어로 진화하게 되었다. 라디오는 음성에 비디오와 데이터 전송이 가능한 디지털 멀티미디어 방송인 DMB로 진화하고, TV도 인터넷을 수용한 IPTV 또는 스마트 TV로 휴대전화도 인터넷과 결합하여 스마트폰으로 진화해 방송은 물론 통신 매체를 포함한 모든 매체가 멀티미디어 서비스를 제공하고 있다."
"멀티미디어 개인용 컴퓨터, -個人用-, Multimedia Personal Computer, MPC",,"미국 마이크로소프트사의 윈도즈로 멀티미디어를 다루는 데 필요한 하드웨어의 조건이나 그 조건을 충족시킨 개인용 컴퓨터(PC). 마이크로소프트사가 중심이 되어 1990년에 멀티미디어 개인용 컴퓨터(MPC) 기준 1(Level 1)을 발표하였다. 사용자가 멀티미디어 대응 하드웨어나 소프트웨어를 쉽게 구입할 수 있도록 하기 위해 1991년에 MPC 지원 단체(MPC Marketing Council)를 결성하여 라이선싱을 개시했다. 1993년에 MPC 기준 2를 발표하고, 1995년에는 동화상 재생 능력의 개선을 중심으로 한 MPC 기준 3을 발표하였다. MPC는 윈도즈 3.1 탑재 PC의 표준적인 하드웨어 규격으로서 자리매김되었다. 1995년에 등장한 윈도즈 95에 관해서는 새로운 하드웨어 규격인 PC 95를 제창하여 그 규격 중에서 멀티미디어 기능에 관해 규정하고 있다. 이어서 1996년에 새로운 규격인 PC 97을 발표하였다. MPC 기준 2와 MPC 기준 3의 주요 내용은 표에서 보는 바와 같고 PC 97의 내용은 해당 항목에 설명되어 있는 바와 같다."
"멀티미디어 객체 전송, -客體轉送, Multimedia Object Transfer, MOT",,"지상파 디지털 멀티미디어 방송(DMB)의 표준 프로토콜의 하나. 텍스트, 정지 영상, 동영상, 오디오 콘텐츠 등을 파일 형태로 전송하면 지상파 DMB 수신기에서 이를 수신해 재생할 수 있도록 한 프로토콜이다. 하나의 DMB 채널로는 노래를 틀어주면서 이와 연동된 다른 데이터 채널을 통해서는 방송 중인 노래와 관련된 그림이나 사진 등을 슬라이드처럼 순차적으로 제공하거나 곡명, 작곡자, 가수, 연주자, 가사, 콘서트 일정 등을 음악과 함께 그림과 문자로 제공할 수 있다."
"멀티미디어 검색, -檢索, Multimedia Search",,"텍스트는 물론 영상, 이미지, 음악 등 원하는 멀티미디어 데이터의 내용을 검색하는 기술. 초기 메타 데이터에 의한 검색 방법에서 색상이나 형태 및 질감과 같이 이미지 자체의 정보를 뽑아내 검색에 이용하는 기술로 진화하고 있다."
"멀티미디어 기능 확장, -機能擴張, MultiMedia eXtension, MMX",,"미국 인텔(Intel)사가 1996년 가을에 출하하기 시작한 펜티엄 마이크로프로세서(개발명: P55C)로부터 멀티미디어 응용 프로그램을 빠르게 처리하기 위하여 내장한 새로운 명령어 집합과 명령 체계의 개선을 가리키거나 이를 채용한 칩의 제품명으로 사용되는 용어. 엠펙-2(MPEG-2) 표준으로 압축한 동영상의 신장(伸長)이나 영상 처리, 3차원 도형 처리 기능 등을 높이기 위하여 추가된 명령어의 수는 모두 57개인데, 인텔사의 80×86 아키텍처의 칩으로서 이렇게 많은 수의 명령어를 추가하고 명령 체계를 개선한 것은 80286에서 80386으로 한 등급 높인 이래 처음이었다. 멀티미디어 기능 확장(MMX)을 내장한 펜티엄 프로세서는 그렇지 않은 펜티엄 프로세서보다 멀티미디어 기능을 구현하는 데 60% 정도의 성능 향상을 보이는 것으로 알려져 있다. 펜티엄의 후계인 펜티엄 프로(Pentium Pro)에도 MMX가 내장되어 있다."
"멀티미디어 기술 위원회, -技術委員會, Committee on Multimedia Technology, CMT",,"대화형 멀티미디어 협회(IMA)와 영화 텔레비전 기술자 협회(SMPTE)가 만든 합동 멀티미디어 기술 위원회. 멀티미디어에 관한 모든 문제를 다루고, 기술보고서 작성, 표준안 제안, 가이드라인 배포, 상품 유통 및 멀티미디어 산업의 상호 운용성 촉진을 목적으로 하고 있다."
"멀티미디어 메시징 서비스, Multimedia Messaging Service, MMS",,"3세대 이동 통신 서비스의 기본 요소로서 정지 영상, 음악, 음성 및 동영상 등의 다양한 형식의 데이터를 주고받을 수 있는 메시징 시스템. 2세대의 단문 메시지 서비스(SMS)의 뒤를 이은 멀티미디어 메시징 서비스(MMS)는 기존의 미디어 형식 메시지들과 멀티미디어 형식 메시지를 제공하는 것으로, 이 시스템을 사용하여 실시간 전송 요구 없이 사용자들 간에 송수신이 가능하다."
"멀티미디어 방송 다중송출 서비스, -放送多重送出-, Multimedia Broadcast Multicast Service, MBMS",,상용 휴대전화와 기존 이동통신망인 3세대(3G) 이동통신에서 방송용 주파수나 기지국 없이도 모바일 텔레비전을 서비스할 수 있는 기술. 3GPP에서 표준화하였다.
"멀티미디어 서비스, multimedia service",,"문자, 수치 데이터, 화상, 동화(動畵), 음성 등으로 구성된 정보의 교환을 제공하는 전기 통신 서비스. 멀티미디어 통신 서비스와 같은 의미이다."
"멀티미디어 스트리밍 서비스, Multimedia Streaming Service, MSS",,"소리, 음악, 동영상 등의 다양한 멀티미디어 데이터를 스트리밍 방식으로 제공하는 서비스. 스트리밍은 전송되는 데이터를 지속적이며 끊임없이 처리하고 재생 할 수 있는 기술을 말한다. 보통은 파일 전체를 내려받고 난 뒤에 멀티미디어를 재생하여 대용량의 파일의 경우 전체 파일을 내려 받는데에 시간이 오래걸릴 수 있으나, 스트리밍 기술을 이용하면, 파일이 모두 전송되기 이전에라도 멀티미디어 재생이 가능하다."
"멀티미디어 신호 처리 장치, -信號處理裝置, Multimedia Signal Processor, MSP",,"디지털 신호 처리 장치(DSP), 마이컴 및 메모리로 구성되고 그래픽, 사운드, 팩스(모뎀) 기능 등을 원칩화한 고성능 멀티미디어 반도체. 음성 신호의 부호화 및 복호화 기능, 디지털 데이터의 필터링, 데이터의 주파수 및 시각 동기화, RF 부문의 제어 기능 등을 처리하는 이동 통신 단말기의 핵심 부품이다. 다양한 멀티미디어 기능과 디지털 신호 처리 기능을 동시에 수행할 수 있어 DVD, PC, 셋톱 박스, 3D 게임기, 디지털 TV 등에 활용된다."
"멀티미디어 애플리케이션 프로세서, Multimedia Application Processor, MAP",,"멀티미디어 기능을 수행하는 멀티미디어 칩. 디지털 컨버전스 시대를 이끌어 갈 주역으로 PC나 휴대형 기기에서 비디오, 오디오, 데이터 등 다양한 미디어를 실행시키는 핵심으로 원칩화되어 출시되고 있다."
"멀티미디어 운영 체계, -運營體系, multimedia operating system",,멀티미디어 처리를 행하는 운영 체계(OS). 일반적으로 화상 데이터나 음성 데이터의 용량은 문자 정보에 비해서 아주 크다. 이들 모두를 일원적으로 효율이 좋게 처리하는 OS를 말한다. 실제로는 기존 OS에 드라이버나 인터페이스를 추가하여 이용자 및 개발자가 쉽게 취급할 수 있는 환경을 제공하고 있다.
"멀티미디어 인터넷 키교환 방식, - 交換方式, Multimedia Internet Keying, MIKEY",,"멀티미디어 세션 보호를 위한 키 교환 프로토콜. 키 교환 방식으로는 비밀 키, 공개 키, Diffie-Hellman Qkdtlr을 이용한다."
"멀티미디어 전송 통합 프레임워크, -轉送統合-, Delivery Multimedia Integration Framework, DMIF",,"다양한 전송 포맷을 가진 복수의 이종 네트워크 환경에서 엠펙 4(MPEG-4) 콘텐츠를 송수신하기 위한 인터페이스. 공식 명칭은 MPEG-4 Part 6(ISO/IEC 14496-6)이며,&nbsp;MPEG-2에서 제정한 디지털 저장 매체에 명령을 내리거나 이를 제어하는 디지털 저장 매체 명령 제어(DSM-CC: Digital Storage Media - Command and Control) 프로토콜을 확장한 개념이다. DMIF는 멀티미디어 전송 통합 프레임워크(DMIF: Delivery Multimedia Integration Framework) 애플리케이션 인터페이스(DAI: DMIF Application Interface)와 네트워크 인터페이스(DNI: DMIF Network Interface)로 구성되어 있다."
"멀티미디어 처리 시스템, -處理-, multimedia processing system",,"컴퓨터로 취급한 문자나 숫자뿐만 아니라 정지화, 동화상 및 음성 등 다양한 정보 미디어를 취급하는 시스템. 멀티미디어 처리 시스템은 종래에 취급했던 문자 데이터에 비해 정보량이 방대해졌기 때문에 압축 기술이나 읽기 전용 콤팩트 디스크 기억 장치(CD-ROM) 등의 대용량 미디어의 도입이 필요하다. 또 대화적이고 시각적인 처리가 필요하므로 해상도(resolution)가 높은 모니터나 마우스 등의 위치 지정 도구의 도입, 문자 인식 및 음성 인식 등 인식 기술의 충실화, 다양한 기술이나 장치 등이 필요하다."
"멀티미디어 카드, MultiMedia Card, MMC",,"미국의 샌디스크(SanDisk)사와 독일 지멘스(Siemens)사가 공동 개발한 플래시 메모리 카드형 데이터 저장 및 통신 장치. 개인 휴대 정보 단말기(PDA), 디지털 카메라, 스마트 폰, 디지털 레코더, MP3 등 다양한 범위의 기기들에 사용된다. 휴대의 편리함, 저렴한 가격, 탁월한 성능, 메모리 카드 인터페이스를 이용한 낮은 전력 소모, 신속한 데이터 처리 등의 장점이 있다. 멀티미디어 표시관(MMC) 통신은 저전압의 환경에서 작동되는 7핀 시리얼 버스를 기반으로 하고 있으며, 기존의 콘트롤러에 대한 호환성을 높이기 위해 멀티미디어 카드 모드 외에도 직렬 주변 기기 인터페이스(SPI) 표준에 기초한 다른 통신 프로토콜을 제공할 수 있다."
"멀티미디어 케이블 망 사업자, -網事業者, Multimedia Cable Network System Operator, MCNS",,"케이블 모뎀 규격의 통일을 목적으로 하는 미국 종합 유선 방송(CATV) 회사 주도의 컨소시엄. 1995년 말에 작업을 개시해서 약 1년 간 멀티미디어 케이블 망 사업자(MCNS) 규격을 종합하였다. 이 규격은 인터넷 프로토콜(IP) 데이터그램을 투명(transparent)하게 전송함으로써 데이터 링크층과 물리 계층의 내용이 CATV 설비에 적합하도록 되어 있다. 하향 채널의 변조 방식은 64치(値) 및 256치의 직교 진폭 변조, 상향 링크의 변조 방식은 4상 위상 변조(四相位相變調)이다."
"멀티미디어 콘텐츠, multimedia content",,디지털화된 어문/음악/사진/미술 등 다중 매체 저작물로서 읽기 전용 콤팩트 디스크 기억 장치(CD-ROM) 또는 컴퓨터에 저장되어 이용될 수 있는 내용물. 또한 디지털화되어 정보 기기로 생산/유통/소비되는 정보 콘텐츠 또는 광대역 통신망이나 고속 데이터망을 통해 양방향으로 송수신되는 정보 콘텐츠.
"멀티미디어 콘텐츠 판별 시스템, -判別-, Multimedia Content Discrimination System",,"인터넷상의 불법ㆍ유해 콘텐츠를 키 워드 검색이 아닌 내용 분석을 통해 판별하는 시스템. 비디오의 경우 장면 전환 정보, 컬러 정보, 위치 정보 등을 복합적으로 비교해 찾는 방식으로 오디오의 경우 주파수 특성을 분석해 불법 콘텐츠를 찾는다."
"멀티미디어 통신 포럼, -通信-, Multimedia Communications Forum, MMCF",,엠펙-2(MPEG-2) 표준 제정으로 다양한 응용 분야의 서비스와 기기의 출현이 예상되고 서비스 간 또는 기기 간의 인터페이스/프로토콜 등을 표준화할 필요성이 발생함에 따라 설립된 국제 민간 표준화 단체 중의 하나. 1993년 설립된 이 단체는 탁상 영상 회의 등 멀티미디어 통신 분야의 표준화를 목표로 한다.
