"프레임 주파수, -周波數, frame frequency",,"텔레비전에서 2회의 필드 주사에 의해 하나의 프레임이 완성될 때 1초당 프레임 수. 2개의 필드에 의해 하나의 프레임이 구성되므로 프레임 주파수는 필드 주파수의 2분의 1이다. 현행 텔레비전 방식별 주사선 수, 필드 주파수, 주사 방식, 프레임 주파수는 표와 같다."
"프레임 중계, -中繼, frame relay",동의어 : 프레임 릴레이,"데이터 통신에서 데이터를 프레임 단위로 전송하고, 망 종단 장치에서 오류 등을 처리하도록 하는 고속 데이터 전송 기법. 프레임 중계(frame relay) 기술을 이용하여 기존의 X.25 패킷 교환망의 10배까지 고속 데이터 전송이 가능해 졌다. 프레임 중계는 망 계층(network layer) 대신 데이터 연결 계층(data link layer)에서 데이터의 다중화를 실현하여 데이터를 중계·교환하는 방식으로, 패킷 모드 인터페이스는 협대역 종합 정보 통신망(N-ISDN)의 위에 있는 한 계층과 같다고 할 수 있다. 프레임 중계는 B 채널, D 채널 또는 H 채널상에 전송될 수 있으며, 패킷 모드 장치 간 종합 정보 통신망(ISDN)에서 정보 교환을 할 수 있게 한다. 프레임 중계는 X.25나 동기식 데이터 연결 제어(SDLC: synchronous data link layer)와 같은 프로토콜과 연관된 오류 제어 및 흐름 제어 절차를 필요로 하지 않기 때문에 전송 효율의 향상과 전송 속도의 고속화를 실현할 수 있게 한다."
"프레임 중계 서비스, -中繼-, frame relay service",동의어 : 프레임 릴레이 서비스,"프레임 중계(frame relay) 기술을 이용한 고속 데이터 전송 서비스. 종래의 X.25 패킷 교환 서비스의 10배까지 고속 데이터 전송이 가능하고, 단일 접속 회선을 통해 다지점 간 고정 가상 회선(PVC)의 구성이 가능하여, 단일 접속 회선만 관리하기 때문에 운용이 편리하고 비용이 저렴하다. 그래픽스(비디오, CAD/CAM 등)와 같은 대량 데이터의 전송과 대형 파일 전송에 적합하다."
"프레임 중계 음성 전화, -中繼音聲電話, Voice over Frame Relay, VFR",,고속 데이터의 전송을 위해 고안된 프레임 중계(frame relay) 망을 사용해 전화 음성을 전송하는 기술. 과거에는 전송 지연 등 품질을 제어하는 기구가 없는 프레임 중계에 의한 음성 전송은 불가능한 것으로 알았으나 데이터 종류나 가상 채널에 따라서 우선 제어 가능한 프레임 중계 조립/분해(FRAD: Frame Relay Assembler/Disassembler)가 등장하여 전화 음성 중계를 할 수 있게 되었다. 통신 사업자의 프레임 중계 서비스를 사용해 내선망을 구축하는 기업도 있다.
"프레임 중계 접근 장치, -中繼接近裝置, Frame Relay Access Device, FRAD",,"전송 제어 프로토콜(TCP), 시스템 네트워크 구조(SNA: System Network Architecture), 망간 패킷 교환 (IPX: Internetwork Packet eXchange) 등 패킷을 프레임 중계 광역 통신망에 사용되는 프레임으로 변환시키는 장치. 랜(LAN)과 프레임 중계 광역 통신망(WAN) 사이를 연결하는 네트워크 장치이다.&nbsp;"
"프레임 중계 조립/분해 장치, -中繼組立分解裝置, Frame Relay Assembler/Disassembler, FRAD",,공중 전용 회선을 프레임 중계 서비스(frame relay service)와 연결하게 해 주는 접속 장치.
"프레임 품질 표시자, -品質標示子, frame quality indicator",,"프레임의 품질을 검사하기 위해 9,600bps와 4,800bps 통화 채널 프레임의 경우에 적용되는 주기적 덧붙임 검사(CRC)."
"프레임 호환, -互換, frame compatible",,좌 영상과 우 영상이 하나의 영상 프레임 내에서 평면적으로 조합되어 전송되는 입체 티브이(3DTV) 방송 서비스 형식. 예로 사이드바이사이드(side-by-side) 방식이 있다. ※ 관련: TTA 단체표준 TTAK.KO-07.0092 '디지털 케이블 3D 방송 송수신 정합'
"프레임 호환 3DTV, -互換-, 3-Dimensional TeleVision Frame-Compatible, 3DTV FC",,입체 텔레비전(3D TV) 전송 포맷 가운데 하나로 좌안 영상과 우안 영상이 한 프레임으로 전송되는 방식. 2D 비디오 프레임과 호환되는 포맷으로 3D를 제공하는 방식으로 별도의 하드웨어나 디코더 추가 없이 서비스를 제공할 수 있다. 그러나 2D 비디오와 호환성을 제공하지 못하고 수평 또는 수직 해상도가 반으로 떨어지는 단점이 있다. 대표적인 포맷으로 사이드 바이 사이드(side-by-side)와 톱 앤 보텀(top-and-bottom) 방식이 있다.
"프레임화 인터페이스, -化-, framed interface",,직렬 비트 스트림이 주기적인 물리적 프레임으로 세분되는 인터페이스. 이 인터페이스에서 세분된 각 프레임은 고정적인 분할 방식에 의해 오버헤드 부분과 정보 페이로드 부분으로 분할된다.
"프레젠테이션, presentation",,컴퓨터나 기타 멀티미디어를 이용하여 그 속에 담겨 있는 각종 정보를 사용자 또는 대상자에게 전달하는 행위. 투영기(OHP:over head projector)를 이용한 학술 발표나 컴퓨터로 작성된 화면을 영사기와 연결하여 보여 주는 행위들이 그 예이다. 프레젠테이션 기능은 대부분의 워드프로세서 프로그램에 포함되어 있다.
"프레젠테이션 매니저, Presentation Manager, PM",,IBM과 마이크로소프트사에서 공동 개발한 OS/2의 그래픽 사용자 인터페이스(GUI). 1988년에 개발되었다. 멀티 윈도 기능을 제공한다.
"프레젠테이션 소프트웨어, presentation software",,"회의나 발표, 브리핑에서 효과적으로 활용할 수 있는 그래픽 작업을 보다 간편하게 자동화시켜 주는 소프트웨어. 파워포인트, 프리랜드 그래픽스 등이 있다."
"프레즌스 서비스, presence service",,"수신자의 모바일 정보와 대기 상황을 발신자에게 알려 주는 서비스. 통화 중, 부재 중, 회의 중으로 구분되는 수신자 상태 정보는 물론 상대방의 위치 정보, 단말 정보, 네트워크 정보, 서비스 정보 등을 알려 주고, 발신자는 수신자의 현재 상태와 수신자가 선호하는 통신 수단(전화, 메신저, SMS, MMS, 이메일)을 확인할 수 있다. 예를 들어, 수신자가 회의 중 선호하는 통신 수단을 이메일로 지정했다면 발신자는 이메일로 메시지를 전달할 수 있다."
"프로그래머 계층적 대화형 그래픽스 시스템, -階層的對話型-, Programmer's Hierarchical Interactive Graphics System, PHIGS",,1989년 국제 표준화 기구(ISO)의 국제 표준 IS 9592-1989로 규정된 응용 프로그램과 도형 입출력 장치 사이의 표준 인터페이스. 대화식 도형 조작이 가능하게 도형을 계층형의 데이터 구조로 기술하는 것이 특징이다. 기본적으로는 동종의 인터페이스인 도형 핵심 시스템(GKS)과 적합성이 있으나 도형은 모두 3차원 좌표계로 표시된다. 도형 데이터가 계층 구조로 표현되어 장치 독립적으로 취급되는 것이 두드러진 특징이다. 기계나 건축의 컴퓨터 지원 설계(CAD)에 적합하다.
"프로그래머 논리 장치, -論理裝置, programmer logical unit",,응용 프로그램이 이용할 목적으로 뜻매김된 논리 장치. 프로그램 실행 시에 실제의 입출력 장치와 이용자 프로그램을 결부시키는 일을 한다.
"프로그래머블 네트워크, programmable network",,"프로그램의 변경에 의해 네트워크의 구조와 동작, 기능 등을 변경할 수 있도록 형성된 네트워크. 새로운 서비스의 개발과 적용을 용이하게 하기 위한 도구와 방법론으로 네트워크의 프로그램화가 추진되고 있다. 그 방법은 스위치나 라우터 등 각종 통신 하드웨어로부터 제어 소프트웨어를 분리해 내고, 개방형 프로그래머블 네트워크 인터페이스를 제공하며, 네트워킹 기반 구조의 가상화 촉진 같은 하드웨어상에 상이한 네트워크 구조를 공존시키고 자원을 분할하는 기술 등이 Opensig 커뮤니티와 DARPA(Defence Advanced Reaearch Project Agency)의 액티브 네트워크 프로젝트 등에서 연구되고 있다."
"프로그래밍학, -學, programmatics",,프로그래밍의 기법이나 프로그래밍 언어를 연구하는 학문의 한 분야.
"프로그램, program",,"①컴퓨터 프로그램. ②해야 할 것을 명시해 놓은 시간표나 계획. ③컴퓨터 프로그램을 설계하고, 쓰고, 검사하는 것."
"프로그램 가능, -可能, programmable",,"①사용자가 논리 회로의 동작을 결정할 수 있는, 즉 프로그램할 수 있는 것을 나타내는 형용사. 집적 회로(IC)에 정보의 기록이 가능한 것 등을 들 수 있다. ②명령을 받아서 저장하고 후에 실행할 수 있는 장치에 관한 형용사. 프로그램 가능성(programmability)은 컴퓨터의 한 특성이다."
"프로그램 가능 CD-ROM, -可能-, Compact Disc-Programmable Read Only Memory, CD-PROM",,읽기용 콤팩트 디스크 기억 장치(CD-ROM)와 기록 가능 콤팩트 디스크(CD-R)를 하나로 결합시킨 코닥사(Kodak) CD 제품. CD-ROM에는 사진의 각종 처리가 가능한 응용 소프트웨어와 데이터가 미리 들어가 있어 사용자는 CD-R 부분에 사진들의 저장과 동시에 적색눈(red-eye)과 같은 이미지 수정을 할 수가 있다.
"프로그램 가능 감쇠기, -可能減衰器, programmable attenuator",,저항 감쇠기로 그 감쇠량을 자유롭게 바꿀 수 있는 것. 저항의 전환에는 수은 릴레이가 사용된다.
"프로그램 가능 기능 키, -可能機能-, programmable function key",,사용자가 프로그램에서 어떤 기능의 키를 선정하여 지정을 한 후에 정규 단말 기능을 이용해서 프로그램을 현시하고 편집할 수 있도록 하는 기법.
"프로그램 가능 논리 배열, -可能論理配列, Programmable Logic Array, PLA",,논리곱과 논리합의 기능을 배열한 장치. 복잡한 논리 함수를 실현하기 위해 만든 대규모 집적 회로(LSI) 칩이다. 입력 변수가 많은 논리 회로를 만들 경우 상당히 큰 용량의 읽기용 기억 장치(ROM)이 필요하므로 프로그램 가능 논리 배열(PLA)은 이런 단점을 개선하여 ROM보다 더 많은 데이터 입력을 다룰 수 있게 하였다. PLA는 금속 산화물 반도체(MOS)나 양극성 회로로 구현된다.
"프로그램 가능 논리 소자, -可能論理素子, Programmable Logic Device, PLD",,"제조 후 사용자가 원하는 형태의 회로를 프로그램하여 사용할 수 있는 논리 소자. 기존의 고정된 특정한 기능을 수행하는 집적 회로는 초기 개발비가 들어가고, 설계 자산을 다른 곳에 쓸 수 없으며, 설계에 많은 시간이 필요하다. 하지만 PLD의 경우 초기 개발비가 필요 없고, 회로를 여러 번 고쳐 쓸 수 있기 때문에 ASIC나 ASSP를 대치하는 차세대 반도체 집적 회로로 부상하고 있다."
"프로그램 가능 논리 시스템, -可能論理-, programmable logic system",,"그 자체로서 일체가 완비되어 있는 시스템. 컴퓨터 제어 기능, 연산 기능, 기억 입출력 등의 기본 요소와 이들이 요구하는 동작을 수행할 수 있게 하는 소프트웨어도 포함하고 있다. 마이크로컴퓨터, 프로그램 가능 계산기, 대형 및 소형 컴퓨터가 이 부류에 속한다."
"프로그램 가능 로직 제어기, -可能-制御機, Programmable Logic Controller, PLC",,"기존의 각종 릴레이, 타이머, 카운터 등의 기능을 마이크로프로세서를 이용한 프로그램으로 제어 될 수 있게 통합시킨 장치. NEMA에서는 ""디지털 또는 아날로그 입출력 모듈을 통한 로직, 시퀀싱, 타이밍, 카운팅, 연산과 같은 특수한 기능을 수행하기 위하여 프로그램 가능한 메모리를 사용하고, 여러 종류의 기계나 프로세서를 제어하는 디지털 전자 장치""라고 정의하고 있다. 시퀀스 제어는 물론 산술 연산, 논리 연산, 함수 연산, 조절 연산 및 데이터 처리를 수행하고, 기존의 릴레이에 비해 제어 기능의 신뢰성이 뛰어나고, 제어 내용을 손쉽게 수정 및 변경 할 수 있으며, 복잡한 제어 기능을 수행할 수 있다. 공정 제어 기기를 비롯한 각종 자동화 시스템에 폭넓게 사용되며, 특히 컴퓨터와도 통신이 가능해 컴퓨터 통합 생산(CIM) 구축에 있어서도 필수 불가결한 요소가 된다. 구조는 제어 처리를 담당하는 중앙 제어부, 입력 신호를 받아 중앙 제어부로 넘겨주는 입력부, 처리된 신호의 결과를 제어 대상에 전달해주는 출력부 등 3개 부분으로 되어 있다. 전체적인 규격으로는 IEC1131이 있다."
"프로그램 가능 인터페이스 회로, -可能-回路, Programmable interface circuit",,컴퓨터에 사용되는 프로그램에 의해 그 동작이 각종 입출력 장치에 일치하는 것을 갖도록 한 인터페이스 회로나 장치.
"프로그램 가능 읽기용 기억 장치, -可能-用記憶裝置, Programmable Read Only Memory, PROM",동의어 : 피롬,"이용자가 데이터를 기록할 수 있도록 제조된 읽기용 기억 장치(ROM). 일반적으로 PROM이라는 약자로 표기되며 ‘피롬’으로 읽는다. 보통의 PROM은 롬 라이터(ROM writer)라는 장치를 이용하여 최초 데이터나 프로그램을 저장한 뒤에는 다시 그 내용을 수정할 수가 없으나, 종류에 따라서는 특수한 기록 장치를 이용해서 재프로그래밍이 가능한 PROM도 있다. 복잡한 제조 공정이 필요한 ROM은 대량 생산에 유리하기 때문에 ROM 설계의 원형 단계(prototyping stage)에서는 PROM이 사용된다. ROM의 설계가 완성될 때까지 PROM의 생성과 폐기를 거듭하여 실험을 하기도 하고, 소량의 ROM을 제조할 때 PROM으로 만들기도 한다."
"프로그램 가능 입출력용 칩, -可能入出力用-, Programmable Input/Output Chip, PIO",,"프로그램으로 제어할 수 있는 입출력용 대규모 집적 회로(LSI) 칩. 프로세서와 주변 입출력 장치 사이의 데이터 송수신을 제어한다. 입출력 회로의 수나 제어 방식을 프로그램에 의해 지정할 수 있으며, 이것에 의해 용도에 따라 여러 기능을 실현시킬 수 있다."
"프로그램 가능 주변 장치 접속기, -可能周邊裝置接續器, programmable peripheral interface",,대부분 3개의 8비트 접속구를 가진 논리 회로. 주변 장치와 양방향 통신을 구현하는 데 사용된다.
"프로그램 가능 통신 인터페이스, -可能通信-, Programmable Communication Interface, PCI",,통신 규약을 프로그램에 의해 변경할 수 있는 인터페이스 장치.
"프로그램 가능 통신 제어 기구, -可能通信制御機構, Programmable Communication Controller, PCC",,컴퓨터 본체에 내장하여 프로그램 제어에 의해 상이한 전송 제어 절차에 대응할 수 있는 제어 기구.
"프로그램 개발 시스템, -開發-, program development system",,"공급자가 제공하는 마이크로프로그래밍 개발 패키지를 이용하여 프로그램 개발자가 음극선관(CRT) 화면, 키보드, 플로피 디스크 장치, 인쇄 장치가 있는 시스템으로 프로그램을 만들거나 모의 실험하거나 오류 수정을 하는 시스템."
"프로그램 검증, -檢證, program verification",,"프로그램이 주어진 명세와 일치하는지를 알아보기 위해 수학적 증명 방법을 통해 특정한 성질들을 증명하는 작업. 보통 주어진 프로그램이 끝나는가, 어떤 변수들이 변하지 않고 남아 있는가와 같은 성질들을 증명한다."
"프로그램 경합 병행 처리, -競合竝行處理, program competition multiprogramming",,"여러 개의 서로 관련되거나 관련되지 않은 프로그램 또는 그 일부를 동시에 병행으로 처리하는 것. 한 프로그램이 입출력 작업이 끝나기를 기다리는 동안에는 미리 정해진 순서에 따라 다른 프로그램으로 처리기의 제어가 넘어간다. 만일 여러 개의 프로그램이 처리기의 제어를 요구할 때에는 기억 장치의 필요량, 처리기의 활용도, 입출력 작업의 정도를 감안하여 순서를 정함으로써 단위 시간당 시스템의 처리 능력을 상승시킨다."
"프로그램 계수기, -計數器, Program Counter, PC",,"컴퓨터에 의해 실행 중인 명령어의 주소가 저장되어 있는 장치. 프로그램 기억 방식의 컴퓨터에서는 명령어도 기억 장치에 기억되어 있는데, 보통 기계에서 명령어는 그 주소가 연속되는 정수순으로 기억되어 있어서 주소가 작은 순서부터 차례로 제어 장치에 전송된다. 프로그램 계수 장치는 제어 장치에 있으며, 지금 실행하고 있는 명령어가 들어 있는 주소가 기억되어 있다. 명령어가 실행될 때마다 프로그램 계수 장치의 내용에 1 또는 명령 길이에 따라 결정되는 수치가 가산되며, 다음에 실행하는 명령어의 주소를 나타내게 되어 있다. 그러므로 다음에 실행될 명령어가 제어 장치에 전송된다."
"프로그램 관리, -管理, program management",,"대규모의 시스템이 여러 분야에 출현함에 따라 경영 기구도 종래의 것에서 시대의 요청에 적응할 수 있는 조직 구조로 다양하고 기능적인 시스템의 확립이 필요하게 되어, 이를 위해 통합적으로 관리 기능을 집중화하는 것(또는 그 기관)."
"프로그램 관리자, -管理者, program manager",,"프로그램의 개발 운영, 업무 계획, 스케줄링 및 감독 책임을 맡은 사람."
"프로그램 구성 설계, -構成設計, program structure design",,시스템 설계서에 기초한 각 프로그램의 내부 구조 설계.
"프로그램 구조, -構造, program architecture",,컴퓨터 프로그램의 구성 요소들 간의 조직과 관계. 프로그램 구조는 가동 환경에서 프로그램 간의 접속도 포함된다.
"프로그램 글로벌 영역, -領域, Program Global Area, Process Global Area, PGA",,"오라클에서 단일 프로세스(서버나 백그라운드)에 대한 데이터와 제어 정보를 저장하는 메모리 영역. 프로세스 글로벌 영역이라고도 하며, 사용자 프로세스가 오라클 데이터베이스에 접속되고 세션이 생성되면 오라클이 프로그램 글로벌 영역(PGA)을 할당한다. PGA에 있는 정보는 공유 서버와 단독 서버 구성 등 오라클 구성에 따라 결정되는데, 세션 변수, 배열 및 다른 정보를 저장하기 위한 메모리인 스택 영역은 PGA에 포함되지만, 전용 서버로 실행되는 인스턴스의 PGA 경우 전용 구조화 조회 언어(SQL) 영역이나 사용자 세션 정보에 필요한 추가 메모리는 PGA에 있지 않고 시스템 글로벌 영역(SGA) 내에 할당된다."
"프로그램 기억 방식, -記憶方式, program memory system",,동작 순서를 기억 장치 내에 기억시켜 차례로 꺼내 참조하면서 조작을 진행하는 방식.
"프로그램 기억 장소, -記憶場所, program storage",,프로그램과 루틴 및 서브루틴들을 저장하기 위해 내부 기억 장치에 특별히 설정한 영역. 우연한 실수로 인해 프로그램 저장 장소의 내용을 변경시키는 일이 발생되지 않도록 대부분의 시스템이 보호 장치를 사용한다.
"프로그램 단계, -段階, program phase",,"컴퓨터에서 프로그램 배치의 최소 단위. 세그먼트라고도 한다. 프로그램 구조의 관점에서 보면 다음 2개의 형으로 분류된다. ㉠단일 단계는 실행에 필요한 모든 정보(프로그램)가 한 번에 주기억부에 배치되는 프로그램 구조이다. ㉡복수 단계는 실행에 필요한 정보(프로그램)의 일부를 주기억에 배치하고, 그 프로그램의 논리에 따라 필요한 단계를 배치하면서 처리를 진행하는 형태로, 갈아넣기 구조를 갖는 프로그램이다."
"프로그램 단위, -單位, program unit",,"기능 블록을 구성하는 요소의 하나로, 처리 절차를 하나로 정리한 것. 각 프로그램 단위는 절차를 기술한 프로그램부와 데이터부로 구성된다."
"프로그램 도식, -圖式, program schema",,"프로그램 속에 나타나는 상수 c나 함수 fi, 술어 qi의 의미는 무시하고 그들을 단순한 기호로 간주한 것. 변수가 취할 수 있는 값의 영역을 지정하고, c, fi, qi에 각각 특정한 상수, 함수, 술어를 주는 것을 해석이라 하는데 프로그램형은 해석이 주어지면 하나의 프로그램이 된다. 이런 뜻에서 프로그램형은 공통의 제어 구조를 갖는 프로그램의 족(族)을 표현한다고 생각할 수 있다. 흐름도 프로그램, 재귀적 프로그램에 대응하여 각각 흐름도 프로그램형, 재귀적 프로그램형이 정의된다. 특히 함수 기호, 술어 기호가 모두 1변수이고 입력 변수, 프로그램 변수, 출력 변수가 각각 하나씩인 흐름도 프로그램형이나 야노프(Yanov) 프로그램형(또는 야노프 도식)이 있다."
"프로그램된 기능 키, -機能-, Programmed Function Key, PF key",,기능 키는 본질적으로 응용 소프트웨어에서 또는 사용자의 선택에 의해 특정한 기능을 수행하도록 프로그램되어 있다는 의미에서 기능 키를 일컫는 말. IBM 응용 소프트웨어에서는 기능 키를 프로그램된 기능 키(PF key)와 커맨드 기능 키(CF key) 등으로 세분하여 부르기도 한다.
"프로그램 레벨 미터, program level meter",,"방송 프로그램의 제작이나 송출, 녹음 등에서 음성 신호의 레벨을 적절하게 설정하기 위해 쓰이는 계기. 평균 제곱형에 가까운 특성을 가진 VU미터와 순간 피크에 가까운 표시를 나타내는 피크 프로그램미터가 많이 쓰이고 있다."
"프로그램 명령어, -命令語, program instruction",,"컴퓨터가 처리할 수 있는 기본적 연산을 나타내는 기계 수준의 명령들. 프로그램의 흐름 제어, 자료의 이동, 논리 산술 연산, 입출력 등의 명령으로 구성된다."
"프로그램 명세, -明細, program specification",,"어떤 프로그램이나 프로그램 세그먼트가 수행할 수 있는 처리 기능의 범위와 논리를 명확하고 질서 있게 정의한 것. 프로그램의 처리 기능에 대한 상세한 설명과 처리 순서, 오류 처리 방법, 입출력 요소의 형식, 제한 사항 등에 대한 설명이 포함되어야 한다. 흐름도도 여기에 속하는 것으로 프로그램을 작성하기 위한 준비 단계에서 작성한다."
"프로그램 문서화, -文書化, program documentation",,"프로그램의 기능, 특성, 작성, 배경 등을 주석(document)이나 별도의 주석용 파일로 서술해 주는 것. 문서화는 프로그램 작성에서 매우 중요한 부분이며 프로그램의 수정, 요원의 훈련, 기계 조작원이 프로그램을 가동시키는 방법을 습득하고, 문제가 생겼을 때 그것을 진단하는 데 필요하다."
"프로그램 및 시스템 정보 프로토콜, -情報-, Program and System Information Protocol, PSIP",,"디지털 텔레비전에서 전송되는 프로그램 및 데이터와 텔레비전 수신에 필요한 여러 정보를 기술하기 위해 만든 규격. ATSC 표준65가 이 규격의 예이다. 디지털 텔레비전을 위한 모든 전송 스트림(TS) 내에서 동작하도록 고안된 테이블의 집합으로, 특정 TS에서 전송되는 가상 채널의 필요한 정보를 기술하여 수상기의 수신에 필요한 정보를 제공한다. 기본 테이블은 시간 정보를 전달하는 STT(System Time Table), 전송 테이블을 관리하는 MGT(Master Guide Table), 가상 채널 정보를 제공하는 VCT(Virtual Channel Table), 각 지역 및 국가에 적용 가능한 등급 기준을 정의하는 RRT(Rating Region Table) 등으로 구성된다."
"프로그램 변환, -變換, program transformation",,"프로그램의 의미를 변화시키지 않고 제어 흐름의 구조를 변화시키는 것. 실행 순서의 상호 교환 및 반복 구조의 분해 등 간단한 것에서부터 재귀 호출 반복으로의 변환, 취급하는 데이터 구조의 변경을 포함하는 것 등 여러 가지 종류가 있다."
"프로그램별 유료 시청 제도, -別有料視聽制度, Pay Per View, PPV",동의어 : 페이 퍼 뷰,"주로 유료 방송 시스템인 위성 방송이나 케이블, IPTV 들에서 도입한 프로그램별 과금 제도로 프로그램을 하나의 상품 단위로 구매해 시청하는 일종의 종량제 방송 서비스. 대표적인 PPV 프로그램으로는 프로 권투나 레슬링, 대형 이벤트, 성인 영화 따위가 있다."
"프로그램 보호, -保護, program protection",,컴퓨터 프로그램의 권리가 없는 사람이 접근하거나 수정하는 것을 예방하기 위해 내부나 외부 제어를 응용하는 것.
