"무음 억제 기능, 無音抑制機能, Suppression Of Non-Sound, SNS",,통화 중 소리가 없는 부분을 데이터화해서 송신하지 않는 기능. 전송로상에서 필요 없는 부분을 제거해서 데이터 전송 효율을 높일 수 있는 기능이다. 비동기 전송 방식(ATM)은 고속성으로서 데이터 지향의 응용이 바람직하므로 음성 신호를 VToA(Voice and Telephony over ATM) 기술 또는 무음 억제 기능 등을 이용하여 동적으로 취급하도록 하고 있다. 따라서 데이터 이외의 음성 신호도 동일 ATM 통신망으로 취급함으로써 ATM의 장점을 한층 더 살릴 수 있다. 또한 앞으로는 고도의 정형화(shaping) 기능(셀의 송출 간격을 유지하면서 전송하는 기능)을 실장한 ATM 교환기를 이용해서 음성/데이터를 통합한 형태의 통신망이 구축될 예정이다.
"무응답 전환, 無應答轉換, no answer transfer",,이동 전화 호출에서 일정 동안 응답이 없는 경우 미리 정해진 다른 전화 번호로 자동 전환하는 서비스.
"무응답 착신호 전환, 無應答着信號轉換, Call Forwarding No Reply, CFNR",,"종합 정보 통신망(ISDN) 부가 서비스의 하나로 사용자의 ISDN 번호로 걸려 오는 호에 대하여 응답하지 않는 경우, 그 번호로 걸려 오는 모든 호를 다른 번호에 전환 접속시켜 주는 서비스. 이때 사용자의 발신 서비스는 영향을 받지 않는다."
"무의미 레코드, 無意味-, Dummy Record, DR",,"의미 있는 정보를 넣기 위한 것이 아니라 시스템의 조건에 맞추기 위해서 적당히 첨가된 레코드. 직접 편성 파일을 작성할 때, 자기(磁氣) 디스크상의 레코드는 연속 상태에서 기억시키지 않으면 안 된다. 이 경우, 디스크상의 결번 레코드 영역을 비워서 그곳에 다음 레코드를 기억시키는 것은 불가능하므로 결번 레코드 대신 무의미 레코드를 사용하게 된다. 또 직접 편성 파일을 작성하는 영역을 확보하기 위해서 최초에 모든 무의미 레코드를 활용, 실제 데이터로 갱신해 둔다."
"무의미 명령어, 無意味命令語, dummy instruction, pseudo instruction","동의어 : 더미 명령어, 의사 명령어","①명령의 형식을 갖춘 데이터 항목으로서, 명령의 집합에 삽입은 되지만 그것을 실행하려는 의도는 갖지 않는 것. ②명령의 실행 결과 데이터의 변경 또는 컴퓨터의 상태가 변화하지 않는 명령. 주로 프로그램 실행 중 외부에서 발생하는 특수 조건을 대기하기 위해 프로그램 안에 삽입한다."
"무의미 인수, 無意味因數, dummy argument",,"함수의 독립 변수 구문으로서 지정된 식 대신에 식의 결과를 값으로 하고, 식과는 다른 세대를 갖는 사실적인 절차로 유도되는 변수."
"무인 궤도 버스, 無人軌道-, computer controlled bus on railway",,"사람이 탑승하여 운전하지 않고 컴퓨터가 조종하여 운행되는 궤도 버스. 미국, 일본 등의 일부 공항에서 물류 수송을 위해 이용되고 있다. 궤도 버스는 레일 위를 운행하는 운반 시스템으로 일반적으로 운행을 담당하는 사람이 탑승한다."
"무인 항공기, 無人航空機, Unmanned Aerial Vehicle, UAV",,"조종사가 직접 탑승하지 않고 원거리에서 무선으로 원격 조정이 가능하거나, 입력된 프로그램에 따라 비행이 가능한 비행체. 초기에는 군사 목적의 무인 항공기가 개발되어 활용되었으나, 최근에는 환경 감시, 기상 관측, 민간 통신 중계 등의 비군사적 분야에서도 활용된다. 일반적으로 드론(drone)으로 불린다."
"무인 항공 시스템, 無人航空-, Unmanned Aerial System, UAS",동의어 : 무인 에어리얼 시스템,"무인 항공기(UAV) 및 이를 운용하기 위해 필요한 제반 시스템. 무인 항공기(UAV)의 이용이 늘어나면서 다른 항공기와 충돌을 피하기 위하여 공역을 통제하여야 한다. 이에 따라 기존의 UAV와 이를 운용하기 위한 제반 시스템이 필요하게 되어 탄생된 개념이다. 무인 항공 시스템은 무인 항공기(UAV), 탑재 장비, 비행 공역, 항공 관제소, 지상 통신 장비로 구성된다. 지상 통신 장비는 지상 장비와 비행체 사이를 직접 연결하는 가시선 통신과 위성을 이용한 비가시선 통신으로 구분된다. 또한, 무인 항공기(UAV)는 유인 항공기가 운항하는 공역 내에서 같이 운용되기 위해서는 무인 항공 시스템(UAS) 통제와 통신망(Control and Non-Payload Communications link)도 갖추어야 한다. "
"무작위 기법, 無作爲技法, randomizing scheme",,파일 레코드들을 여러 개의 파일 기억 모듈에 고르게 분포하여 각 파일의 정보들을 얻는 데 소요되는 시간이 일정하게 되도록 분포하는 계획.
"무작위 대입 공격, 無作爲代入攻擊, Brute Force Attack",,"암호문의 암호 키를 찾기 위해 모든 경우의 수를 무작위로 대입하여 암호를 푸는 공격 방법. 과거에는 암호문을 알아볼 수 있는 평문을 찾기 전에는 다른 키로 그 뜻을 파악하여 공격하는 암호 키를 알아내는데 사용하는 공격이었으나, 주로 아이디(ID)와 패스워드를 알아내기 위하여 반복 대입하는 공격으로 사용된다."
"무작위 시험, 無作爲試驗, random test",,"사용되는 시스템을 모두 시험하는 것은 시간이 많이 걸리고 복잡하므로 그중에서 몇 개의 프로그램, 단말 장치, 데이터 파일만을 임의로 시험하고, 어떤 특정한 부분에 대해서만 모든 과정이 정상적으로 처리되는가를 확인하는 방법."
"무작위화, 無作爲化, randomizing",,"데이터를 저장하고 접근하는 데 사용되는 한 방법. 미리 할당한 데이터 공간의 주소를 결정하기 위해서 데이터의 일부분을 이용하여 주소를 계산하는 연산을 사용한다. 데이터는 결정된 주소에 저장될 수도 있고, 결정된 주소에는 데이터가 저장된 주소가 저장될 수도 있다."
"무잡음 통신로, 無雜音通信路, noiseless channel",,입출력 함수가 1:1로 확정되어 있어 정보량의 손실이 없는 통신로.
"무장하 반송 전화 방식, 無裝荷搬送電話方式, nonloaded cable carrier telephony",,전송로로 무장하 케이블을 사용하는 반송식 다중 전화 방식. 장하 케이블에 비해서 다중적으로 전송로를 이용할 수 있고 전파 시간이 빠르기 때문에 원거리 통신에 적합하다.
"무장하 케이블, 無裝荷-, nonload cable",,코일을 삽입시키지 않고 주파수 분할 다중 방식에 적합하도록 구성한 케이블. 장하 케이블은 코일의 삽입으로 전파 시간의 증대와 차단 주파수의 저하를 가져오기 때문에 장거리 전송이나 주파수 분할 다중 방식에 적합하지 않다. 이 점을 고려하여 구성한 케이블을 말한다.
"무장하 케이블 반송 방식, 無裝荷-搬送方式, nonloaded cable carrier system",,"전송로로 코일(coil)을 삽입시키지 않은 무장하 케이블(nonload cable)을 사용하는 반송 방식.시외 간선 경로에 널리 사용되었으며, 반송 케이블을 사용하여 60 또는 120 통화로까지 중첩해 사용하고, 장하 코일(loaded coil)을 제거한 시외 케이블로 12 통화로용으로 사용하던 방식이다. 우리나라에서는 전송로로 1.4mm 성형 종이 케이블(paper-cored cable: 심선 절연 및 층이 지게 종이를 감아서 사용한 케이블)을 사용한 T12ATR 방식이 처음에 서울~부산 등 주요 도시에 시설되었으나, 현재는 사용되지 않는다."
"무전극 램프, 無電極-, induction lamp",,"외부로부터의 전압이나 전류 인가용 전극이 없는 형광 방전 램프.  고효율, 고연색성의 특성을 가지고 있으며, 특히 일반 전구와는 달리 내부에 필라멘트가 없어 수명이 반영구적이므로 보수교환이 어려운 시설분야에 적용되고 있다. 원리는 방전관 외부에 설치된 코일에 고주파가 흘러 발생된 자기장이 방전관을 통과하면 패러데이의 원리에 의해 기전력이 발생된다. 이 기전력에 의해 여러 가지 가스가 혼합된 방전관 내에서 전자가 가속되어 플라즈마가 발생되고, 여기에서 나온 자외선은 유리관 내부에 도포된 형광체를 자극하여 조명에 알맞는 편안한 가시광선만을 방출하게 된다."
"무접속, 無接續, Non-Connection, NC",,집적 회로(IC) 핀의 배열에서 불필요한 핀. 내부의 회로와는 연결되어 있지 않으며 IC 제도상에서 핀의 개수 등을 표준화하기 위해 불가피하게 존재한다.
"무접점 계전기, 無接點繼電器, noncontact relay",,"계전기 동작의 켜짐, 꺼짐에 대응하는 2개의 출력 상태를 가진 소자 또는 그 조합의 총칭. 자기 증폭기나 트랜지스터를 이용한 것 등이 있다. 접점이 없기 때문에 접점 사고가 없으며 온도, 습도 등 외부 조건에 구애받지 않고 안정하게 동작하므로 신뢰성이 높아 여러 분야의 제어 소자로 이용된다."
"무접점 스위치, 無接點-, noncontact switch, contactless switch",,"기계적 스위치와 같이 접점을 가지지 않고 전기 회로를 개폐하는 스위치 소자. 진공관, 파라메트론, 자기 증폭기, 다이오드 등이 사용된다."
"무정의 조합, 無定義組合, don`t care combination",,"n(자연수) 개의 논리 변수가 취한 논리값의 조합에 대하여 하나의 논리값이 대응하는 논리 함수에서, 논리 함수의 논리값이 규정되어 있지 않은 논리값의 조합. 이 조합을 이용하여 논리식이나 회로를 간단하게 한다."
"무정전 전원 장치, 無停電電源裝置, Uninterruptible Power Supply System, UPS",,"컴퓨터의 데이터가 소멸되는 것을 방지하기 위해 전원 전압, 주파수 변동이 있는 곳에서 전압, 주파수를 자동적으로 안정하게 조정하고 정전 시에도 일정 시간 전력을 계속 공급하는 장치."
"무정지 서버, 無停止-, nonstop sever",,이중화된 중앙 처리 장치(CPU)와 메인 메모리 등 주요 하드웨어를 완전 동기화하여 장애가 발생하더라도 멈추지 않는 고가용성 서버. 무정지 서버는 정지시간이 연간 5분 미만으로 99.999% 사용을 보장하는 서버이다.
"무정지형 컴퓨터, 無停止型-, Fault Tolerant Computer, FTC",,"컴퓨터 시스템을 구성하는 요소에 고장이 발생해도 시스템은 계속 그 기능을 실행하는 내(耐)고장성을 갖춘, 신뢰성이 높은 컴퓨터. 복수 개의 중앙 처리 장치(CPU) 다수결 처리, 기억 장치, 자기 디스크를 하드웨어에 이중으로 갖추도록 하여 일부가 고장나도 시스템 전체로서는 처리가 속행되도록 설계되어 있다. 예비의 자원을 갖기 때문에 고가여서 처리가 정지되면 영향이 큰 은행, 항공사의 온라인 시스템 등에 사용된다."
"무조건 건너뛰기, 無條件-, unconditional jump",,컴퓨터 명령 부호의 하나. 항상 지정된 주소로 제어를 옮기는 동작을 한다.
"무조건 문, 無條件文, unconditional statement",,"논리식 또는 조건에 의해 제어되는 것이 아니고 무조건 정해진 동작을 하는 문법 단위. 알골(ALGOL)에서는 무조건 문이라 하고, 코볼(COBOL)에서는 무조건 명령이라고 한다."
"무조건 분기 명령, 無條件分岐命令, unconditional branch instruction",,프로그램의 다른 부분으로 제어를 옮기는 명령. 프로그램의 조건이나 상태와는 무관하게 이루어진다.
"무조건 요구, 無條件要求, unconditional request",,매크로(macro) 명령 등에서 요구가 충족되지 않으면 이상 종료가 되는 요구.
"무조건 착신호 전환, 無條件着信號轉換, Call Forwarding Unconditional, CFU",,"ISDN 부가 서비스의 하나로, 사용자의 ISDN 번호로 걸려 오는 모든 호를 무조건 다른 번호로 전환 접속시켜 주는 기능. 이 서비스 사용자의 발신 서비스는 영향을 받지 않는다. 이 서비스가 작동되면 착신 측의 단말 상태에 관계없이 걸려 오는 호는 전환된다."
"무주소 명령어, 無住所命令語, noaddress instruction",,"명령의 수행에 연산 자료가 필요없거나 연산 자료의 출처가 스택과 같은 중앙 처리 장치 내의 특수한 곳이어서 연산 자료의 주소 지정이 불필요한 경우에, 주소 지정이 없이 연산자만으로 나타낸 명령. 스택 컴퓨터의 명령어, 즉 PUSH, POP 등이 있다."
"무지향성 무선 표지, 無指向性無線標識, Non-Directional Radio Beacon, NDB",,"중·장파대(160~526.5kHz)의 무지향성 전파를 전 방향으로 발사하여 항공기의 항행을 원조하는 시설. 항공기상의 자동 방향 탐지기(ADF)를 사용하여 무지향성 무선 표지(NDB)의 주파수에 맞추어 동조시켜서 표지 신호를 확인, 지침이 표시하는 방향을 비행하면 그 NDB를 향해서 비행할 수 있게 된다. NDB는 항공로의 요소 요소나 공항에 설치되어 있다. →호밍 비컨."
"무지향성 안테나, 無指向性-, omnidirectional antenna, nondirectional antenna",,"특정 방향이 없이 단일 평면상에서 전방향성의 방사 패턴을 보이는 안테나. 수평면에서는 무지향적 패턴을 보이지만 이에 수직한 면에서는 지향적인 패턴을 보인다. 턴스타일 안테나, 슈퍼 이득 안테나, 나선형(helical), 원통 슬롯, 다단 동축형 등의 안테나가 있다."
"무채색, 無彩色, achromatic color",,색상의 지각을 느끼지 않는 백에서 흑까지의 색. 색 자극에 대해서는 같은 에너지 스펙트럼의 색이 무채색으로 사용된다.
"무크(MOOC), Massive Open Online Course, MOOC",,"웹 기반의 온라인 공개 강좌. 정규 교육의 보조 수단에 머물지 않고 수업과 시험 등의 교육 체계를 갖춘 대학 강좌를 가리킨다. 여러 사람에게 강좌를 널리(massive) 공개(open)하기 때문에 기존 대학 교육 체계를 크게 바꿀 태세다. 미국 유명 대학이 앞서 시작했으며, 일본의 주요 대학도 2014년부터 인터넷으로 강좌를 제공했다. 한국에서도 이른바 케이무크(K(Korea)MOOC)가 추진된다."
"무통화 시 잡음, 無通話時雜音, idle channel noise",,상호 접속된 통화자가 아무 말도 않고 있는 상태일 때의 잡음. 펄스 부호 변조(PCM) 회선의 경우 열잡음 등의 미소 잡음이 양자화 레벨의 변동에 따라 양자화 제 1스텝으로 확대되어 생기는 잡음 등으로 이루어져 있다.
"무통화 시 패턴, 無通話時-, idle pattern",,무통화 시에 음성 시간 슬롯에 송출되는 비트열의 패턴. 일반적으로 ‘0’ 레벨이 입력되었을 때의 부호기의 출력 패턴이다.
"무파일 웜, 無-, Fileless Worm",,기억 장소에서만 존재하며 시스템의 취약점을 이용해 네트워크로 전파되는 웜. 파일 형태로 존재하지 않으므로 파일 검사 기반의 백신 프로그램으로는 진단에 한계가 있다. 코드레드 웜(CordRed worm)이 여기에 속한다.
"무한 반복, 無限反復, livelock",,"프로그램 수행 중 끝없이 동일 과정을 반복하는 것. 2개 이상의 프로세스가 상대방의 변화에 의해 대응되는 요청을 서로 미루는 것으로, 부정확한 정보나 자기가 자기를 호출하는 프로세스가 반복되는 경우에 일어난다. 2개 이상의 프로세스가 서로 상대방이 변화하기를 기다리며 반복하는 것이 아닌 교착 상태(deadlock)와는 다르다."
"무한 반복, 無限反復, endless loop, maze",동의어 : 무한 맴돌이,프로그램이 어떤 부분을 반복적으로 무한히 실행하여 거기에서 빠져나오지 못하는 상태. 주로 프로그램의 논리적 착오 때문에 발생하지만 다른 원인일 경우도 있다. 무한 반복 상태가 되면 프로그램이 끝나지 않고 계속되므로 컴퓨터 자원을 낭비하게 된다. 이런 경우는 사용자나 운영 체계가 강제로 중단시켜야 한다.
"무형 언어, 無形言語, typeless language",,"스노볼(SNOBOL) 4와 같은 프로그램 작성 언어들에서, 동적 형 검사 방법을 요구하므로 변수들에 대한 선언문을 전혀 사용하지 않는 것. 식 ‘a＋b’에서 a와 b 같은 변수들의 자료형은 프로그램을 수행하는 동안 변하게 된다. 즉, a와 b는 덧셈이 수행되는 시간에 동적으로 검사된다."
"무혼신 조건, 無混信條件, Non-Interference Basis, NIB",,"혼신 또는 간섭을 주지 않는 것을 조건으로 한 것. 어떤 국(局)이 사용하는 주파수에 근접한 주파수를 할당하면 혼신 등 유해 현상을 일으킬 수 있다. 그러나 무선 설비 이용 시 설비 특성상 기존 주파수와 인접한 주파수 발생 장치가 이미 부착된 경우에 기존 설비에 대한 보호(즉, 일종의 기득권) 차원에서 후 개설 무선국은 선 개설 무선국에 유해한 혼신을 미치지 않는 것을 조건으로 허가(할당)하는 것을 말한다."
"무효 부호, 無效符號, invalid code",,컴퓨터가 정상으로 처리할 수 있는 부호 외의 무효인 부호.
"무효 시간, 無效時間, dead time",,①혼란을 초래하는 중복을 피하기 위해 혹은 특별히 다른 사건을 허용하기 위해 연관된 2개 행위 사이에 고의적으로 한정된 지연. ②시간의 단위로 측정되는 2개의 연관된 행위 사이의 효율적 연구를 위한 지연.
"무효 전력, 無效電力, reactive power",,"인덕턴스와 정전 용량에 교류 전류가 흐를 때처럼 전원으로부터의 에너지를 주고받는 것이 반 주기마다 반복되어 실제로는 아무 일도 하지 않고 열 소비도 없는 전력. 즉 피상 전력 중에서 실제로 일을 하지 않는 전력을 가리킨다. 교류 전압, 전류의 실효값을 각각 V 및 I라 하고, 위상각을 VI가 되고, 유효 전력 및 무효 전력은 각각 VIcosVIsinф로 표시된다."
"무효 페이지, 無效-, invalid page",,실제 기억상에는 없는 가상 페이지. 중앙 처리 장치(CPU)의 동적 주소 변환 기구로서 직접 주소로 할 수 없는 페이지이다.
"무효 프레임, 無效-, invalid frame",,"고위 데이터 링크 제어 절차(HDLC)에서 규정 이외의 프레임 구성. 무효 프레임은 전후 2개의 프레임이 플래그 순서로 구분되어 있지 않은 것, 또는 프레임 길이가 너무 짧은 것(플래그 사이가 32비트보다 적은 것) 등을 말하며, 수신 측에서 검출되어 버려지게 된다."
"묵음 회로, 默音回路, muting circuit",,"증폭기나 동조기에서 소리를 줄이지 않고 일시적으로 음량을 20dB 정도 내리는 기능을 가진 회로. 증폭기 등에서는 오디오 뮤팅(audio muting)이라 하며, 레코드를 틀 때 이 회로를 동작시켜 두면 픽업(pickup)의 침이 소릿골을 찾아가기 전까지는 잡음이 차단되고, 완전히 찾아가면 보통의 동작 상태로 되돌아오도록 할 때 사용된다. 동조기에서는 다이얼을 회전시켜서 선국할 때 이 회로를 동작시켜 잡음을 차단하고 동조가 잡히면 이 회로는 해제되어 정상 상태가 된다."
"묶음, pack",,"①몇 개의 작은 필드들을 1개의 큰 필드로 조합 또는 통합시키는 것. ②기억 장소를 절약하기 위해 2개 이상의 정보 단위를 1개의 물리적 단위로 합병하는 것. 예를 들면, 종업원 임금 지급 번호, 주급 비율, 세금 공제의 필드들은 1개의 단어 속에 기억될 수 있는데, 이들 각각은 한 단어의 다른 위치에 할당된다. ③데이터나 공백(blank)들을 부호화하는 방법을 바꾸어서 정보를 담는 데 필요한 기억 용량을 줄이는 과정. 예를 들면, 인접한 서브필드(subfield)를 사용하거나 단어들을 적절히 여러 부분으로 나누어 2개 이상의 데이터 항목을 한 단어에 기억시키는 것 등을 말한다."
"묶음 10진수, -十進數, packed decimal",,수의 값을 표시하는 데 1바이트에 두 자리의 숫자를 표시하도록 표시되는 10진수 표시의 수치. 한 자리의 10진 숫자는 4비트로 표시할 수 있고 정(＋)이나 음(-)의 표시는 9보다 큰 수로 표시한다.
"묶음 10진 정수, -十進定數, packed decimal constant",,"1바이트로 두 자리의 10진수를 표시하고, 최하위 바이트의 하위 4비트로 부호를 표시하는 형식의 정수."
"묶음 10진 표기법, -十進表記法, packed decimal notation",,"2개의 연속되어 있는 10진 숫자에 각각 4비트씩을 할당하고, 1바이트로 표현하는 2진화 10진 표기법."
"묶음 서비스, bundling service",,"시내전화와 장거리전화, 인터넷, 무선전화, 무선호출 등 두 개 또는 그 이상의 서비스들을 묶어서 단일 서비스로 제공하는 것. 결합서비스는 마케팅 통합(commercial convergence) 측면에서 서비스의 단순묶음으로 이해될 수 있으나 서비스 제공자들은 유사 부문의 통폐합에 의한 비용절감과 보다 고도의 서비스를 개발할 수 있고, 소비자들은 요금 할인 또는 요금청구 단일화(single billing) 등의 혜택을 받는다."
"묶음 풀기, unpack",,①압축(pack)된 정보를 여러 개의 단어들이나 원소로 분해하는 것. ②압축된 자료로부터 원래 자료로 복귀하는 것. ③결합된 정보 사항을 개개의 기계 단어로 분리하는 것.
"문맥, 文脈, context",,어느 언어의 통어(統語) 규칙에 따라 구성된 문(형식)과 그 문이 존재하는 상황(경우)과의 관계.
"문맥 광고, 文脈廣告, contextual advertising",,"웹의 방문자들이 보고있는 페이지의 내용과 방문 습관을 기반으로 연관성 있을 만한 내용을 자동으로 보여주는 동적인 광고.  방문자가 웹 사이트에서 검색을 위해 사용한 단어들과 검색 페이지를 이용하거나, 동일 페이지를 방문한 다른 사람들의 자료를 활용하여 페이지의 광고란이나 팝업창에 준비된 광고를 띄운다. 구글의 애드센스(AdSense)가 본격적으로 시도된 최초의 문맥 광고이다."
"문맥 의존, 文脈依存, context-dependent",,어떤 프로세스나 데이터 문자 집합의 의미가 주위 환경에 따라서 달라지는 것을 나타내는 용어.
"문맥 의존 도움, 文脈依存-, context-sensitive help",,"대화형 처리 환경에서 조작 도중에 색인(index)이나 메뉴와 같은 특별한 화면을 펼치지 않고 명령이나 옵션, 사용자가 취해야 하는 조치 등에 관한 설명을 화면 표시상에 표시함으로써 사용자를 유도해 나가는 방식. 사용자가 프로그램을 떠나지 않고 현재 시도하고 있는 명령이나 조작에 관한 정보를 온 스크린으로 얻을 수 있으므로 사용자가 새롭거나 낯선 프로그램을 배우는 데 특히 유용하다."
"문맥 의존 문법, 文脈依存文法, context-sensitive grammar",,"구(句)구조 문법 G = (VN, VT, P, S)의 바꿔쓰기 규칙이 다음과 같은 문법. &nbsp; 이 문법에서 생성된 언어를 문법 의존 언어라고 한다. 특히 바꿔쓰기 규칙에서 시단(始端) 기호 S에 대해서만 S→α1 A→α1 β일 때 좌변 측(左邊測) 문맥 의존 문법이라고 한다. 같은 방식으로 우변 측 문맥 의존 문법을 총칭하여 변측 문맥 의존 문법이라고 한다."
"문맥 자유 문법, 文脈自由文法, context-free grammar",,"구(句)구조 문법 G = (VN, VT, P, S)의 바꿔쓰기 규칙이 다음과 같은 형태를 지니는 문법. 2형 문법이라고도 한다. &nbsp; 이 문법에서 생성되는 언어를 문맥 자유 언어라고 하며, 2형 언어라고도 한다. 이 문법에 따라서 생성되는 언어의 클래스는 비결정성(非決定性) 후입 선출 자동 장치가 받아들이는 언어의 클래스와 일치한다. 특히 결정성 후입 선출 자동 장치가 받아들이는 언어를 결정성 문맥 자유 언어라고 한다."
"문맥 자유 언어, 文脈自由言語, context-free language",,언어를 형식적으로 연구하기 위해 수학적으로 모델화한 것. 이는 촘스키의 언어 분류 중 세 번째에 해당하는 것으로 현대에 사용되는 대부분의 프로그램 작성 언어들은 그 문법 구조가 이 부류에 속한다. 특히 배커스 나우어 형식(BNF)에 의해서 기술된 언어는 모두 문맥 자유 언어이다.
"문맥 전환, 文脈轉換, context switching",,"①다중 프로그램 작성의 환경에서 어떤 프로그램의 실현을 중단하고 다른 프로그램의 실행을 재개할 때, 그 프로그램의 재개에 필요한 환경을 다시 설정하는 것. 운영 체계(OS)에서 부대 조작(overhead)의 큰 요인 중 하나이다. ②인터럽트 처리 기법의 하나로, 컴퓨터 내부에 복수의 누산기나 레지스터군을 마련해 두고, 인터럽트의 발생과 동시에 이들 레지스터군을 전환하는 방법."
