"모뎀 풀, modem pool",,"셀룰러 모뎀과 유선 모뎀 사이의 통신이 원활할 수 있도록 프로토콜을 변환하여 주는 장치. 무선 단말기 간의 데이터 통신 시에는 두 가입자가 모두 셀룰러 모뎀만 가지고 있으면 통신이 가능하나, 무선 단말기가 기존의 유선 공중 교환 전화망(PSTN)에 연결된 팩스나 개인용 컴퓨터(PC)와 통신하거나 하이텔(hitel) 등 공중 통신망의 부가 서비스를 사용하기 위해서는 별도의 셀룰러 모뎀을 설치하여야 한다. 또한 통신 상대자가 유선인지 무선인지 구분하여 모뎀을 달리 선택해야 하는데, 모뎀 풀을 설치하면 이러한 불편을 해소할 수 있다"
"모뎀 형식, -形式, modem type",,"데이터 통신용 변복조기의 형식. 인쇄 전신기 교환 서비스(TWX)와 텔렉스는 전화선에 연결된 비가청 모뎀이 필수적이다. 단말기로부터 분리된 패키지 모뎀은 독립적이며, 독립된 모뎀은 다른 형태뿐만 아니라 연계국 패키지에도 사용된다. 모뎀 카드는 단말기를 형성하는 단말기 카드 파일 내에 꽂도록 되어 있고, 수신 접촉기가 부족하지만 칩으로 된 모뎀도 있다."
"모듈, module",,①잘 정의된 한 가지 일을 수행하는 프로그램의 논리적인 일부분. 주 프로그램은 논리적으로 몇 개의 모듈로 나뉠 수 있다. 모듈은 여러 프로그램 작성자에 의해 나뉘어 작성되는 성질을 지닌다. 그러므로 모듈이 서로 모여 하나의 완전한 프로그램으로 만들어질 수 있다. ②큰 시스템 중 비교적 독립적인 한 부분.
"모듈라, Modula",,1977년 스위스 취리히 공과 대학의 N. 비르트(Niklaus Wirth) 교수가 개발한 프로세서 제어용 언어의 하나. 동시 처리 특징이 있으며 실시간 또는 분산 운영 체제를 프로그램하는 데 적합하게 설계되어 있다.
"모듈러, modular",,조합될 수 있고 많은 종류의 조합 가능한 기기를 갖는 컴퓨터 시스템 구성 요소의 표준값.
"모듈러 서버, modular sever",,"컴퓨팅, 네트워킹, 스토리지 기능을 하나의 시스템에 통합한 서버. 대용량 네트워크 및 스토리지 기능이 모듈 형태로 탑재되기 때문에, 별도의 스토리지 장비가 필요한 블레이드 서버에 비해 공간 효율성은 높이면서 구축 비용은 낮추고, 시스템 설치의 신속성과 관리의 편리를 갖춘 것이 특징이다. 소규모 시스템이 필요한 중소기업에 적합하다."
"모듈러 접속기, -接續器, modular connector",,"전화기 본체나 정보 기기(개인용 컴퓨터, 팩스 등)와 연결선, 연결선과 전화 회선의 콘센트를 전기적으로 결합하는 데 사용하는 암수가 한 쌍으로 되어 있는 접속 기구."
"모듈러 프로그램 작성, -作成, modular programming",,"하나의 프로그램을 논리적으로 독립된 기능을 수행할 수 있는 작은 부분으로 나누어서 구성하는 방식. 각 모듈은 하나의 입력과 출력을 갖는다. 모듈러 프로그램 작성의 목적은 크고 복잡한 문제를 보다 작고 단순한 모듈로 나누어서 프로그램의 작성을 쉽게 하고, 작성된 프로그램의 유지를 쉽게 하며 신뢰성을 높이는 것이다."
"모듈로 덧셈, modulo addition",,"모듈로만 10진법, 2진법이라 할 때의 법(法)의 의미로 9 mod 5＝4와 같이 최초의 연산수를 제2의 연산수로 나누었을 때의 나머지를 결과로 하는 산술 연산. &nbsp;N, M, R, n은 0 또는 양의 상수이고 n＜R일 때 위와 같은 연산을 모듈로 R 덧셈이라 한다. 컴퓨터 내의 연산은 2진법에 의하는 것으로 모듈로 2덧셈이 이용되고 있다. 모듈로 2덧셈은 배타적-OR 논리에 상당하는 방식으로 A B＝C의 진리표는 표와 같다."
"모듈 방식 설계, -方式設計, modularity design",,"하드웨어나 소프트웨어, 어느 측면에서나 사용되는 용어. 하나의 시스템을 구축하려 할 때 독자적 기능을 가지는 여러 개의 모듈로 나뉘도록 설계하는 방법이며, 각 모듈은 다시 하나의 시스템으로 간주되어 이러한 작업을 반복적으로 계속 수행할 수도 있다. 이와 같이 설계하여 구현하게 되면 시스템에 고장이 발생하거나 오류가 생길 때 발견하기 쉽고 교정도 쉽다."
"모듈성, -性, modularity",,"①하드웨어나 소프트웨어의 구성 요소가 특정한 부분의 교체 없이 쉽게 식별되고 변경되며, 확장될 수 있는 정도. ②운영 체계 프로그램은 제어 프로그램이 모든 작동 프로그램과 동일한 접속부를 갖도록 특정한 표준을 준수하며, 이 표준은 사용자 프로그램에서도 같은 법칙을 따를 수 있도록 서식이 잘 되어 있는데, 사용자가 표준에 정해진 법칙을 따르면 제어 부분이나 처리 프로그램을 모듈러 방식으로 변경하거나 바꿀 수 있는 성질."
"모듈형 허브, -型-, modular hub",,"다양한 망의 각종 모듈로 구성된 네트워크 허브. 하나의 샤시나 카드 케이지에 다수의 카드 슬롯이 있고, 각 슬롯은 통신 카드나 모듈과 연결되어 하나의 허브로 동작한다."
"모드, Module, MOD",,"음원을 내장한 사운드 파일. WAV나 AU 등의 음원과 MID의 악보 정보가 함께 내장되어 있는 모듈 파일로, 모듈 파일은 각각의 악기를 트랙이라는 독립된 채널로 연주하는데, 보통 4~8가지 트랙을 사용하며, 최대 32트랙을 지원하는 포맷도 있다. 모드(MOD) 파일을 연주하는 프로그램을 트랙커(tracker)라 한다."
"모드, mode",,"[광/송/기] 공진계 또는 도파계에서 전자계가 어떤 고유의 분포를 하는 상태. 레이저 빔 단면 내의 진폭 분포를 모드 패턴이라 한다. 광공진기의 광축 방향의 모드를 세로(종) 모드라 하고, 광공진기 및 광도파로의 광축에 수직인 방향의 모드를 가로(횡) 모드라 한다. 단일의 모드일 때 단일 모드라 하고 그렇지 않을 때를 다중 모드라 한다. [무] 전자파 등의 진동 상태. 웨이브 모드라고도 한다. 자유 공간이나 2선식 선로를 따라서 전파하는 전자파는 TEM파라고 하는 것과 같이 전기적으로나 자기적으로 횡파이며, 그 모드는 간단하지만 도파관 내를 전파하는 파는 전기적 횡파(TE파) 또는 자기적 횡파(TM파)가 되어 그 모드를 표시하는데, TEmn, TMmn라는 기호를, 공동(空洞) 공진기의 경우는 TElmn, TMlmn라는 기호를 쓴다. 첨자 l, m, n은 경계 조건이 정해지는 전자파의 고유값이며, 직사각형 도파관에서 m, n은 횡단면 좌표 x, y에 따른 전계 또는 자계 변화의 반주기의 수를 가리킨다. 원형 도파관에서 m은 원주 방향에 따른 전계 또는 자계 변화의 1주기의 수, n은 반지름 방향에 따른 변화의 반주기의 수를 가리킨다. TE파, TM파 대신에 H파, E파라고도 한다."
"모드 간섭, -干涉, mode interference",,도파관 이론에 기초를 둔 1차 모드와 고차 모드(주로 2차 모드)가 간섭하는 현상. 그 결과 위상 차가 거리 차에 비례하지 않는 현상이 일어난다.
"모드 결합, -結合, mode coupling",,광도파로에서 모드 간의 전력 교환. 전력 교환은 평형 길이라고 하는 유한한 거리를 전파한 후 통계적 평형 상태에 도달한다.
"모드 내 일그러짐, -內-, intermodal distortion",,단일 모드 광도파로(single-mode optical waveguide)에서 하나의 전파 모드의 군(群) 속도 분산으로 생기는 일그러짐.
"모드 동기, -同期, mode locking",,"다중 모드로 발진하는 레이저에서 모드 상호 간에 일정한 위상 관계를 유지시키는 조작. 시간폭이 좁은 고속의 광 펄스를 얻는 방법으로 쓰인다. 포화성 흡수체를 쓴 수동 모드 동기, 레이저 매질의 비선형으로 인하여 자발적으로 생기는 자기 모드 동기, 레이저 내에 변조기를 두어 모드 간격과 같은 주파수로 변조하는 강제 모드 동기 등이 있다. 수동 모드 동기에 대하여 강제 모드 동기를 능동 모드 동기라고도 한다."
"모드 변환, -變換, mode conversion, mode mixing",,광도파로에서 각 모드가 상호 결합되어 그 전력이 이행하는 것. 구부러진 곳이나 접속부에서의 부정합(不整合) 등으로 일어난다.
"모드 부피, mode volume",,광도파로가 가질 수 있는 구속 모드의 수. 즉 V＞5일 때 계단형 굴절률 분포의 광도파로와 언덕형 굴절률 분포의 광도파로에 대해서 근사적으로 각각 V2/2과 V2/［2g/(cg＋2)］의 값으로 주어지며 여기서 V와 g는 각각 정규화 주파수와 굴절률 분포 변수를 나타낸다.
"모드 분리, -分離, mode separation",,"각종 진동 모드 중에서 특정 모드의 파를 분리하는 것. 모드 필터 등을 사용하여 도파관 내의 복잡한 파동 모드 중에서 특정의 TE10파만 끄집어내거나, 마그네트론의 동작 조건이 약간 변하였기 때문에 진동 모드가 비약하는 것을 피하기 위하여 양극 주변에 홈을 만든 다음 균압환을 메워 특정의 모드만을 분리하는 것을 예로 들 수 있다."
"모드 분배 잡음, -分配雜音, mode partition noise",,"다중 모드로 발진하는 반도체 레이저를 직접 변조하였을 때, 각 모드 사이의 출력의 흔들림이 광섬유를 전파한 수에 총출력의 흔들림으로 변환되어 생기는 잡음."
"모드 분산, -分散, mode dispersion",,다중 모드 광도파로에서 각 모드의 군속도가 달라지는 것. 전송되는 펄스 폭이 넓어지는 원인이 된다.
"모드 분포, -分布, mode distribution",,다중 모드 광도파로에 여진되어 있는 각 모드 사이의 상대적인 전파계의 진폭 분포.
"모드 선택, -選擇, mode selection",,레이저를 단일 모드로 발진시키는 것. 이것을 위한 장치를 모드 선택기라 한다.
"모드 순도, -純度, mode purity",,"도파관 내를 전송하는 파동 모드의 순도. 예를 들어 직사각형 도파관을 원형 도파관에 결합할 경우에는 적당한 테이프를 붙여 반사 손실이 없게 하는데, 이때 원형 도파관에는 바라는 모드의 파뿐만 아니라 다른 모드의 파도 혼입될 우려가 있다. 그럴 때는 모드 필터를 사용하여 바라는 TM01파만을 통과시키고 다른 모드를 저지하는데, 이 경우의 관내 모드의 순도를 말한다."
"모드 잡음, -雜音, modal noise, mode noise",,다중 모드 광섬유에서 도파 모드 간의 간섭 상태가 변화함으로써 생기는 잡음.
"모드칩, modification chip, modchip",,"게임기나 DVD 플레이어에서 소프트웨어에 걸려 있는 잠금이나 제한 기능을 무력화하기 위해 기기에 부착하거나 개조하는 부품.  일반적으로 게임기에서 각종 제한 기능을 풀어 놓거나, 불법 복사된 게임을 구동시킬 때, 그리고 DVD 플레이어에서 모든 지역의 DVD를 감상하기 위해 지역 코드 제한을 무력화시킬 목적으로 사용한다."
"모드 푸싱, mode pushing",,다중 모드 레이저에서 능동 매질의 비선형 효과로 인하여 발진 주파수가 스펙트럼선의 바깥 방향으로 쏠리는 것.
"모드 풀링, mode pulling",,"매질의 굴절률 분산 때문에 레이저의 발진 주파수가 공진기 이론과는 달리 공진 주파수에서 벗어나는 것. 증폭 매질의 이상 분산은 흡수선(吸收線)의 경우와는 반대로 중심 주파수를 기준으로 하여 저주파 쪽에서는 부, 고주파 쪽에서는 정이다. 따라서 발진 주파수는 중심 주파수의 방향으로 변위한다."
"모드 필드 직경, -直徑, Mode Field Diameter, MFD",,"단일 모드 광섬유에서 광 에너지의 직경. 일반적으로 모드 필드 직경(MFD)은 실제 광 코어 직경보다 크므로(1µm 정도), 매개 변수로서는 광 코어 직경으로 대체한다. MFD는 광섬유 접속에 편리한 매개 변수로서 MFD가 같은 광섬유 상호 접속은 손실이 적게 된다."
"모드 필터, mode filter",,"도파관 내에 전송되는 특정 모드의 전자파만을 저지하는 필터. 그림은 원형 도파관의 TE01, TM01 모드의 전계 분포와 선상 스크린을 표시한 것인데, 이와 같은 모드 필터를 원형 도파관 내의 일부에 삽입하면 전자의 경우는 TE01파를, 후자의 경우는 TM01파를 저지할 수가 있다."
"모드 호핑, mode hopping",,"단일 모드 발진 중에 레이저 다이오드의 출력광이 어떤 한 모드에서 갑자기 다른 모드로 전환(shift)되는 현상. 레이저는 보통 어느 종 모드(즉, 어떤 파장)에서 발진하고 있지만, 레이저 온도 변화에 의해 파장이 느리게 변화되면서 급속히 스텝 모양으로 변환된다. 느린 파장 변화는 굴절률의 온도 변화에 의한 것이며, 스텝 모양의 파장 변화는 밴드 갭 에너지의 온도 변화에 의한 것이다."
"모드 혼합기, -混合器, mode scrambler",,"광섬유에서 모드 결합을 유도하는 장치, 또는 강한 모드 결합이 일어나는 1개 이상의 광섬유들로 구성된 장치. 광원의 특성과 무관한 모드 분포를 만드는 데 사용되기도 한다."
"모바일 2.0, Mobile 2.0",,"유선의 웹 2.0처럼 모바일 기기의 진화로 사용자가 만든 콘텐츠를 모바일 기기로 즐길수 있는 환경. 이미 노키아, 구글, 애플 사 등 모바일 관련 업체는 제3자를 통해 다양한 서비스를 창출하고 콘텐츠를 강화하기 위해 운영 체계(OS)를 개방하여 누구나 애플리케이션을 개발해 유통할 수 있게 하였다."
"모바일 3D 서비스, Mobile 3D Service",,3차원 모바일 방송 및 통신 서비스. 모바일 방송 및 통신 시스템을 통해 기존의 2D 정보에 깊이 정보를 가지는 영상이나 보조 데이터를 부가적으로 전송하여 3차원으로 텔레비전 및 멀티미디어 서비스를 제공하는 것을 말한다.
"모바일 IP, Mobile IP, MIP",,"사용자가 다른 지역 인터넷망으로 이동할 때, 사용 중인 IP 주소를 그대로 사용하여 통신의 지속성을 유지시켜 주는 기술. 인터넷은 여러 서브넷이 라우터를 통해 연결되어 있는 형태로 구성되어 있어 이동 단말기가 다른 서브넷 지역으로 이동하면 인터넷 접속이 끊기도록 되어 있다. 모바일 IP(MIP)는 이러한 문제점을 해결하고자 제안된 기술로 단말기가 어느 서브넷 지역으로 이동하더라도 통신이 가능하다. 자신이 등록된 네트워크 라우터를 홈 에이전트(HA), 이동하여 접속한 다른 네트워크 라우터를 포린 에이전트(FA)라고 한다. HA로 도착한 패킷은 터널링 기법을 통하여 FA를 통해 전달된다."
"모바일 IPTV, Mobile IPTV",,"사용자에게 서비스 품질/체감 품질(QoS/QoE), 보안, 이동성, 양방향성을 제공하는 IP 기반 유무선망을 통해 텔레비전, 비디오, 오디오, 텍스트 및 그래픽을 포함한 멀티미디어를 제공하는 기술. 어디서나, 심지어는 이동 중에도 IP 텔레비전(IPTV)을 즐길 수 있다. 구현 방법은 디지털 멀티미디어 방송(DMB)과 같은 모바일 TV에 IP 기술을 접목하거나 기존 IPTV에 이동성 기능을 추가한 개념으로, 이동 전화나 무선 인터넷 등 다양한 무선 기술을 이용해 이동 환경에서도 IPTV 서비스를 제공하는 방법 등이 있다."
모바일 OK,,"웹 국제 표준화 단체인 월드 와이드 웹 컨소시엄(W3C) 산하 모바일 웹 이니셔티브(MWI) 그룹에서 제정한 모바일 웹 표준. 모바일 브라우징 환경에 대한 표준화로, 휴대폰을 비롯한 다양한 이동 단말에서 기존 인터넷과 포털에서 제공하는 각종 콘텐츠와 서비스를 비롯한 다양한 웹 콘텐츠를 자유롭고 불편함 없이 이용할 수 있도록 마크업 언어, 단말 정보 규격, 응용 환경 들을 표준화하는 작업이다. 모바일 OK 표준의 실증을 거치면 PC에서만 이용 가능했던 지도 서비스나, 블로그, 웹2.0 응용 서비스를 휴대폰에서도 손쉽게 이용할 수 있게 된다."
"모바일 RFID 리더, Mobile RFID Reader",,"모바일 RFID용으로 만들어진 모바일 RFID 리더 모듈을 휴대폰, PDA, WiBro 단말, 등의 각종 휴대 단말기에 장착하여 RFID 태그의 정보를 판독할 수 있도록 한 휴대 단말기."
"모바일 RFID 서비스 제공자, -提供者, mobile RFID service provider",,"모바일 RFID 이용자에게 텍스트, 이미지, 동영상, 음악, 등과 같은 다양한 종류의 콘텐츠를 제공하여 읽기, 듣기, 보기, 주문/결제 등 정보생활을 누릴 수 있도록 콘텐츠 정보 자원을 제공하는 자."
"모바일 RFID 취급 사업자, -取扱事業者",,"RFID 칩이나 태그 및 RFID 태그가 부착 또는 내장된 물품을 제조, 판매하거나, RFID 태그에 기록된 물품 정보 등을 개인정보와 연계하는 자 및 RFID 태그에 개인정보를 기록하거나 RFID 태그에 기록된 개인정보를 수집하는 자."
"모바일 RFID 태그, Mobile RFID Tag/Transponder",,"모바일 RFID 서비스에 활용되는 RFID 태그. ISO/IEC 18000-6B와 ISO/IEC 18000-6C, 및 EPC C1-Gen2 등 세 가지 종류가 있다. 모바일 RFID 서비스에서는 ISO/IEC 18000-6C 규격을 기본으로 ISO/IEC 18000-6B를 선택 사항으로 규정하고 있으나, ISO/IEC 18000-6C의 규격이 EPC C1-Gen2 규격과 동등 내지는 상호호환성이 있기 때문에 EPC C1-Gen2 규격의 태그도 지원한다."
"모바일 SI, Mobile System Integration",,"기업의 주요 업무 시스템과 모바일 시스템을 통합하는 것. 즉, 유선 기반에서 작동하는 기존의 그룹웨어나 ERP, CRM, KMS 등 기업의 업무 시스템들을 모바일 디바이스를 통해서도 사용할 수 있도록 시스템을 통합하는 것을 말한다."
"모바일 TV 표준, -標準, Mobile TV Standard",,"휴대 또는 차량용 단말기로 이동중에도 TV방송을 수신할 수 있는 이동방송 표준. 전송망에 따라 지상파, 위성, 이동통신으로 표준을 달리하고 있다. 지상파 표준은 우리나라가 개발한 T-DMB, 노키아의 DVB-H, 퀄컴의 MediaFLO, 일본의 One-Seg가 있으며, 이들은 2007년 ITU에서 복수의 국제표준으로 채택되었다. 위성의 경우 우리나라와 일본에서 서비스중인 S-DMB가 있으며, 이동통신의 경우 3GPP에서 개발중인 MBMS 등이 있다."
"모바일 T머니, Mobile Telephone Money",,휴대 전화로 지원하는 금융 서비스 기능. 3세대 이동 통신(3G) 휴대 전화의 범용 가입자 인증 모듈(USIM) 칩에 T머니 자동 충전과 결제 기능을 탑재해 교통 결제와 온라인/오프라인 유통 결제를 가능하도록 한 결제 서비스 기능이다.
"모바일 가상화, -假想化, Mobile Virtualization",,"하나의 스마트폰을 가상화하여 두 대의 스마트폰처럼 사용하는 기술. 개인용 스마트폰에 또 다른 운영체체(OS)를 가상으로 생성하여 업무용으로 분리시키는 것이다. 개인용 문자 메시지, 통화 내역, 전화 번호 등은 업무용 애플리케이션과는 접근 경로를 차별화하여 정보가 보호될 뿐 아니라, 이후 요금까지도 개인용과 업무용으로 분리하여 사용료를 받을 수 있다."
"모바일 게이트웨이, Mobile Gateway",,휴대용 단말기를 포함하여 선박이나 항공기 등에서 사용하고 있는 단말에 인터넷 서비스를 제공하는 기술. 사용자 단말 및 시스템 내부의 구성 요소에 이동체 내에서 인터넷과의 끊김 없고 안정적인 통신이 보장되는 서비스를 제공한다.
"모바일 게임, mobile game",,"휴대 전화, 개인 휴대 정보 단말기(PDA), UMPC 등 휴대용 기기에서 실행되는 게임. 다만 별도의 플랫폼을 가지고 실행되는 플레이 스테이션 포터블과 같은 게임은 핸드헬드 게임으로 분류한다. 휴대 단말용 3D 엔진 및 전용 게임 전화가 출시됨에 따라 모바일 단말을 통해서도 3D 게임을 즐길 수 있게 되었다."
"모바일 광개토 플랜, -廣開土-, Mobile Gwanggaeto Plan",,"이동통신 주파수를 추가 확보하기 위한 우리나라의 모바일 광대역 계획. 모바일 광개토 플랜은 2011년 방송통신위원회가 우리나라의 모바일 광대역을 위하여 2020년까지 이동통신용으로 600 메가헤르츠(MHz) 대역폭을 추가로 확보하려는 계획이다. 그러나 모바일 트래픽의 증가율이 당초 예상보다 매우 높아짐에 따라 2012년에 '모바일 광개토 플랜'을 더욱 확대, 발전시켜 모바일 광개토 플랜 2.0을 수립하였다. 주요 내용으로 2023년까지 총 1,190 메가헤르츠(MHz)를 추가로 확보하는 내용으로, 단기간에 회수/재배치가 가능한 대역은 배타적으로 할당하고, 회수/재배치가 어려운 대역은 주파수 공동사용 방법으로 공급할 예정이다."
"모바일 금융, -金融, mobile finance, m 금융",,"이동 통신 단말을 이용하여 금융 업무를 수행하는 것. 3세대 이동 통신(3G)에서는 2G에서처럼 은행에서 칩을 받아 장착하지 않고, USIM 카드로 관련 애플리케이션을 내려받기하면 된다."
"모바일 기기 기본 보호프로파일, -器機基本保護-, Mobile Device Fundamentals Protection Profile, MDFPP",동의어 : 모바일 기기 공통 보호프로파일,"국제 공통평가기준(CC: Common Criteria)을 준용하여 모바일 기기에 대한 보안 인증 요구 사항을 기술한 국제 표준. 스마트폰, 태블릿PC 등 모바일 기기 보안의 핵심이 되는 키 관리(key management), 암호 모듈, 기기 암호화, 와이파이(Wi-Fi) 보안, 화면 잠금(screen lock) 및 단말 관리 등에 대해 80여 개의 보안 요구 사항을 기술한다. 2013년 10월 모바일 기기의 국제 보안 인증을 위해 미국 국가정보보증협회(NIAP: National Information Assurance Partnership) 주도로 영국, 캐나다 등의 정부기관과 삼성전자, 애플(Apple), 마이크로소프트(Microsoft), 블랙베리(Blackberry), 모토로라(Motorola) 등 글로벌 기업이 함께 만들었다. ※ 미국 국가정보보증협회(NIAP)는 1997년 미국 국립표준기술연구소(NIST)와 국가안보국(NSA) 주관으로 설립한 공통평가기준(CC) 인증기관이다."
"모바일 기반 서비스, -基盤-, Mobile Originated service, MO 서비스",,특정 번호가 부여된 서버나 PC로 휴대폰을 통해 SMS 메시지를 전송하고 서버에서 메시지를 받아 다른 형태의 데이터로 가공 또는 원본을 온라인 또는 다른 매체에서 보여 주는 P2M(Person To Machine) 서비스. 휴대폰끼리 주고받는 일반적인 문자메시지와는 차별화된다.
"모바일 기업 애플리케이션 플랫폼, -企業-, Mobile Enterprise Application Platform, MEAP",,"많은 엔터프라이즈 애플리케이션을 모바일 환경에 적용하기 위한 프레임 워크. 스마트폰 실용화로 촉발된 기업의 업무 환경이 모빌리티를 수용하지 않으면 안 되는 환경으로 빠르게 변하고 있다. 스마트 워크를 위한 스마일 오피스 구현 기업이 빠르게 확산되고 있으며, 이러한 환경 변화에 능동적으로 대응하고 기업의 경쟁력을 높이기 위해 기존의 애플리케이션 플랫폼에 모바일을 포함하는 애플리케이션 플랫폼으로 진화된 형태가 MEAP이다."
"모바일 노드, Mobile Node, MN",,"모바일 IP 망에서 IP 주소의 변경없이 다른 서브 망으로 연결점을 변경시키는 이동 호스트나 라우터. 항상 홈 주소를 가지고 있으면서 홈 네트워크를 벗어나면 에이전트 인식을 통해 움직임을 판단하고, 외부 에이전트 보조 주소(COA) 또는 인접 COA를 사용하여 홈 에이전트(HA)에 등록하고, 그 COA 터널을 통해서 HA와 통신한다."
"모바일 디스플레이 디지털 인터페이스, Mobile Display Digital Interface, MDDI",,퀄컴사가 제안한 모바일 디스플레이 데이터 전송 기술 표준. 휴대폰의 모뎀과 액정 표시 장치(LCD) 간 병렬형 데이터 전송 방식을 직렬 방식으로 전환하여 회로를 간단히 하고 전력 소모를 줄인 데이터 전송 기술이다.
"모바일 멀티미디어 기술 연합, -技術聯合, Mobile Multimedia Technology Alliance, MMTA",,"중국의 최고 정보 통신(IT) 정책 입안 기관인 정보산업부와 반도체 기업인 비미크로(Vimicro), 통신 장비 공급사인 후아웨이 테크놀러지스(Huawei Technologies), ZTE사, 주요 유무선 통신 사업자 4개 회사 등이 참여하여 기술 혁신과 표준의 진흥 및 3G 애플리케이션의 대중화를 위해 2004년에 설립한 기관. 모바일 멀티미디어 기술 연합(MMTA)는 국제적 기업과 표준 기구의 국내외 협력 기구로서의 역할을 담당하며 중국 기업의 기술적 역량과 협력을 강화함으로써 외국 기업의 IP에 대한 의존도를 낮추는 것을 목표로 삼고 있다."
