"볼륨 이중화, -二重化, volume dualization",,볼륨상의 데이터를 볼륨 단위로 이중화하는 기능. 같은 데이터를 물리적으로 존재하는 2개의 볼륨을 사용하여 논리적으로 존재하는 하나의 볼륨을 구성한다.
"볼륨 일련번호, -一連番號, volume serial number",,"개인용 컴퓨터(PC)가 하드 디스크나 테이프 장치의 볼륨을 인식하는 유일한 식별 번호. 포맷 프로그램에 의해 자동으로 지정되며, 사용자가 변경할 수 없다."
"볼륨 제어 블록, -制御-, Volume Control Block, VCB",,"파일 시스템에서 볼륨 목록(VTOC : volume table of contents) 안의 제어 블록들인 파일 입구 블록(FEB : file entry block), 빈 영역 블록(FSB : free space block), 앞으로 쓸 블록(FUB : future use block) 등을 관리하기 위한 제어 블록. VTOC 안에 오직 하나 존재한다. use block……앞으로 쓸 블록."
"볼멧, VOLMET",,"국제선을 비행하는 항공기의 운항에 필요한 항공 기상 통보(주요 비행장의 일기 개황 및 예보). 태평양 지역에는 호놀룰루, 오클랜드, 샌프란시스코, 도쿄, 홍콩 등지의 항공 기상대의 무선국에서 이 지역을 항행하는 항공기국을 대상으로 HF대의 전파를 국제적으로 협정된 방송 시간에 따라 순차적으로 방송한다. 태평양 지역(PAC) 볼멧 방송은 세계 협정시(UTC) 매 시 10분부터 15분까지, 매 시 40분부터 45분까지 2회에 걸쳐 J3E 전파 2,863kHz, 6,679kHz, 8,828kHz 및 13,282kHz 등 5개 주파수로 항공기상 방송을 하고 있다."
"봇, bot",,"①로봇의 줄임말로 데이터를 찾아주는 소프트웨어 도구. 인터넷 웹 사이트를 방문하고 요청한 정보를 검색, 저장, 관리하는 에이전트의 역할을 한다. ②보안이 취약한 컴퓨터를 스스로 찾아 침입해 보이지 않는 곳에서 조용히 작동하면서 컴퓨터 사용자도 모르게 시스템에게 명령을 내릴 수 있는 원거리 해킹 툴. 봇(bot)은 채팅 서버와 P2P 네트워크를 통해 컴퓨터를 감염시켜, 해커들이 마음대로 지시를 내릴 수 있으며, 다른 컴퓨터를 공격하도록 명령하거나 감염된 시스템에서 정보를 빼낼 수 있어 보안 문제 가운데 하나가 되고 있다. ☞좀비피시(PC)"
"봇넷, botnet",,"악성 프로그램에 감염되어 나중에 악의적인 의도로 사용될 수 있는 다수의 컴퓨터들이 네트워크로 연결된 형태. 봇넷은 해킹 또는 악성 프로그램에 감염된 컴퓨터를 네트워크로 연결하고, 해커는 봇넷에 연결된 컴퓨터를 원격 조종해 개인 정보 유출, 스팸 메일 발송, 다른 시스템에 대한 공격 등 악성 행위를 한다."
"봇헌터, BotHunter, BT",,미국 조지아 공과대학에서 발표한 봇넷 탐지 기술의 하나. 침입 탐지 시스템(IDS) 기반 로그를 이용해 네트워크 트래픽을 분석해 이미 잘 알려진 악성 코드와 비교하여 봇넷을 탐지하는 기술이다. IDS 기반 로그를 이용하기 때문에 암호화된 채널을 이용하거나 감추어진 스캐닝 기법을 이용하는 악성 코드는 탐지가 어렵다.
"봉투, 封套, envelope",,"메시지 통신 처리 시스템(MHS)에서의 메시지 구성 요소. 메시지는 그림과 같이 봉투와 내용으로 구성되는데, 봉투에는 메시지의 식별 번호, 발신자와 수신자 및 내용 유형 등 메시지 전송 시스템(MTS)이 메시지를 전송하는 데 사용되는 식별 정보와 메시지의 전송 이력이 수록된다."
"부가, 附加, attach",,"[컴] 컴퓨터에 여러 종류의 주변 장치를 접속하는 일. 운영 체계의 용어로서 실행 중의 태스크 요구에 의하여 서브태스크(subtask)를 기동하여 주 태스크와 평행적으로 실행할 수 있는 상태로 하는 것이다.[교] 대기 행렬에 트랜잭션을 연결하는, 즉 등록하는 것. 역으로 트랜잭션을 인출하는 것을 분리(detach)라고 한다."
"부가 2차 위상 계수, 附加二次位相係數, Additional Secondary Phase Factor, ASF",,"로란 C(LORAN-C)에서 송신점에서 수신점까지 전파가 전파(傳播)할 때, 전파로가 육상 또는 육상과 해상이 혼재할 때의 전파 시간과 전파로가 모두 해상일 때의 전파 시간의 차."
"부가 가치 및 데이터 서비스, 附加價値-, Value Added And Data Services, VADS",,영국에서 기본 서비스 이외의 서비스의 총칭. 영국에서는 1987년 4월에 발효한 부가 가치 및 데이터 서비스에 관한 등급 면허에 따라 부가 가치 및 데이터 서비스(VADS)의 제공 조건이 규정되어 있다. VADS는 미국의 고도 서비스의 개념에 상당한다.
"부가 가치 서비스, 附加價値-, value added service",,"부가 가치 통신망(VAN)에서 전송이라는 기본적인 통신 서비스에 대하여, 회선 교환, 패킷 교환, 프로토콜 변환, 부호 변환, 통신 속도 변환, 정보의 축적/전송, 매체 변환, 계산 처리, 데이터베이스의 제공 등 여러 가지 기능을 제공하는 통신 서비스."
"부가 가치 통신망, 附加價値通信網, Value Added Network, VAN",,"공중 통신 사업자로부터 회선을 대여받아 고도의 통신 처리 기능으로 부가 가치를 높여 서비스를 제공하는 통신망. 부가 가치 통신망(VAN)의 본래 의미는 전화 또는 텔렉스 통신 서비스 기능을 첨가한 데이터 통신망을 지칭하는 개념이었으나, VAN의 부가 가치는 일반적으로 프로토콜, 부호, 형태, 미디어, 속도 등의 변환을 전송에 부가하여 행하는 통신 처리에 있다. 이러한 VAN 서비스는 컴퓨터의 발달과 함께 서비스가 다양화되고 이용이 증가하고 있다."
"부가 가치 판매, 附加價値販賣, Value Added Resale, VAR",,"매입한 상품에 특정한 업종, 업무에 특정 사업화한 부가 가치를 부가시켜 시스템으로 재판매하는 것."
"부가 가치 판매업자, 附加價値販賣業者, Value Added Retailer, VAR",,제조원의 제품을 매입하여 부가 가치를 가해 판매하는 소도매업자. 미국에서 1983년경 등장하였다.
"부가 백색 가우스 잡음, 附加白色-雜音, Additive White Gaussian Noise, AWGN",,"넓은 주파수 범위라는 특징을 지니는 통계적으로 랜덤 분포하는 백색 잡음 신호. 모든 색의 빛이 합치면 백색이 된다는 색의 원리와 마찬가지로 모든 주파수의 신호가 합쳐진 상태를 의미하며, 여기에 확률변수로는 가우시안 형태를 가지고, 원래의 신호에 더해진다는 의미이다. 자유공간으로 전파되는 전자파는 공간에 항상 존재하는 어떤 잡음을 고려해야 하는데 그 경우에 일반적으로 사용되는 개념이다."
"부가 비트, 附加-, overhead bit",,"주 신호의 감시, 절체 제어 등을 원활하게 하기 위해 전송계의 인터페이스에 부여되는 비트."
"부가 서비스, 附加-, supplementary service",,"통신망에서 기본적인 서비스에 추가하여(부수적으로) 제공되는 서비스. 종합 정보 통신망(ISDN)에서 착신자에게 발신 측의 ISDN 번호를 알려 주는 발신 번호 표시(CLIP)나, 요금을 지불해야 하는 사용자에게 이용 요금을 통지해 주는 이용 요금 통지(advice of charge)와 같은 것이 있다."
"부가식 확인 응답, 附加式確認應答, piggyback acknowledgement",,"전송 채널 대역의 사용 효율을 높이기 위해 수신한 전문에 대해 확인 응답 전문을 따로 보내지 않고, 상대편에게 데이터 전문에 확인 응답을 함께 실어 보내는 방법. 그러나 상대편에게 보낼 데이터 전문이 오랫동안 발생하지 않으면 응답 회신을 무한정 지연시킬 수 없기 때문에, 각 수신 전문에 대해 타이머를 작동시켜 타임 아웃되는 경우 개별적인 응답 전문을 회신하여 송신 측이 다음 동작을 취할 수 있도록 한다."
"부가 전화기, 附加電話器, additional telephone set",,"전화 회선에 분기 접속 또는 전환기, 전환 스위치 등으로 부가 증설된 전화기. 착신 전송, 전화기 상호 간의 통화, 비화 등의 기능을 부가한 것도 있다."
"부가 전화기 결선법, 附加電話機結線法, additional telephone wiring plan",,"부가 전화기 중에서 2개 이상의 전화 회선에 전환기 등으로 인해 공통으로 접속되는 부가 전화기 방식. 2회선용과 3회선용이 있고, 1회선에 사용할 수 있는 전화기는 5대 이내이다."
"부가 지원 처리기, 附加支援處理器, Attached Support Processor, ASP",,여러 개의 짧은 작업을 처리하는 데 효율을 높이기 위해 여러 컴퓨터를 서로 연결한 것. 보통 2개의 컴퓨터를 채널 접합기로 연결한다.
"부가 채널, 附加-, augmentation channel",,"고선명 텔레비전(HDTV) 시스템에서 전송을 위해 부가적으로 사용하는 별도의 채널. HDTV 시스템 중에는 호환성을 위해 영상 신호를 전송할 때 주(主) 채널과 부가 채널을 사용한다. 이때, 주 채널은 기존의 색채 텔레비전 신호의 전송을 위해 사용되며, 부가 채널은 화면비를 늘리기 위한 측면 신호나 수평 및 수직 해상도의 향상을 위한 부가 신호의 전송을 위해 사용된다."
"부가 통신 사업자, 附加通信事業者, Value Added Common Carrier, VACC",,"기간통신사업자에게 전기 통신 회선 설비를 임차하여 기간 통신 역무 이외의 전기 통신 역무를 제공하기 위해 방송통신위원회 위원장에게 신고하고 사업을 영위하는 자. 부가통신사업에는 전송이라는 기본적인 통신 서비스에 컴퓨터 기능을 결합하여 회선 교환, 부호 변환, 통신 속도 변환, 정보의 축적/전송, 매체 변환, 계산 처리, 데이터베이스의 제공 등 향상된 통신 서비스가 있다.&nbsp;"
"부가 회선 용량, 附加回線容量, additional trunk capacity",,어느 회선군에서 호 손율을 일정하게 유지하고 1회선을 증가함에 따라 전송할 수 있는 호량의 증가분.
"부고조파 믹서, 副高調波-, Sub-Harmonic Mixer, SHM",,"로컬 오실레이터(LO)의 고조파를 이용하는 믹서. 믹서는 RF 시스템에서 높은 주파수를 낮은 주파수로 또는 낮은 주파수를 높은 주파수로 바꾸는 장치로 RF, LO, IF, 3개 포트로 구성된다. LO는 RF에서 IF를 뺀 주파수로 RF가 높을 경우 LO도 높아야 하기 때문에 구현이 어렵다. 그러나 SHM은 LO 주파수의 n고조파를 이용하기 때문에 LO 주파수는 1/n이 되어 주파수가 쉽게 발생할 수 있다."
"부궤환 위상 검파 방식, 負饋還位相檢波方式, negative feedback phase detection system",,각도 변조파의 보조로 사용되는 방식. 수신 신호와 직각의 위상차를 가져 그로부터 충분히 큰 레벨의 복조용 국부 발진 신호를 가해서 진폭 변조로 변환한 후에 포락선 검파한다. 따라서 수신 신호 레벨이 잡음 레벨보다 저하해도 복조 신호를 판별할 수 있다. 이 경우 위상 검파기의 직선성의 양호한 범위는 매우 작으므로 복조 출력을 국부 발진기에 부궤환하여 검파기의 압축을 한다. 이것은 고감도 수신 방식의 일종으로 전송 품질을 향상시켜 한계(threshold)를 개선하는 것이다.
"부당 변경, 不當變更, tampering",,시스템이나 장비의 정당한 기능을 변경하는 비승인된 수정 행위. 시스템이 제공하는 보안 기능의 약화나 기능성의 훼손을 초래할 수 있다.
"부대 서비스망, 附帶-網, grapevine",,"메시지 전달, 자원의 위치, 신원 확인, 사용 통제 등의 서비스를 제공하는 컴퓨터망. 분산과 복제의 2가지 형태로 구성되는데, 분산은 서비스의 일부가 망을 통해 교신하는 여러 대의 컴퓨터 개입으로 제공되는 것이고, 복제는 서비스가 여러 대의 다른 컴퓨터에서 동일하게 제공되는 것이다. 부대 서비스망의 원래 목적은 우편의 전산화에 있었으나, 다른 여러 가지 목적에도 사용될 수 있도록 융통성 있는 구조를 가지고 있다."
"부대역 부호화 APC, 副帶域符號化-, Sub-Band Coding With Adaptive Predictive Coding, SBC-APC",,"음성 신호 부호화의 한 방식. 표준적인 펄스 부호 변조(PCM)에 의한 디지털화 신호의 비트 수(64kbps)를 낮추어 줄이기 위한 방법의 하나로서, 음성 대역을 2분할하여 각각의 부대역을 적응 예측 부호화 방식(APC)에 의하여 부호화한다."
"부대역 부호화 방식, 副帶域符號化方式, Subband Coding, SBC",,"영상 신호나 음성 신호를 주파수가 다른 복수의 대역 신호로 분할하여 대역 신호마다 신호의 특성과 중요도에 따라서 부호화 방식이나 비트 수 할당 등을 달리하여 부호화하는 방식. 입력 신호를 대역 분할 필터로 복수의 대역 신호로 분할하여 부호화하고, 복호 측에서는 대역 합성 필터로 원래의 대역 신호를 재생하여 합성한다. 대역 신호마다 다른 부호화법을 사용하여 그에 적합한 부호화를 함으로써 고능률 부호화를 할 수 있고, 대역 신호마다 비트 수의 배분이나 부호화 정확도를 설정할 수 있어서 각 대역 신호의 중요도나 부호화 잡음에 대한 인간의 지각 감도 등에 따라서 부호화 오차를 제어할 수 있다. 부대역 부호화에서는 변환 부호화에서와 같이 블록 단위의 처리를 하지 않기 때문에 블록 일그러짐이 생기지 않고, 전송로에서 생긴 오류가 그 대역 신호 이외에는 영향을 미치지 않는 특징이 있다. 또한 대역 신호마다 병렬 처리할 수 있기 때문에 샘플링 주파수가 높은 신호를 취급하는 데 유리하다. 음성의 부대역 부호화는 엠펙(MPEG) Ⅰ, Ⅱ나 디지털 콤팩트 카세트(DCC)에서 이미 실용화되고 있다. "
"부대역 적응 차분 펄스 부호 변조, 副帶域適應差分-符號變調, Sub-Band Adaptive Differential Pulse Code Modulation, SB-ADPCM",,"입력 신호를 저역(50Hz~4kHz)과 고역(4~7kHz)으로 나누고 저역에는 64kbps 중 48kbps를, 고역에는 16kbps를 할당하여 부호화하는 적응 차분 펄스 부호 변조(ADPCM) 방식의 하나. 고품질의 음성을 다루는 방식에서 주로 사용하며 G.722에서 채택하고 있다."
"부 돌출부, 副突出部, side lobe",동의어 : 사이드 로브,안테나의 주 빔 방향 이외에 방사되는 전파.
"부 돌출부 억압, 副突出部抑壓, Side Lobe Suppression, SLS",동의어 : 사이드 로브 억압,2차 레이더에서 주(主) 안테나의 부 돌출부(side lobe)로 생기게 되는 불필요한 신호를 하나 이상의 보조 안테나 패턴으로 억압하는 기술.
"부동, 浮動, floating",,정류기와 축전지를 부하에 병렬로 접속하고 축전지의 자기 방전을 계속 보충해 부하에 전력을 공급하는 것.
"부동 게이트, 浮動-, floating gate",,"소거 삭제 ROM, EPROM 등과 같은 비휘발성 금속 산화물 반도체(MOS) 기억 장치에 사용되는 전하 축적용 게이트. 주변과 전기적으로 절연되어 있다."
"부동 소수점, 浮動小數點, floating point",,"하나의 수를 고정 소수점 부분을 나타내는 부분(가수)과 고정 소수점 위치를 나타내는 부분(지수)으로 나누어 표현하는 표기법, 또는 그러한 수치를 연산하는 연산 조직. 고정 소수점 방식보다 넓은 영역의 숫자를 나타낼 수 있어 과학적인 응용에 많이 이용된다."
"부동 소수점 기수, 浮動小數點記數, floating-point radix",,"부동 소수점 기수법에서 암시적으로 고정된 1보다 큰 정(＋)의 정수(整數)의 기수. 부동 소수점 기수법에서 수는 가수부(mantissa)와 지수부(exponent)로 표현되는데, 이렇게 표현된 수의 실수를 결정하기 위해 부동 소수점 기수가 사용된다. 10진수의 기수는 10, 2진수의 기수는 2이다. 예를 들어 10진수 640,000을 부동 소수점 기수법으로 나타내면 6.4E5인데, 가수는 6.04, 지수는 5, 기수는 10이므로 640,000＝6.4×105가 된다."
"부동 소수점 기수법, 浮動小數點記數法, floating-point representation system",,"지수를 이용하는 기수 표기법. 매우 큰 수 및 매우 작은 수를 표현하는 데 사용된다. 부동 소수점 기수법에서 수는 부동 소수점 부분과 지수 부분(exponent)의 2부분으로 나뉘어 표현된다. 부동 소수점 부분을 가수부(mantissa)라고도 한다. 가수부는 그 수의 숫자 부분을 지정하고 지수부는 그 수의 크기(소수점의 위치)를 지정한다. 부동 소수점 기수법에서 어떤 수 (n)이 가수부 (a)와 지수부 (b)로 표현되면 n＝a×rb가 된다(r는 기수). 예를 들면 10진수 314,600,000과 0.0000451은 각각 3,146E5와 451E-7로 표현되는데 3,146과 451은 가수부이고 E5와 E-7은 지수이다. 따라서 314,600,000＝3,146×105가 되고, 0.0000451＝451×10-7이 된다."
"부동 소수점 데이터, 浮動小數點-, floating-point data",,부동 소수점 기수법을 사용해서 표현된 데이터.
"부동 소수점 데이터 형식, 浮動小數點-形式, floating point data format",,"①수치적인 자료 표현 방법의 하나로, 하나의 수를 가수와 지수로 나누어 표현하는 형식. ②소수점이 포함되는 실수의 표현에 사용되는 형식. 같은 수의 비트를 가지고 고정 소수점 형식보다 더 넓은 영역의 수를 나타낼 수 있어서 과학적인 응용에서 많이 이용된다."
"부동 소수점 레지스터, 浮動少數點-, Floating Point Register, FPR",,부동 소수점의 연산에 사용되는 레지스터.
"부동 소수점 상수, 浮動小數點常數, floating-point constant",,"부동 소수점 기수법에서, 고정 소수점 부분 또는 가수부(mantissa)의 값을 나타내는 상수. 부동 소수점 상수는 1 또는 2 이상의 숫자와 하나의 소수점으로 이루어지며, 소수점은 맨 끝에 올 수도 있다. 예를 들면, 10진수 0.03은 3.0E-2, 2,147,830은 2.147830E6의 형식으로 표현되는데 여기에서 3.0과 2.147830은 가수부의 값을 나타내는 상수이다. 이들의 값은 각각 3×10-2와 2.147830×106이 된다."
"부동 소수점 연산, 浮動小數點演算, Floating-Point Operation, FLOP",,"①부동 소수점 기수법을 사용해서 표현된 데이터. 예를 들면, 수 2,147을 2.147＋E3과 같이 고정 소수점 부분(2.147)과 지수 부분(E3)의 2개 부분으로 나누어 표현된 데이터에 대한 산술 연산을 말한다. 부동 소수점 연산에서는 부동 소수점 수의 2개 부분이 그 수의 절댓값을 결정하기 때문에 고정 소수점 연산에서와 같이 소수점의 위치가 그 수에서의 숫자들의 상대적 위치에 따라 결정되지 않는다. 부동 소수점 연산 방식을 사용하면 매우 작은 수나 매우 큰 수가 경제적으로 기억될 수 있으며 일관되게 정확도가 높은 계산이 가능하다. 대부분의 마이크로컴퓨터는 부동 소수점 연산을 지원하지 않기 때문에 소프트웨어나 특수 부동 소수점 프로세서를 사용해서 실행해 왔으나, 1개의 대규모 집적 회로(LSI)에 부동 소수점 연산 기능을 결합한 칩 등이 보급되면서 부동 소수점 연산 속도를 획기적으로 높이게 되었다. ②컴퓨터가 단위 시간내에 처리 할 수 있는 부동 소수점 연산(예: 한번의 더하기나 곱하기, 빼기, 나누기)의 수로서 일반적으로 컴퓨터, 특히 슈퍼컴퓨터나 배열 처리기, 벡터 처리기 등의 과학 기술 계산의 성능을 표시하는 지수. 1초 간에 실행 가능한 부동 소수점 연산의 횟수로 표현하는데, 100만 회(MFLOPS)의 단위로 표시될 때가 많다. 슈퍼컴퓨터에는 300GFLOPS를 초과하는 기종도 나와 있다."
"부동 소수점 정밀도, 浮動小數點精密度, floating point precision",,"부동 소수점으로 수를 표현할 때 사용되는 가수 부분의 정밀도. 즉 부동 소수점은 소수점의 위치를 일정하게 하지 않고 소수점의 위치를 나타내는 수를 병기하는 표시 방법(예를 들면, 638,020,000을 6.3802×108 또는 6.3802E8 등)이며, 부동 소수점 방식의 가수 부분으로 사용되는 2진수의 최대수를 말한다."
"부동 소수점 프로세서, 浮動小數點-, floating-point processor",,"부동 소수점 연산을 고속으로 실행하기 위해 사용되는 하드웨어 기구. 부동 소수점 유닛이라고도 한다. 컴퓨터의 주 프로세서와 조합해서 사용하기 위해 1개의 대규모 집적 회로(LSI)에 부동 소수점 연산 기능을 합친 부동 소수점 프로세서 또는 칩이 보급되어 있다. 가감승제뿐만 아니라 제곱근, 삼각 함수, 로그 함수 등의 연산을 고속으로 실행할 수 있는 것도 많이 있다. 취급하는 데이터의 형식이나 연산 결과의 라운딩(rounding) 방법에 관해서는 IEEE 754로 표준화되어 있다. 32비트 마이크로프로세서에는 부동 소수점 프로세서를 내장한 칩이 많다."
"부동 소수점형, 浮動小數點型, floating type",,데이터의 값이 실수를 나타내는 데이터형.
"부동 소수점 형식, 浮動小數點形式, floating-point format",,"①부동 소수점 상수를 나타내기 위해 사용되는 형식. 예를 들면, 10진수 0.03은 3E-2, 31,000,000은 3.1E7의 형식으로 표현하는데, 이들의 값은 각각 3×10-2＝0.03, 3.1×107＝31,000,000과 같다. ②2진 부동 소수점 기수법에서 2진 부동 소수점 값을 표현하기 위해 사용되는 기억 형식."
"부동 축전지, 浮動蓄電池, floating battery",,"축전지를 충전용 기기에 항상 병렬로 접속한 다음 축전지 1개당 2.15~ 2.25V의 전압을 걸어 주어 자체 방전을 보충하는 정도의 적은 전류로 충전하여 항상 충전 상태를 유지시키고 보통 작은 부하는 충전 기기로부터, 일시적인 큰 부하는 축전지로부터 공급하도록 한 축전지."
"부동 충전, 浮動充電, floating charging",,"정류기와 축전지를 부하에 병렬로 접속하고 축전지의 방전을 계속 보충하면서 부하에 전력을 공급하는 것. 통신용 전원으로 직류 전력을 공급할 때 사용하는 방식으로 그림과 같이 축전지에 병렬로 정류기를 접속해서 부하에 직류 전력을 공급한다. 부동 방법에는 단순 부동과 정밀 부동이 있는데, 단순 부동은 정류기의 전압을 어떤 값에 미리 설정해 놓고 부하 전류가 증가하면 축전지로부터 방전하고, 부하 전류가 감소하면 축전지에 충전 전류가 흘러서 방전을 보상하는 것이다. 정밀 부동은 축전지에 항상 적은 양의 전류(보통 10시간율로 충전 전류의 0.3~1%)가 흐른 상태에서 부하에 정류기로부터 전력이 공급되도록 되어 있다. 이와 같은 방식으로 운용한다면 축전지의 수명은 길어지지만, 3~4개월에 1회는 정규적으로 균등 충전할 필요가 있다."
"부동 헤드, 浮動-, floating head",,자기 디스크 또는 자기 드럼의 회전으로 인해 생기는 공기의 흐름에 의해 헤드에 유체 베어링의 원리가 적용되어 부동하는 것을 이용한 헤드. 헤드와 자성 매체와의 빈틈이 매우 작기 때문에 기록 밀도가 높다.
"부두, Voodoo",,미국의 3DFX사에서 개발한 3차원 전용 그래픽 카드와 칩셋. 실제 사물의 이미지와 흡사하고 고화질을 제공하여 3D로 제작된 게임을 보다 실감 있고 빠르게 실행하거나 DVD 영화를 좋은 화질로 감상할 수 있다. 그러나 2차원 그래픽 기능이 없기 때문에 단독으로는 사용이 불가능하고 별도의 그래픽 카드와 함께 사용해야 하는 단점이 있다.
"부등식, 不等式, inequality",,"2개의 수식이나 함수 A, B의 크기 관계를 나타내는 명제. A가 B보다 큼(A＞B), A가 B보다 작음(A＜B), A가 B보다 크거나 같음(A≥B), A가 B보다 작거나 같음(A≤B)의 4가지 유형이 있다. 이 명제가 참인 조건을 만족하는 변수들의 범위를 알아내는 과정을 보통 부등식을 푼다 또는 부등식의 가능한 해를 구한다라고 한다."
"부 디렉터리, 副-, subdirectory",,계층적인 디렉터리 구조 안에서 한 디렉터리 안에 위치하는 디렉터리. 즉 자식 디렉터리를 말한다.
"부모 노드, 父母-, parent node",동의어 : 윗노드,"나무형의 데이터 구조에서 어떤 하나의 노드에 대하여 이 노드의 상위에 연결된 노드. 다음 그림에서 P와 Q는 각각 A, B, C 마디와 D 마디의 부모 노드이다. 또 마디 R는 P, Q 마디의 부모 노드이다."
