"블랙베리, blackberry",,"RIM(Research in Motion)사가 개발한 모바일용 운영 체계(OS). 휴대 전화 기능은 물론 개인 휴대 정보 단말기(PDA) 기능, 인터넷 기능 등을 추가하여 인터넷 및 컴퓨터에 접속하여 이메일, 웹 브라우저, 팩스, 뱅킹, 게임 등을 지원한다. 일부 기기는 멀티미디어 플레이어나 카메라를 갖추고 있다."
"블랙 엔젤, Black Angel",,천사처럼 나타나 돈을 대주다가 갑자기 태도를 바꿔 창업자를 밀어내거나 자신의 이익만을 노리는 악성 투자자. 블랙 엔젤은 기업을 성장시켜 이익을 함께 나누는 정통 벤처 투자가 아니라 짧은 시간에 자본 이득을 취하려는 분위기가 확산된 데 따른 현상이다. 이들이 노리는 대상은 주로 재무 구조가 취약해 금융 대출이나 기관 투자를 유치하기 힘든 신생 벤처 기업이다.
"블랙 햇, black hat",,"이해관계나 명예를 위해 다른 사람의 컴퓨터 시스템이나 네트워크에 침입하는 해커나 파괴자(cracker)를 일컫는 용어. 블랙 햇 해커는 파일을 파괴하거나 도용을 목적으로 하며, 피해를 알리지 않고 다른 해커나 일반인에게 전파하여 해당 기관이 보안 대책을 세우기 전에 그 약점을 이용하도록 한다."
"블랙 햇 검색 엔진 최적화, -檢索-最適化, Black Hat Search Engine Optimization, 블랙햇 SEO",동의어 : 부정 검색 최적화 방법,검색 결과 페이지에서 순위를 올리려고 쓰는 부정한 방법. 검색 엔진에서 검색했을 때 맨 위에 나타나도록 검색 엔진 최적화 기법을 쓰는 것이다.
"블랙 홀, black hole",,정보를 중계하는 시스템이 중계해야 할 모든 트래픽을 폐기한 상태. 망 주소 정보의 잘못된 설정 등이 그 원인이 된다. 이 용어는 모든 트래픽을 삼켜 버리는 것같이 보이는 데서 유래한다.
"블랭크 마스크, Blank Mask",,"반도체, 액정 표시 장치(LCD) 회로 인쇄 핵심 재료로 포토마스크에 전자 회로를 입히기 전 상태의 석영 유리판. 전자 회로 패턴이 형성되기 전의 마스크로 석영 유리 기판 위에 크롬(Cr)과 크롬 화합물의 금속박막 필름을 입힌 형태로 되어 있다. 일반적으로 위상 반전막이라는 투광막의 유무에 따라 BIM(Binary Mask)과 PSM(Phase Shifter mask)의 블랭크 마스크 2종류로 구분된다."
"블랭킷 에어리어, blanket area",,"방송국의 송신 안테나에서 발사하는 강한 전파로 인해 다른 전파와의 간섭이 일어나는 지역. 표준 방송의 경우에는 지상파의 전계 강도가 매 미터 1볼트 이상인 지역을 말하고, 블랭킷 에어리어 내의 가구 수는 그 방송국의 방송 구역 내 가구 수의 0.35퍼센트 이하로 제한하고 있다."
"블레이드 PC, blade personal computer, blade PC",,"중앙 집중식 랙(rack)이나 선반(shelf)에 낱장 카드로 끼워지는 개인용 컴퓨터(PC). 유틸리티 컴퓨팅에서는 네트워크를 통해 프린터를 비롯해 블레이드 PC를 공유 개념으로 제공하기도 하는데, 중앙 집중식 시스템 관리가 가능하고, 임시직 직원용 PC를 별도로 구입할 필요가 없으며, 하드웨어 1대를 여러 명이 공유할 수도 있는 장점이 있다. 사용자의 파일들은 별도의 네트워크 스토리지에 저장되므로 데이터가 더 안전하게 보호되며, PC가 고장난 경우 새로운 블레이드 PC에 로그인해 기존 파일을 불러올 수도 있다."
"블레이드 서버, blade server",동의어 : 낱개 서버,"하나 이상의 마이크로 프로세서와 메모리, HDD, 운영체재(OS) 등 서버의 핵심 요소를 내장하고 서버 시스템의 본체에 끼워 동작시키는 얇고 모듈화된 증설품 서버.  좁은 공간에 많은 수의 서버를 삽입, 설치할 수 있다는 의미에서 고밀도 서버라고도 부른다. 블레이드 서버 자체만으로는 독립적인 서버의 역할을 하지 못하나 본체로부터 전원, I/O, 부수 장치 및 각종 제어 기능을 지원 받아 서버로서의 기능을 수행하며, 동시에 다수의 블레이드 서버가 클러스터를 이루어 개별 서버 이상의 복합적인 기능을 수행하기도 한다. 블레이드 서버는 각종 공통 설비의 공유와 에너지 절약 등 집적도 향상에 따른 효과이외에도 최근에는 다양한 OS의 지원 아래 웹, 방화벽, 네트워크 스위치, 스토리지 등 다양한 장비와 각종 애플리케이션과 DB 관리 등의 소프트웨어적 기능을 통합하는 종합 하드웨어 플랫폼, 즉 서버 시스템으로 발전하고 있다."
"블레이드 안테나, blade antenna",,선 형태의 안테나 대비 광대역 특성을 얻기 위해 판 형태로 만든 안테나. 주로 사다리꼴의 형태를 가지며 항공기의 초단파(VHF) 통신용 안테나로 많이 사용된다.
"블렌드, blend",,"그래픽 프로그램에서 계조(색을 점차 변하게 하는 기법)를 만드는 기능. 양 끝에 색을 정한 후 블렌드를 선택하면 자동적으로 그 사이의 색이 만들어진다. Adobe Illustrator, Aldus FreeHand와 같은 그래픽 프로그램과 편집 프로그램 등에서 많이 사용된다."
"블로그, blog",동의어 : 누리사랑방,"웹(web)과 로그(log)의 합성어로, 개인이 관심사에 따라 자유롭게 글을 올릴 수 있는 웹 사이트. 게시판 형식의 사이트에 일반인이 자신의 일상적인 일기에서부터 사회적 관심의 칼럼, 기사 등을 자유롭게 올리며, 개인 출판, 개인 방송, 커뮤니티까지 다양한 형태를 취하는 1인 미디어이다."
"블로그 마케팅, Blog Marketing",,"블로그를 마케팅 수단으로 활용하는 것. 관심사가 같은 블로거가 모이는 곳에 상품 등을 판매하기 위해 홍보하는 타깃 마케팅 기법으로, 소비자와 양방향 커뮤니케이션이 가능하고 마케팅 공간에서 곧바로 구매가 가능하다는 것이 장점이다. 특히 비용 대비 홍보 효과가 높아서 경제적인 마케팅 채널로 떠오르고 있다. 전문가들은 블로거들이 증가 추세이며 소비자들의 구매 행태가 온라인으로 이동하고 있어 블로그를 통한 마케팅이 더욱 늘어날 것으로 전망하고 있다."
"블로그 스팸, Blog Spam",,블로그를 악용하는 스팸. 블로그 댓글에 악의적인 웹 페이지로 연결되는 링크와 유인 문구를 게시해 사용자가 악성 콘텐츠를 내려받도록 유도하는 방식이다.
"블로그스피어, Blogsphere/Blogosphere",동의어 : 블로그 세상,"블로그들이 모여서 이루어진 블로그 세상. 대부분의 블로거들은 서로 상호작용을 하고 있으며, 다른 블로그를 읽고 링크하며, 댓글을 달기도 하여 특유의 문화를 형성한다."
"블로그젝트, Blogject",,"블로그(blog)와 움직이는 객체(object)가 결합된 새로운 형태의 블로그. 반드시 사람만 블로그의 주체가 될 필요는 없다는 관점에서, 모든 사물이 블로깅을 하여 분리된 데이터를 모아 소셜 미디어를 통해 확산시킬 수 있다. 모든 움직이는 사물이 블로깅을 하는 상황이 올 수도 있으며 수집된 정보는 다양한 매시업 정보를 만들어낼 수 있다."
"블로킹, blocking",동의어 : 구역짓기,①데이터 기억 장치에서 파일을 일정한 크기의 블록으로 잘라서 관리하는 작업. ②통신에서 신호가 송신되는 것을 강제로 막는 작업.
"블로킹 인수, -因數, blocking factor",동의어 : 구역짓기 인수,"블록 장치, 즉 데이터를 블록 단위로 처리하는 장치로 이송하거나 그 장치로부터 이송되는 데이터 블록의 크기. 개인용 컴퓨터(PC)에서의 일반적인 블로킹 인수는 128,256,512바이트이다."
"블로킹 현상, -現狀, Blocking Effect",,디지털 영상 부호화를 위한 블록 단위의 양자화 과정에서 오차로 인하여 발생되는 화질 열화 현상. 블록 단위의 양자화 과정에서 각각의 블록이 각기 독립적으로 처리될 때 압축률이 높은 경우에 인접한 블록의 경계에서 불연속성이 나타나 화질 열화 현상이 발생한다. 이에 대한 대처 방안으로 H.264 등에서는 디블로킹 필터를 사용한다.
"블로트웨어, Bloatware",,지나치게 많은 메모리를 요구함으로써 효용성이 떨어진 소프트웨어. 꼭 필요한 기능 외에 별로 쓸모도 없는 기능까지 이것 저것 붙여 덩치만 큰 소프트웨어이다
"블로피시, Blowfish",,데이터 암호화 표준(DES)과 국제 데이터 암호화 알고리듬(IDEA)을 대신하여 사용되는 암호화 알고리듬. 이것은 키의 길이가 32 비트 내지 448 비트의 가변 길이 키를 사용하는 비밀 키 블록 암호이다. 1993년에 만들어져 현재는 비특허로 모든 사용자에게 무료로 개방되어 있다.
"블록, -, block",,"① 1개의 단위로 취급하는 단어 또는 레코드나 문자들의 집합. 파일 기억 장치 블록은 물리적 레코드라고도 한다. ② 한 블록의 단어들이 기억되었거나 수록된 기억 장치 장소나 테이프 위치들의 집합. ③ 컴퓨터에서 최소의 입출력 단위. 블록이란 물리적으로 읽기를 할 수 있는 레코드라는 의미에서 물리 레코드라고 하며, 1블록을 구성하고 있는 각 레코드를 논리 레코드라 부른다. 하나의 논리 레코드는 논리적인 내용을 가진 몇 개의 필드로 만들어진다. 결국 블록(block 또는 physical record)은 컴퓨터에서 1회 입출력되는 단위이며 논리 레코드는 프로그램에서 처리의 대상이 된다. 블록을 구성하고 있는 논리 레코드의 개수를 블록화 인수라 부르며 블록 간격(IBG)이 발생한다. ④ 한 단위로서 전송되는 비트 혹은 n진수의 그룹. ⑤ 한 단위로서 기록되는 연속된 문자의 그룹. ⑥ 알골(ALGOL: Algorithmic Language)의 프로그램을 구성하는 것으로 선언의 열(#)에 문장(#)이 이어진 것으로 시작과 끝을 둘러싼 것.⑦ 블록체인에서 식별, 암호화 및 거래 정보를 포함하는 기본 데이터 단위. 하나의 블록은 블록 해시(hash), 헤더(header) 및 바디(body)로 구성된다. 블록 해시는 블록 식별자이며, 헤더 영역을 해시한 값을 포함한다. 헤더 영역은 버전 정보, 이전 블록 해시, 머클 루트(Merkle root), 시간(time), 난이도(difficulty) 및 논스(nonce)로 구성된다. 바디 영역은 다양한 거래 정보들을 포함한다. * 머클 루트(Merkle root): 블록의 바디에 저장된 거래 정보 머클 트리(Merkle tree)의 최종값* 타임(time): 블록의 생성 시간* 난이도(difficulty): 목표값(target)을 구하는 난이도 조절용 수치. bits로 표기한다 * 논스(nonce): 블록을 만드는 과정에서 해시값을 구하기 위해 1씩 증가하는 계산 횟수 블록 해시는 전체 블록의 식별자 역할을 하는 블록 이름 정보인데 헤더 영역의 정보를 암호화 기술(SHA-256)을 적용한 값이다. 다음 블록에 이전 블록 해시가 포함되어 가상의 체인으로 연결된 구조를 가진다. 블록체인 시스템에서 블록은 참여자들의 특성에 따라 분산‧저장된다. 또한 이 블록의 구조는 블록체인 기술을 이용한 다양한 서비스에 따라 서로 다르게 정의하며 일반적으로 특정 커뮤니티 안에서만 통용된다."
"블록 간격, -間隔, Interblock Gap, IBG",,"자기 테이프, 자기 디스크 보조 기억 매체 정보가 블록으로 기록되어 있는 경우, 블록과 블록 사이를 구분하기 위해 정보가 기록되어 있지 않은 공백 부분. 이 간격은 데이터를 기록 매체에 기억시키거나 기억되어 있는 데이터를 추출할 때 필요하며, 자기 테이프나 자기 디스크 장치는 가동되어 일정한 균일 속도가 되어야만 정보를 판독/기록할 수 있다."
"블록 검사, -檢査, block check",,"데이터는 일반적으로 몇 개의 블록으로 나뉘어 전송되는데, 이 블록 중에 오류의 발생 유무를 검사하는 것. 정보는 블록 단위로 보내져 오류가 있으면 그 블록을 재송신하고 오류가 없으면 다음 블록을 송출한다. 블록 검사 방법으로는 수평 패리티 검사 방식, 수평 마크 계수 검사 방식, 주기적 덧붙임 검사 방식 등이 있다."
"블록 검사 문자, -檢査文字, Block Check Character, BCC",,"데이터 통신에서 한 블록의 데이터를 전송할 때 그 블록의 맨 뒤에 오류 검사를 위해 덧붙이는 문자. 이는 패리티, 체크섬, 또는 주기적 덧붙임 검사 부호(CRC) 등을 이용한다."
"블록 검사 부호, -檢査符號, Block Check Sequence, BCS",,기본형 데이터 전송 제어 절차에서 전송되는 정보 블록의 맨 끝에 붙는 검사 코드.
"블록 검색, -檢索, block search",,"전체 레코드를 일정한 수의 레코드를 가지는 여러 개의 블록 단위로 나누어 저장하고, 찾기를 원하는 특정 레코드가 속한 블록을 결정한 후에 해당 블록 내의 키값을 순차적으로 비교하여 원하는 레코드를 찾아내는 검색 방식. 프로그램 작성과 갱신이 쉽다는 장점이 있으나 키값이 어느 정도 정렬되어 있어야 검색이 가능하다는 단점이 있다."
"블록 계산, -計算, block count",,"①프로그램에 의한 파일 처리에서, 하나의 파일 내에 몇 개의 블록이 수용되어 있는지를 계산하는 것. ②하나의 파일 내에 들어 있는 블록의 수. 보통 블록의 끝을 표시하는 블록 끝(EOB) 내에 기억되어 있다."
"블록 구조, -構造, block structure",,"주로 알골계의 프로그램 작성 언어에서, 프로그램을 여러 단계의 블록으로 나누어서 작성할 수 있도록 해주는 언어의 구조. 즉 프로그램을 작성할 때, 일련의 문장을 하나의 프로시저나 함수로 묶고 이러한 프로시저나 함수들을 계층적으로 조직하여 하나의 프로그램을 만들어 내는 것으로, 하향식 설계를 자연스럽게 구현하므로 프로그램을 이해하기가 쉽다. 또한 각 블록은 지역 변수와 다른 블록을 포함하며 변수의 범위(scope)가 블록 내로 제한되므로 기억 장소가 절약되고 오류의 가능성이 적다. 이러한 블록 구조를 채택하는 언어로는 알골, 파스칼, PL/1, C, 에이다(Ada) 모듈라-2 등이 있다."
"블록 구조 언어, -構造言語, block structured language",,"여러 개 단위 블록의 모임으로 하나의 프로그램을 만들도록 하는 프로그램 작성 언어. 알골, 파스칼, PL/1, C, 에이다 등이 있다."
"블록 기동, 起動, activation of block",,각 불록의 기능이 완료되었음을 나타내는 용어. 시작 블록은 제어가 그 블록의 시작문에 도달했을 때 ‘기동되었다’라고 한다. 절차 블록에서는 그 절차가 어딘가의 입구에서 호출되었을 때 ‘기동되었다’라고 한다.
"블록 기술어, -記術語, Block Descriptor Word, BDW",,가변 길이 레코드에서 각 블록의 앞머리에 붙인 블록의 길이에 관한 정보를 포함하는 필드.
"블록 끝, End Of Block, EOB",,자기 테이프상의 블록 종료를 규정하는 특별한 표시. 이 표시 뒤에 블록 간격(interblock gab)이 마련된다. 보통 EOB로 줄여 부른다.
"블록 다중 채널, -多重-, Block Multiplexer Channel, BMC",,"데이터 전송 채널의 일종. 블록 단위로 데이터를 전송하는 주변 장치인 디스크나 테이프를 복수로 제어하는 기능을 가지고 있다. 즉, 이 장치는 몇 개의 서로 다른 데이터 전송을 시분할 방식에 의해 병렬적으로 처리해 주며 고속 주변 장치의 데이터 전송에 이용된다."
"블록 단신, -單信, single-block transmission",,"블록을 1개만 송신하는 것. 기본형 데이터 전송 제어 절차에서, 동일한 정보 전송의 단계 중에서 단일의 블록을 송신하는 것을 말한다."
"블록 레지스터, block register",,선 제어(line control) 컴퓨터에 의한 사용을 위해 또는 받아들여지는 정보의 저장을 위해 서로 연결된 저장 블록을 지시하는 주소 레지스터.
"블록 레코드, block record",,"기억 장치 할당이나 제어를 융통성 있게 하기 위하여 표준 블록으로 구성되어 있는 것으로, 주기억 장치나 파일 저장 장치에 포함된 고정된 크기의 특수한 기억 장치의 영역."
"블록 무시 문자, -無視文字, block ignore character",,"데이터 준비나 데이터 전송 시 오류가 발생한 경우, 이를 포함하는 일부의 데이터를 무시하도록 하기 위한 제어 문자의 하나. 이러한 문자가 나타나면 미리 정해진 만큼의 데이터가 무시되는데, 경우에 따라서는 최근에 나타난 블록 표시 부호까지의 부분적인 데이터 블록이 무시되기도 한다."
"블록 복사, -複寫, block copy",동의어 : 구역복사,문서 처리기에서 문서의 일부를 블록으로 지정한 후에 그것을 동일 문서의 다른 곳이나 다른 문서에 저장하는 것. 같거나 비슷한 문장이 여러 번 거듭될 때 유용하게 사용된다.
"블록 부호, -符號, block code",,"부호화가 일정 길이의 블록 단위로 이루어지며, 각 블록에서의 부호화가 다른 블록에 의존하지 않는 부호. 보통 모든 부호어의 길이는 같은데 이 부호어의 길이를 부호 길이라 한다."
"블록 부호화 방식, -符號化方式, block coding method",,"화상 정보의 압축 부호화 방식의 하나. 복수의 화소(통상 nxn 화소)를 모아 블록을 만들어, 그 블록 안의 화소를 밝은 쪽의 화소와 어두운 쪽의 화소로 분리하여, 각각의 평균치로 부호화하는 방식이다. 주로 정지화를 대상으로 하며, 압축률은 펄스 부호 변조(PCM)의 약 8분의 1이다."
"블록 분류 정렬, -分類整列, block sorting",,"레코드 수가 많은 파일을 분류할 때 상위의 눈에 띄는 항목으로 파일을 분할하고, 먼저 분할된 블록을 분류한 후에 전체를 통합하는 분류 방법. 카드 분류에 필수적인 정렬 방법이다. 또한 자기 테이프에서, 정렬의 범위 내에서 정렬되는 내부 분류도 일종의 블록 정렬이다."
"블록 분리, -分離, deblock",,"하나의 블록에서 일단의 논리적 레코드들을 분리하는 것. 디스크의 저장 효율을 높이기 위해 대부분의 파일 관리 프로그램이나 데이터베이스 시스템에서는 디스크 드라이브와 같은 외부 매체에 레코드를 블록 단위로 저장하는데, 그 레코드에는 문서의 행수나 레코드 수가 포함된다. 애플리케이션이나 데이터베이스 시스템에서 저장된 레코드를 유효하게 사용하기 위해서는 블록에서 레코드를 분리해야 한다."
"블록 암호, -暗號, block cipher",,암호문을 만들기 위해 암호 키와 알고리듬이 블럭 단위의 평문에 적용되는 대칭 암호화 방식.
"블록 암호 운영 모드, -暗號運營-, Block Cipher Modes of Operation",,"블록 단위로 고정된 입출력 길이만을 처리하는 블록 암호의 기능을 보완하기 위하여, 다양한 길이의 입력과 일치하는 길이의 출력을 보장하고 암호화는 물론 인증용으로도 활용할 수 있도록 하나의 비밀 키를 이용하면서 패딩이나 초기 벡터, XOR 게이트, 시프트 기능. 순환 기능 등을 선택적으로 이용하는 블록 암호의 운영 방식. 대표적인 운영 모드로는 ECB(Electronic CodeBook), CBC(Cipher Block Chaining), OFB(Output FeedBack), CFB(Cipher FeedBack), CTR(Counter) 등이 있다."
"블록 오류율, -誤謬率, block error rate",,"전송된 블록의 전체 수에 대해서 올바르게 전송되지 않은 블록 수의 비율. 블록 오류율 E는 다음과 같다. &nbsp;블록 오류율은 오류의 발생 형태, 즉 집단적인지 또는 모든 시간대에 대해 일정한지에 따라 크게 달라진다."
"블록 올려놓기, block loading",,1개의 로드 모듈을 구성하는 복수의 제어 부분을 가상 기억상의 연속된 영역에 배치하는 것.
"블록 인터리빙, block interleaving",,무선 전송상의 버스트 에러를 막기 위해서 전송 데이터를 연속적으로 구성하지 않고 특정 패턴으로 순서를 바꿔 구성하는 방법. 무선 전송은 페이딩으로 인하여 유선 전송보다 버스트 오류 발생 빈도가 높으므로 그 에러를 랜덤화하여 데이터의 일부분을 한꺼번에 잃어버리는 경우가 없도록 한 것이다. 이 경우 에러가 발생하더라도 돌림형 부호(convolution code)와 같은 에러 정정 코드를 사용하여 에러를 정정할 수 있다.
"블록/일깨움 규약, -規約, block/wakeup protocol",,"한 처리기가 입출력 요구를 하게 되면 입출력이 끝날 때까지 그 처리기는 블록 상태가 되며, 어떤 다른 처리기가 이와 같이 블록된 처리기를 일깨워 주어야 하는데, 이러한 교신을 일컫는 말."
"블록 일시 처리, -一時處理, block concurrency",,기억 장치에 써넣을 때 데이터를 한 번에 써넣는 단위.
"블록 입출력 방식, -入出力方式, block input/output system",,"유닉스(UNIX) 시스템 입출력 방식의 하나. UNIX 시스템은 블록 입출력 방식과 문자 입출력 방식이 있다. 블록 방식은 512바이트 이상의 블록 단위로 데이터를 전송하는 주변 기기에 쓰이므로 보통 디스크나 데이터에 적용된다. 커널이 입출력 빈도를 줄이기 위해 완충부를 쓰는 특징이 있다. 문자 방식은 블록 방식이 적용되지 않는 주변 장치, 즉 단말기, 인쇄기 등에 쓰인다."
"블록 접두어, -接頭語, block prefix",,자기 테이프상에 아스키(ASCII) 코드로 기록된 레코드의 블록 또는 비블록화 레코드에 선행하는 임의 선택 가변 길이 필드.
"블록 정합 알고리듬, -整合-, Block Matching Algorithm, BMA",,"영상을 일정한 크기의 블록으로 분할하고 블록내의 모든 화소를 하나의 움직임 벡터로 표현하는 방법. 움직임 벡터를 찾기 위해 이전 프레임의 블록들을 한 화소씩 이동하면서 현재의 블록과 가장 유사한 블록을 찾는 것이며, 정합 기준으로는 평균 절대 오차(MAE: mean absolute error)와 평균 제곱 오차(MSE: mean squared error)등이 많이 쓰인다. 물체의 움직임은 한 블록 내에서 모두 동일하다고 가정하는데, 블록의 크기가 작을수록 이러한 가정의 신뢰도는 높아지나 움직임 벡터의 계산량과 전송량이 증가하게 된다."
"블록 주소, -住所, block address",,"버퍼 기억 장치를 갖는 컴퓨터에서 버퍼 메모리는 보통 몇 개의 섹터로 나누어지며, 이 섹터는 다시 몇 개의 블록으로 나누어지는데, 이 블록의 위치를 나타내는 것."
