"번호 계획, 番號計劃, numbering plan",,"통신망을 접속, 제어할 때 필요한 이용자와 통신망 간의 규약(언어와 문법)에 해당하는 것. 조작면, 교환기 등의 제어면을 고려하여 정한다. 번호 체계와 번호 부여로 대별되며, 전자는 디짓의 수(용량), 기본적인 할당을 고려하는 방법 등을 정하고, 후자는 체계에 따른 구체적인 부호의 할당을 수행한다."
"번호 계획 식별, 番號計劃識別, Numbering/Addressing Plan Identification, NAPI",,"ISDN의 사용자-망 인터페이스에 사용되는 D 채널 신호 방식에서, 발신 주소, 착신 주소 등을 전송하는 경우, 그 메시지에 포함되어 있는 숫자가 어떤 번호 계획, ISDN 번호 계획, 전화번호 계획, 데이터 번호 계획 등에 기준한 주소를 뜻하고 있는지를 나타내기 위해 사용되는 식별자. ITU-T의 1988년판 권고에서는 numbering plan identification이라고 호칭하고 있다."
"번호 공동 사용, 番號共同使用, Number pooling",,"각 이동 전화 사업자의 식별 번호(011, 017, 016, 018, 019) 이외에 이동 전화 사업자가 공동으로 새로운 식별 번호 010을 단일 번호로 사용하도록 하는 통합 계획. 010 통합은 국가 자원인 번호의 효율적인 이용과 번호의 브랜드화 방지를 위한 것으로, 010으로 통합하면 이동 전화 가입자들끼리는 010을 누르지 않고도 통화할 수 있는 편리함이 있다. 번호 이동성과 함께 가입자가 개별 번호를 유지하면서 손쉽게 사업자를 변경할 수 있도록 하기 위한 상호 보완적 정책이다."
"번호군, 番號群, number group",,자국 내 접속 및 타국으로부터의 입접속을 하는 경우에 피호출 가입자 번호를 그 가입자 회선이 수용되는 라인 링크 프레임상의 수용 위치에 번역하는 장치.
"번호 변환 장치, 番號變換裝置, Telephone Number Transfer, TNT",,다이얼 자릿수가 많은 경우에 2~5자리로 단축하는 장치.
"번호 용량, 番號容量, numbering capacity",,최대 디짓 수 N 디짓의 범위 내에서 부여할 수 있는 최대의 상대 선택 번호. 번호 용량은 최대 디짓 수에 따라 제약을 받기 때문에 장래 수요를 적절히 파악하고 번호 부여는 사전에 면밀한 사용 계획에 따라 수행할 필요가 있다.
"번호 이동성, 番號移動性, number portability",,"전화 사용자가 계약한 번호는 전기 통신 사업자가 변경된 경우에도 기존 전화번호를 계속 사용할 수 있는 것. 번호 이동성이 실현되면 동일한 번호를 계속 사용할 수 있기 때문에 전기 통신 사업자 선택이 쉽고, 사용자의 이용 편의성 향상 및 사업자 간 경쟁 촉진을 기대할 수 있다. 미국이나 유럽에서는 그 중요성을 인식하여 실현을 위해 많은 검토가 진행되어 왔으며, 우리나라도 평생 번호 제도를 도입 실현하고 있다."
"번호 종별, 番號種別, Type Of Address, TOA",,"ISDN 사용자-망 인터페이스에 사용되는 D 채널 신호 방식에서 발신 주소나 착신 주소를 전송하는 경우, 그 메시지에 포함되어 있는 번호의 종별(국제 번호, 국내 번호, 하위 번호 등)을 표시하기 위해 쓰는 식별자. ITU-T의 1988년판 권고에서는 type of number라 호칭하고 있다."
"번호 처리 방식, 番號處理方式, Number Translation, NTR",,"교환기에서 가입자가 다이얼한 번호를 처리하여 착신 가입자에게 연결하기 위하여, 중계선군 식별 및 그 호에 대한 과금 정보 등을 알아내어 호 처리를 수행하는 과정. 번호 처리 방식에는 중첩 처리(overlap) 방식과 일괄 처리(enbloc) 방식이 있다."
"번호 통화, 番號通話, station-to-station call",,국제 통화 청구 시 외국 가입자의 전화번호만을 지정하여 청구하는 통화. 전화가 연결되는 즉시 요금이 부과되는 국제 수동 통화이다.
"번호 할당 모듈, 番號割當-, Number Assignment Module, NAM",,전화번호 등 모든 변수를 수록할 수 있는 칩 또는 모듈.
"번호 확인음, 番號確認音, number check tone",,"수동 즉시 통화, 전보 탁송 등에서 요금 통지 등 때문에 교환대 취급자가 신청자의 전화번호를 확인할 때 사용하는 신호음. 이 경우 교환대 취급자는 끼어들기 경로에 따라 그 신청자를 포착하여 번호 확인음(500Hz 또는 1,700Hz의 연속음 또는 단속음)을 송출한다."
"번호 확인 접속, 番號確認接續, number verification connection",,교환대 취급자가 신청자 전화번호를 확인하기 위한 접속.
"벌룬 헬프, balloon help",동의어 : 풍선 도움말,"미국 애플 컴퓨터사의 매킨토시 운영 체계(OS)인 시스템 7에 탑재되어 있는 기능의 하나. 직역하면 풍선 도움말이 된다. 벌룬은 풍선으로 만화 속 인물이 대화를 입에서 불어 낸 풍선 꼴로 나타낸 윤곽을 의미하는 말인데, 컴퓨터 화면에 이와 같은 꼴로 마우스가 가리키고 있는 아이콘이나 메뉴의 설명 표시를 하는 기능이 벌룬 헬프이다. 예를 들면, 풀 다운 메뉴(pull-down menu)에서 항목 선택 중에 항목의 설명이 나오게 하거나, 마우스가 가리키고 있는 버튼의 처리 내용을 표시할 수 있다. 벌룬 헬프 기능은 초보자를 위한 도움 기능으로 마련한 것인데 사용자의 조작으로 표시되지 않도록 설정할 수도 있다."
"벌집형 망, -型網, honey-comb network",,하나의 교차점이 3방향의 회선군을 수용하여 6각형의 고리형 망이 몇 개 집합된 벌집 모양의 망.
"벌크 암호 키, -暗號-, Bulk Encryption Key, BEK",,"벌크 데이터를 암호화하는 데 사용되는 대칭 암호 키. 벌크 데이터는 ftp, electronic mail 등과 같이 크기가 큰 데이터를 말하며 대부분의 데이터가 이에 속한다. 벌크 암호 키는 벌크 데이터의 수신 측 공개 키로 암호화된 것으로, 클라이언트에서 생성되어 서버에 전달되며, 이 공개 키를 KEK(Key Encryption Key)라 부르기도 한다."
"벌크 이레이저, bulk eraser",,"오픈 릴 테이프나 카트리지 테이프의 녹음을 강력한 교류 자장으로 통채로 지우는 자장 소거기(demagnetizer). 녹음기의 소거 헤드로 지우는 방식에 비해 잔류 자기가 남지 않으며, 단시간에 깨끗하게 지울 수 있는 장점이 있다."
"벌크 전송, -傳送, bulk transmission",,"복수의 회선을 묶어서 고속화하는 전송 방식. 예를 들면, 종합 정보 통신망(ISDN)에서 64kbps의 B 채널을 2개 묶으면 128kbps의 전송이 가능하게 되며 3회선의 기본 인터페이스인 384kbps는 결과적으로 6개의 B 채널이 된다. 일반적으로 필요한 전송 속도에 따라 다양한 채널 조합을 할 수 있는데 이와 같은 벌크 전송에서는 각 채널의 전송 지연 시간에 차가 생기므로 벌크 전송 장치, 예를 들면 이러한 기능을 가진 터미널 어댑터(TA)를 선택할 때는 어느 정도의 지연 시간 차를 보정할 수 있는지를 확인할 필요가 있다."
"벌크 탄성파, -彈性波, Bulk Acoustic Wave, BAW",,"탄성체의 기판(substrate) 전체에 전파되는 음향파. 벌크 탄성파가 전파되는 기판은 황산카드뮴(cds) 등 압전 반도체(piezo-electric semiconductor)이며, 압전 효과의 결과로서 전기 신호로부터 음향파가 생성된다. 음향파의 전계 벡터(electric field vector)는 반도체의 전도 전자(conduction electrons)와 상호 작용하는데, 이 전도 전자는 외부에서 가해지는 직류 전계에 따라 이동 속도(drift velocity)를 갖게 된다. 이동 속도가 어떤 충분한 값이 되면 이동 전자의 운동 에너지(kinetic energy)는 음향파의 전계와 상호 작용의 결과로 고주파(RF) 에너지로 변환되며, 그 결과로 원래 신호의 증폭이 이루어진다. 신호 처리에 널리 사용되는 음향파 소자 중에서 증폭기 등은 벌크 탄성파의 전파(傳播)를 이용하는 반도체 소자이다."
"범세계 개인 통신, 汎世界個人通信, Universal Personal Telecommunications, UPT",,"사용자가 자기의 전화기나 데이터 단말을 어디로 가지고 가든지, 또는 타인의 단말을 이용하더라도 자기가 희망하는 서비스의 발착신이 가능한 통신. 개인에게 할당된 망과 독립된 번호인 범세계 개인 통신(UPT) 번호를 사용하여 통신한다. 특정 전화기/회선을 기초로 서비스하는 것이 아니라 UPT 번호를 가지고 있는 특정 이용자를 대상으로 하는 서비스이다. UPT의 특징은 다음과 같다. ㉠착신선의 지정이 가능하여, 착신선의 시간대와 장소를 지정하여 등록해 놓으면 UPT 번호에 의해 교환기가 직접 착신선을 찾아서 접속시키고, ㉡용도에 따라 업무용/개인용 등 복수의 개인 번호를 가질 수 있으며, ㉢이용자의 지정에 따라 휴대 전화 또는 고정망의 전화로도 사용할 수 있어서 이용자의 지정에 따라 어느 쪽에도 착신이 가능하다. 이용자의 위치 정보나 희망하는 서비스 기능 및 조건을 망 내의 데이터베이스에 저장함으로써 실현 가능하므로 지능망(IN)의 중요한 서비스의 하나이다."
"범용 IC 카드, 汎用-, Universal IC Card, UICC",,3세대(3G) 통신 시스템에서 이동 터미널에 사용되는 칩 카드. 전 지구적 이동 통신 시스템(GSM)의 가입자 정보 모듈(SIM)과 같은 범용 이동 통신 시스템(UMTS)의 주요 컴포넌트이며 SIM 카드를 확장한 UICC는 범용 가입자 정보 모듈(USIM) 애플리케이션을 내포하고 있다. 그리고 다양한 다중 애플리케이션의 보안 지원을 통해 모든 개인 정보 데이터의 무결성과 보안을 보장한다.
"범용 MPLS, 汎用-, Generalized Multiprotocol Label Switching, GMPLS",,"파장 분할 다중 방식(WDM) 광통신망에서 광 파장에 기반을 둔 데이터 전송 교환 기술. 광통신망 지원이 가능하도록 MPLS에 많은 확장 지능을 추가한 것으로, 패킷 내의 필드 내용을 검사하는 것이 아니라 광 파장을 분석해서 전송 경로를 결정한다. 아울러 IP 패킷뿐 아니라 ATM, 셀, 음성 프레임, RF, 광 파장 등 다양한 형태의 데이터에도 확장, 적용 가능한 MPLS 기술이다."
"범용 개발 시스템 소프트웨어, 汎用開發-, universal development system software",,"시스템 개념 및 최종 설계를 평가, 개발하는 데 응용 프로그램의 필요한 모든 소프트웨어를 사용자에게 제공하는 시스템. 여러 가지 시스템 프로그램 등을 포함한다."
"범용 교정 기호, 汎用校正記號, generalized markup",,문서를 출력하는 시스템에 의존하지 않는 전자 문서에 부가되는 교정 기호. 사용하는 교정 기호를 사용자가 정의한다. 표준 범용 문서 마크업 언어(SGML)로 정의한 교정 기호가 대표적이다.
"범용 단일 식별자, 汎用單一識別子, Universal Unique Identifier, UUID",,"인터넷 상에서 객체나 실체를 식별하는데 사용되는 128비트 숫자. 공간과 시간(약 3400년까지)의 조합을 통해 구성되는 거의 유일하게 사용할 수 있는 식별자로서 극히 단시간의 객체에서부터 영구적인 객체 식별에 이르기까지 다양한 목적으로 사용된다. 인증 기관의 등록 절차는 없고, 다만 UUID 생성 프로그램의 유일한 식별 숫자만 필요하다. 이 숫자는 총 16옥텟(128비트)으로, 공간 영역 6옥텟(48비트)은 IEEE 등록 기관을 통한 주소 블록으로 할당되어 IEEE 802 주소로 이미 망 접속 시스템에 적용되고 있다. 나머지 옥텟은 다수의 시간 영역이며 시간은 100나노초 간격의 세계 표준시로 나타낸다."
"범용 대화형 표시 시스템, 汎用對話型標示-, General Purpose Interactive Display System, GIDS",,"인간-기계 인터페이스 설계자에 의한 각종 인터페이스 개념의 구축, 시뮬레이션, 시험을 위한 독립형 하드웨어/소프트웨어 시스템. 일반 그래픽 능력이 있다."
"범용 동기식 송수신기, 汎用同期式送受信器, Universal Synchronous Receiver/Transmitter, USRT",,"1개의 칩으로 구성된 금속 산화물 반도체/대규모 집적 회로(MOS/LSI) 장치. 단어-병렬 제어기 또는 데이터 단말기를 비트-직렬 동기식 통신망에 접속하기 위해 필요한 직렬-병렬, 병렬-직렬 변환 논리를 대체할 수 있다. 범용 동기식 송수신기(USRT)는 독립된 클록과 데이터선 상태를 지니는 분리된 송신기와 수신기로 구성되어 있다. 송신기와 수신기는 단어 길이와 패리티 형태가 같다. 데이터는 각각의 입력 클록 주파수와 동일한 속도로 비제로 복귀(NRZ) 형식으로 수신 또는 송신된다. 메시지의 클록에 대해서는 비트 동기식으로 각각의 전문을 초기화하는 동기 또는 형성 문자에 대해서는 문자 동기식으로, 연속적인 문자열로서 정의된다. USRT 수신기는 비트 투명 형식으로 내부 수신 동기 레지스터의 내용과 입력 데이터를 비교한다. 비교 후에는 각각의 문자 시간에 5, 6, 7, 8비트 문자로 출력하는 문자 동기식이 된다."
"범용 디스크 형식, 汎用-形式, Universal Disk Format, UDF",,"CD-RW, DVD-ROM, DVD-video와 같은 CD 포맷을 지원하는 파일 시스템 표준. 기존의 ISO 9660 CD 포맷은 DVD, CD-RW 등과 같은 CD에는 적당하지 않아 패킷 라이팅이라는 새로운 기술을 사용한 대체 규격으로서, 오버헤드의 낭비없이 한번에 한 파일씩 순차적으로 데이터를 읽거나 CD-RW 미디어 상의 파일의 부분 또는 전체를 삭제하는 기능이 있다. OSTA(Optical Storage Technology Association)가 개발한 ISO/IEC 13346의 서브셋이다."
"범용 레지스터, 汎用-, general purpose register",,"컴퓨터의 중앙 처리 장치(CPU) 내에 있는 레지스터 중에서 계산 결과의 임시 저장, 산술 및 논리 연산, 주소 색인 등의 여러 가지 목적으로 사용될 수 있는 레지스터. 이것은 프로그램 카운터나 명령어 레지스터와 같이 특별한 용도로 사용되는 레지스터들에 대비되는 개념이다. 많은 컴퓨터가 CPU 내에 여러 개의 범용 레지스터를 갖고 있으며 레지스터 번호로 각각을 지정한다."
"범용 마크업 언어, 汎用-言語, Generalized Markup Language, GML",,"1969년 IBM이 제안한 초기의 마크업 언어. 텍스트로 표현된 문서에 표현하고자 하는 모양이나 구조, 그리고 의미 등 추가적인 정보를 부가하기 위해 태그 형식을 사용하였다. GML을 비롯한 여러 마크업 언어들이 발전되어 국제표준화기구(ISO)는 1986년에 국제 표준 마크업 언어로서 SGML(표준 범용 문서 마크업 언어)을 채택하였다."
"범용 멀티미디어 접근, 汎用-接近, Universal Multimedia Access, UMA",,"하나의 콘텐츠를 특성과 성능이 서로 다른 다양한 단말기에서도 사용 가능하도록 제공해 주는 one-source multi-use 개념의 서비스. 디스플레이 해상도나 컬러/흑백, 프로세서 성능, 사용자 인터페이스, 이동 휴대가능 여부, 그 밖에 DTV 수신기, 개인용 컴퓨터(PC), 개인 휴대 정보 단말기(PDA), 휴대폰 등의 서비스 기종에서 사용이 가능하도록 윈래의 콘텐츠를 적절한 형태로 변환하여 제공한다. 대표적인 요소 기술로는 스케일러블 코딩(scalable coding), 트랜스 코딩(trans coding), 트랜스모딩(transmoding) 등이 있다."
"범용 명령 집합, 汎用命令集合, universal instruction set",,"범용 컴퓨터에 준비되어 있는 범용적으로 쓰이는 명령의 집합. 여기에는 ㉠부동 소수점 연산 명령, ㉡고정 소수점 연산 명령, ㉢분기 명령, ㉣저장 배치 축적, ㉤특수한 용도로 쓰이도록 설계된 컴퓨터에 쓰이는 명령이 짜 넣어져 있다."
"범용 명명 규칙, 汎用命名規則, Universal Naming Convention, UNC",,"네트워크에서 기억 장치를 명시하지 않고 컴퓨터의 공유 파일을 구분하는 방법. 윈도즈 OS, 노벨 네트웨어 등 기타 운영 체계(OS)에서 시스템 로컬 이름 대신 사용한다. 윈도즈 OS에서의 UNC 이름 형식은 \\서버명\공유명\경로\파일명으로, 여기서 공유명은 파일이 저장되어 있는 볼륨이나 저장 장치를 논리적으로 식별하는 이름이며, 경로는 없을 수도 있지만 여러 개의 서브 폴더 이름들이 나열될 수도 있다."
"범용 문자 집합, -文字-, Universal coded Character Set, UCS",,"국제 표준 ISO/IEC 10646에 정의된 2바이트의 부호화 문자 집합. 1993년 ISO/IEC JTC 1에서 국제 표준 ISO/IEC 10646-1로 채택되어, 2003년 ISO/IEC 10646으로 갱신되었다.UCS는 1개의 기본 언어판(BMP)과 16개의 보충 언어판 등 17개의 언어판으로 구성되며, 각각의 언어판은 16 비트, 즉 65,536개의 문자를 지정한다. 따라서 유니코드가 지정할 수 있는 총 문자의 수는 대행 코드 영역(Surrogates) 2,048개를 제외한 1,112,064 글자가 된다. UCS에는 ㉠옛 한글의 자모를 포함한 한글 자모 240자, ㉡한국 표준인 KSC 5601의 조합형 한글 자모 94자, ㉢한글에서 구현할 수 있는 최대 글자 수 1만 1,172자를 가나다순으로 배열해 놓은 완성형 등 3종의 한글 코드 체계가 모두 포함되어 있다. 또한, 한국, 일본, 중국, 대만에서 쓰고 있는 공통 한자에 대해서는 같은 2 바이트의 코드가 할당되어 있다. 유니코드(unicode)라고도 부른다."
"범용 미디, 汎用-, General MIDI, GM",,"로랜드(Roland)사의 미디 규격을 토대로 미디 악기의 표준으로 채택된 세계 공통의 미디 규격. 128개의 멜로디 악기와 1개의 기본 드럼 세트로 구성되고, 각 악기별 음색 간에 호환이 되도록 음색의 특징을 가지고 있다. 이에 따라 미디 음원 제조 시 이 규격을 참조하여 음원을 만들게 된다. 각 제조사별 또는 제품 모델에 따라 같은 악기의 소리가 조금씩 차이가 나지만 악기 배치가 동일하게 구성되어 GM 모드로 제작된 미디 데이터 간의 호환이 된다. 윈도에서나 게임, 악기 등에서 기본으로 지원되고 있다."
"범용 비동기화 송수신기, 汎用非同期化送受信器, Universal Asynchronous Receiver/Transmitter, UART",,"컴퓨터의 비동기 직렬 통신을 처리하는 프로그램. 보통 마이크로칩으로 실현되며, RS-232C DTE 인터페이스를 제공하여, 모뎀이나 기타 다른 직렬장치들과 통신하거나 데이터를 주고받을 수 있게 한다. UART는 병렬 데이터를 직렬 비트 스트림으로 변환, 또는 복원하고, 패리티 비트를 추가하거나 패리티를 검출, 제거하며, 비동기 통신을 위해 시작 비트와 정지 비트를 추가하고 삭제하는 기능들을 수행한다. 또한, UART 직렬 통신측의 속도와 CPU 속도에는 큰 차이가 있어 완충기(buffer)을 내장하기도 한다."
"범용 비즈니스 언어, 汎用-言語, Universal Business Language, UBL",,"확장성 마크업 언어(XML)를 기반으로 한 기업의 전자상거래용 문서 표준.국제 전자 문서 표준화 기구인 UN/CEFACT와 민간 전자상거래 표준화 기구인 OASIS의 범용 비즈니스 언어(UBL) 기술 위원회는 공동으로 XML 사전 표준화를 추진하여 2004년 5월 8개의 문서에 대한 UBL 스키마 1.0을 발표하였다. 우리나라는 2003년 12월에 UBL KRLSC(Korea Localization Subcommittee)를 설립하고 UBL 표준에 대한 번역, 적용, 확산 작업을 하였다.&nbsp;"
"범용 시뮬레이션 시스템, 汎用-, General-Purpose Simulation System, GPSS",,"①IBM사에서 개발한 시뮬레이션 프로그램 작성 언어로서 이산적 사건(discrete-event) 시뮬레이션에 가장 널리 이용되는 언어. 순서도 같은 블록의 레퍼토리를 포함하는 프로세스 지향적 언어로서, 시뮬레이션되는 모델에 대해 자발적으로 생성된 다양한 측정을 제공한다. ②대기 행렬의 이산형 시뮬레이션에 필요한 기능을 약 40개의 블록에 의한 기본적인 조작으로 조합하여 모델을 만들고, 그 모델에 대한 시뮬레이션을 실시하기 위해 특별히 설계된 프로그램 작성 언어."
"범용 어셈블리 캐시, 汎用-, Global Assembly Cache, GAC",,"응용프로그램에서 공유하도록 설치되는 어셈블리를 저장하는 전체 컴퓨터에 사용되는 캐시. 공통 언어 런타임(CLR)이 설치된 컴퓨터에는 응용프로그램에서 공유하도록 설치된 어셈블리를 저장하는 GAC 기능이 있다. 닷넷(.NET)에는 캐시와 관련한 두가지 도구가 있는데, 하나는 그래픽 사용자 인터페이스(GUI)를 사용해 캐시를 이용하는 윈도즈 셀 확장과, GAC 도구라 부르는 명령줄 도구이다."
"범용 언어, 汎用言語, general purpose language",,특수한 기능만 수행하도록 만들어진 것이 아니라 여러 가지 유형의 문제를 포괄적으로 해결할 수 있도록 고안된 언어.
"범용 운용 프로그램, 汎用運用-, general purpose operating program",,"입출력 조작, 원격 자료 전송, 다른 체제를 이용하는 다수의 사용자 등을 제어하기 위한 계획이나 명령어들. 이 제어 프로그램은 모든 사용자가 이용하므로 보통 컴퓨터 제작자가 만들어 무료로 제공하며, 운영 체계, 실행 체제, 입출력 체계 등으로 불리기도 한다."
"범용 원격 제어 통신, 汎用遠隔制御通信, Universal Remote Console Communication, URCC",,"가전제품을 원격으로 제어하는 표준 규격. 텔레비전, 비디오 녹화기, 스테레오, 에어컨, 기타 전자 제어 및 표시 장치에 대하여 전용 장치나 랩톱 컴퓨터, 개인 휴대 정보 단말기(PDA), 통신 보조 장치 등을 통하여 원격 제어하는 규격으로 적외선, 무선 전파를 주로 이용한다."
"범용 이동 통신 시스템, 汎用移動通信-, Universal Mobile Telecommunications System, UMTS",,"셀룰러 방식의 이동 전화, 코드 없는 전화(cordless telephone), 무선 랜(wireless LAN) 및 무선 호출 등 다양한 이동 통신 기술이 결합된 3세대(3G) 이동 통신 기술. 국제 이동통신 표준화 기구인 3GPP(3rd Generation Partnership Project)에서 표준화하였으며, 이용자의 위치(환경)와 시스템의 용량에 따라서 데이터 전송 속도에만 제한이 있을 뿐 장소에는 아무런 제한 없이 동일한 종류의 서비스를 제공하는 것을 목적으로 하였다. GSM(Global System for Mobile Communications) 망에 기반을 두고 부호 분할 다중 접속(CDMA), 멀티미디어 등 신기술을 결합하고 혼합 셀 구조를 실현하여 최고 2Mbps의 전송 속도를 제공한다."
"범용 인공 지능, 汎用人工知能, Artificial General Intelligence, AGI",,"특정 문제뿐 아니라 주어진 모든 상황에서 생각과 학습을 하고 창작할 수 있는 능력이 있는 인공 지능 또는 이에 대한 연구. 인공 지능 연구의 궁극적 목표 중 하나이다. 현재 인공 지능 연구는 음성 인식, 바둑 등 특정한 문제에 대해서는 좋은 성과를 보이고 있으나, 아직 사람과 같은 지능을 갖추지는 못하고 있다. 예를 들어, 사람과 대화하며 동시에 바둑도 둘 수 있는 인공 지능 에이전트는 아직 개발되지 못하였다. 이와 같이 특정 문제만을 해결할 수 있는 인공 지능을 좁은 인공 지능(ANI: Artificial Narrow Intelligence)이라 한다. AI에 대한 철학 가설로 약 인공 지능(weak AI)과 강 인공 지능(strong AI) 가설이 있다. 약 인공 지능은 인공 지능 컴퓨터가 실제 지능이 있는 것이 아니라 지능이 있는 것처럼 보일 뿐이라는 가설이며, 강 인공 지능은 인공 지능 컴퓨터가 실제로 지능이 있다고 보는 가설이다. 강 인공 지능 가설이 참임을 검증할 수 있는 컴퓨터를 강 인공 지능 컴퓨터라고 한다. 일부 인공 지능 연구자들은 특정한 문제를 해결하기 위한 컴퓨터 프로그램을 개발하는 것도 중요하지만, 진짜 사람 수준의 인공 지능을 연구하는 것이 더 중요하다는 주장을 하고 있다."
